reviewText,overall
"Very nice keyboard. Yes, you can get cheaper one, but this is guaranteed not to wear off paint off the keys. Love the ability to chose the color. Keys provide good amount of feedback and don't feel too mushy.

Other components (This is about $1000 build) - feel free to copy for your build:
1.&nbsp;<a data-hook=""product-link-linked"" class=""a-link-normal"" href=""/Intel-Core-i5-4670K-Quad-Core-Desktop-Processor-3-4-GHZ-6-MB-Cache-BX80646I54670K/dp/B00CO8TBOW/ref=cm_cr_arp_d_rvw_txt?ie=UTF8"">Intel Core i5-4670K Quad-Core Desktop Processor 3.4 GHZ 6 MB Cache - BX80646I54670K</a>
2.&nbsp;<a data-hook=""product-link-linked"" class=""a-link-normal"" href=""/Cooler-Master-HAF-922-Mid-Tower-Computer-Case-with-High-Airflow-and-USB-3-0/dp/B0026FCI2U/ref=cm_cr_arp_d_rvw_txt?ie=UTF8"">Cooler Master HAF 922 - Mid Tower Computer Case with High Airflow and USB 3.0</a>
3.&nbsp;<a data-hook=""product-link-linked"" class=""a-link-normal"" href=""/8GB-G-Skill-DDR3-PC3-12800-1600MHz-Ripjaw-Series-9-9-9-24-Dual-Channel-kit-F3-12800CL9D-8GBRL/dp/B00339X1EM/ref=cm_cr_arp_d_rvw_txt?ie=UTF8"">8GB G.Skill DDR3 PC3-12800 1600MHz Ripjaw Series (9-9-9-24) Dual Channel kit F3-12800CL9D-8GBRL</a>
4.&nbsp;<a data-hook=""product-link-linked"" class=""a-link-normal"" href=""/Gigabyte-GTX-760-GDDR5-2GB-2xDVI-HDMI-DP-OC-WINDFORCE-3X-Graphics-Cards-GV-N760OC-2GD-REV2-0/dp/B00DGM8B6O/ref=cm_cr_arp_d_rvw_txt?ie=UTF8"">Gigabyte GTX 760 GDDR5-2GB 2xDVI/HDMI/DP OC WINDFORCE 3X Graphics Cards GV-N760OC-2GD REV2.0</a>
5.&nbsp;<a data-hook=""product-link-linked"" class=""a-link-normal"" href=""/Samsung-840-Series-2-5-inch-120GB-SATA-III-internal-Solid-State-Drive-SSD-MZ-7TD120BW/dp/B009NHAF06/ref=cm_cr_arp_d_rvw_txt?ie=UTF8"">Samsung 840 Series 2.5 inch 120GB SATA III internal Solid State Drive (SSD) MZ-7TD120BW</a>
6.&nbsp;<a data-hook=""product-link-linked"" class=""a-link-normal"" href=""/Corsair-Builder-Series-CX-600-Watt-ATX-EPS-80-PLUS-CX600/dp/B0092ML0OC/ref=cm_cr_arp_d_rvw_txt?ie=UTF8"">Corsair Builder Series CX 600 Watt ATX/EPS  80 PLUS (CX600)</a>
7.&nbsp;<a data-hook=""product-link-linked"" class=""a-link-normal"" href=""/Asus-24x-DVD-RW-Serial-ATA-Internal-OEM-Optical-Drive-DRW-24B1ST-Black/dp/B0033Z2BAQ/ref=cm_cr_arp_d_rvw_txt?ie=UTF8"">Asus 24x DVD-RW Serial-ATA Internal OEM Optical Drive DRW-24B1ST (Black)</a>
8.&nbsp;<a data-hook=""product-link-linked"" class=""a-link-normal"" href=""/Twisted-Gamer-Sinister-Arch-FPS-MMO-Ergonomic-Gaming-Mouse-With-Adjustable-DPI-Button-and-2-insert-able-Weights-Noob-Friendly/dp/B00BE52TIQ/ref=cm_cr_arp_d_rvw_txt?ie=UTF8"">Twisted Gamer - Sinister Arch FPS/MMO Ergonomic Gaming Mouse, With Adjustable DPI Button, and 2 insert-able Weights. (Noob Friendly)</a>
9.&nbsp;<a data-hook=""product-link-linked"" class=""a-link-normal"" href=""/MSI-Computer-Corp-Motherboard-ATX-DDR3-1333-LGA-1150-Motherboards-Z87-G41-PC-MATE/dp/B00D12OBEA/ref=cm_cr_arp_d_rvw_txt?ie=UTF8"">MSI Computer Corp. Motherboard ATX DDR3 1333 LGA 1150 Motherboards Z87-G41 PC MATE</a>",5.0
"I loved this game, and I have played several Adventure Games.  It has the right amount of everything.  You get interaction with characters.  Puzzels, hunting for clues and putting items together.  Story is very well played out, and the spooky factor gives it plenty of interest all the way thru.  Would recommend this game to anyone.",5.0
"No DLC, No Clan Name Registry, No pre-order bonus, Wii u owners treated like second class citizens, yet they still charge full $60 price tag. That just isn't right on so many levels. There is no reason why this could not lower the price to $50 or $40 for the Wii U version since it's so crippled. If they want Nintendo owners to support Activision and other 3rd party developers, you have to treat them fairly and give them value for their hard earned money. Don't charge top dollar for an inferior product. Some companies recognize this a do something about it. When Batman Arkham Origins was released on the WIi u, it did not have online multiplayer, so what did they do? They sold it at $50 instead of $60 and Amazon did the awesome deed of offering an additional $10 Amazon credit for all pre-orders of the Wii u version. That was totally great and fair price at only $40 for the game. I applaud them for doing it since they didn't really need to do it. I wanted to get this game because I really enjoyed Black Ops II on the Wii u, but until the price decreases to a more fair amount and Wii U owners are treated more equally, I will find other entertainment.

Update: Recently got Call of Duty Ghosts for only $40 on Amazon, nice Black Friday deal. The game is much better than expected. Certainly very happy they decided to bring the game to Wii U. Graphics and gameplay are very engaging and fun. Controls feel better than Call of Duty Black ops II. Overall, this is an improvement from all other Call of Duty games. I would recommend for all Wii U owners.",5.0
Works great on my controller.,5.0
"Could not wait to get this ever since I saw it was coming out.  Both my kids are avid Basketball players and thought this would really be fun and improve their game.  I can already tell it will. You have to dribble with your head up...100% of the time, look down and your are going to miss something.  I am also VERY impressed with the Kinects ability to tell which hand you are dribbling with, and don't even try to get away with trying to fool the Kinect into believing your crossover was a behind the back dribble...it knows!  The Kinect can tell if you are doing the trick correctly almost 100% of the time.

The game has 3 difficulties (rookie, pro and baller) and you try to time your dribble to the beat with either your right or left hand.  Staggered throughout there are also 'tricks' in between dribble beats that you must perform to get multipliers.  The tricks on rookie are limited to crossovers/around the world,dribble under leg/pump fake and side pass.  Rookie mode is a great warmup, I find Pro to be quite challenging and fun.  There are 30ish tracks and none available yet for download, but I hope some are coming soon.  As long as new tracks keep coming, this game will be in heavy rotation in our house!

FYI- the ball they give you is not ideal, very 'bouncy' and difficult to control.  I thought the ball originally had some sensor or something, but actually you can use any ball.  We use my son's evolution ball and it works great, but any ball would do.",5.0
"Fits my Pokemon X/Y Limited Edition 3DS nicely. Comes with 3 pockets to store your games in and 2 straps to, well, strap in your 3DS so it doesn't fall out. Just be careful around liquid materials because the case can get stained easily. Recommended for all 3DS owners.",5.0
"It is what it is, 60 days of time.",5.0
"Nintendo knows how to make fun games, plain and simple. They do it with a consistency and a playful attitude. Super Mario Galaxy is an exemplar of this approach.

It incorporates various innovative ideas centered around the idea of hopping between planets, each with its own gravitational field (we as human beings are still trying to figure out how gravity actually works but just go with it for the game (: ). This is one of the more fun games I've played over the past few years. I highly recommend it.",5.0
"Actually a really good CoD. Best one since MW3 in my opinion.
The campaign is really really well made and the multiplayer is honestly really fun and rewarding once you get the hang of it.
It has some of the best gun balancing and the variants make for an exciting supply drop system.
Zombies in spaceland is fun and refreshing
Give it a try an don't listen to all the people that trashed it without even playing it.",5.0
Excellent product,5.0
Great Quality !,5.0
muy buen vendedor me llego todo a tiempo  y en mu buen estado le doy el maximo puntaje al vendedor,5.0
This game is awesome! This works flawlessly on multiplayer and single player on my PC. The only complaint I have is that there aren't enough players! Usually there is only a few servers that have people in them sadly. But the single-player is awesome as usual.,5.0
"I've been on a DS binge lately and bought this game at the same time I bought&nbsp;<a data-hook=""product-link-linked"" class=""a-link-normal"" href=""/Last-Window-Secret-of-Cape-West-UK-Import/dp/B003Y73B2U/ref=cm_cr_arp_d_rvw_txt?ie=UTF8"">Last Window: Secret of Cape West (UK Import)</a>&nbsp;and&nbsp;<a data-hook=""product-link-linked"" class=""a-link-normal"" href=""/Jake-Hunter-Detective-Story-Memories-of-the-Past/dp/B001URRGZO/ref=cm_cr_arp_d_rvw_txt?ie=UTF8"">Jake Hunter Detective Story: Memories of the Past</a>. I haven't played Jake Hunter but I started Ghost Trick right after playing Last Window - two very different mystery stories indeed!

In Ghost Trick, you're desperately seeking clues to your identity before the sun comes up and ends your existence forever - but around every bend is some damn fool getting killed that needs your help, and it quickly becomes apparently that you are going to help these recently departed if you ever want to find out the secrets of your past!

Ghost Trick is very much a spiritual (no pun intended) successor to the Ace Attorney series by the same creator. Quirky characters with spiky hair, high-energy females who love to eat, and a little bit of the super natural tossed in with a rousing mystery at the bottom of it all - this game will really have you hooked! The Ghost Trick puzzle mechanics are a really refreshing type of puzzle, and the story is engaging enough to keep you at it no matter what. Another addictive series, but unfortunately it seems to be only a ""stand-alone"" story line that will keep you guessing until the very end. The first thing I said at the end was ""WHAT THE *BLEEEP*?!?"" immediately followed by ""YOU GOTTA PLAY THIS GAME!!!"" to anyone who would listen! Pick it up now!!",5.0
Very cool rail shooter. This is probably the best game I've played on WII yet. If you have ''young'' children then language dialogue might be an issue during gameplay; this can most likely be muted in the options menu.,5.0
good,5.0
"This game is just so intresting game to play. Loving the disney characters and a fanatic for the final fantasy series especially FF7. Seeing Cloud in this game was SOOOOOOO..........Cool. Playing as Sora, You travel through the worlds of Disney Characters. Sure the fighting may have gotten a little annoying but you quickly forget about it once you are on your way to the new world you are about go to. Overall, the graphics were SWEET, storyline even better, and the voices along with the intresting atmosphere really made this a great game that should be all gaming collections.

Highly recommended:)",5.0
"I recently purchased an xbox one, and this was one of my initial purchases. Needless to say, I was not disappointed in the least. An open-world zombie game where the player can actually mow through the zombies rather than getting subdued by one or two weak ones. DR3 is the zombie game we as gamers need AND deserve. I bought Dying Light and returned it, and was very let-down. I bought DR3 and have not had one moment of disappointment. The graphics, weapons, sounds, and comic content are all great. This is a must-have title for zombie fans and for those looking for a great title to enjoy.",5.0
"Pros:
Smooth UI/Menu navigation.  Good graphics.  Great story.  Just about endless gameplay (even after you beat the main game and end game).  Very easy to beat if you understand some simple strategies that this game requires.  And it puts a major emphasis on force multiplication rather than simply mindlessly wiping out the opposition.  AI is pretty impressive towards the end of the game.

Cons:
Has one sick part in the end that Kojima would probably describe as a ""necessary evil"".
Also, some button action options and MB coins.

This game is pretty much the culmination of what made all the other MGS games great.  If you like any of the previous MGS games, there's something in here for you.

What I didn't like about the game was the way that there doesn't seem to be a predictive button action feature.  Something that would learn your patterns when there are multiple interactions available in the same geographic location such as having the choice to Fulton extract an enemy, or pick up his weapon because both are in the same spot.  This makes it so that you have to restrain from pushing and holding the button until the screen displays the option you're sure you want to enact.

Something else (which is inherently greedy) is the MB coin aspect. Why pay actual money to speed up the FOB component of the game?  And once you enable the FOBs, GMP is divided and shared, and in a way that pushes you to want to advance the online parts more than the actual side ops.  The result is that you either have to wait patiently for more daily free MB coins, or you have to fork out some cold hard real world cash to Konami.

Still, this game is very easy, very fun, and very well done.  I'm now looking forward to what Kojima does next (Death Stranding), however, I don't know that I'll want to play MGS Survive since it has a high likelihood of showing even more of Konami's greed for users to purchase MB coins and other nonsense.

If MGS Sruvive ends up being a well-made game, then I'll be all for it.

Also, I didn't use it for the main game (I use it sometimes to get quick inventory when I need supplies), but there is a ""chicken hat"" feature for those of you who think this game is too difficult.  It's basically a funny way to rush through stocking up if you don't feel like wasting too much time sneaking around.  I definitely DON'T recommend using that hat for the main two game parts (unless you're completely new to this franchise and want to learn the ropes).

But once you figure out the psychological aspect to the way these games work, it'll become a lot easier for your muscle memory to kick in and speed through the game in a very enjoyable way.  You can even get the opposition so scared that they'll run from you.

It's definitely not a shooter anywhere near as much as it is about puting some thought into your actions.  If you prefer to just point and shoot, then buy something else.  If you like having to outsmart the opposition while also thinking several moves ahead of the game by carrying out things like sabotage detonations when you're exfiltrating an area, and also stealing enemy supplies, then this game is definitely for you!  It remembers enemy utilities that you've previously destroyed.  Sometimes those utilities are replaced, but going in ahead of time to sabotage an enemy base can make earning an ""S"" rank on primary missions a lot easier.  It's one of my all time favorite games.

Also, if the game says to destroy enemy vehicles, just Fulton extract them instead.  It'll help you in the long run.

This game definitely isn't for most people, but ever since the first MGS, I've been hooked.  Kojima made sure that each iteration of MGS was more intuitive, had better graphics, and utilized system resources more effectively.  Here's to hoping the team at Konami keeps with this tradition when making future MGS games.",5.0
"Fast shipping, and very reliable!",5.0
I love pretty much every wrestling game WWE has put out since WWF Warzone in the mid 90's and this one is as good as any of them.,5.0
my son loved it,5.0
Great game,5.0
"the progression rate was perfect. I spent a lot of the early game running for my life, but by the end I was walking into fortresses with my sword drawn ready for anything! Very fun platinum!",5.0
"GRAPHICS ARE SUPERB
I LOVE THE STORY TELLING
SOUND EFFECTS ARE AWESOME
MUSIC IS AWESOME
GAMEPLAY IS AWESOME
MULTIPLAYER IS ADDICTING
GET THIS GAME NOW!!!!!",5.0
Best Need for Speed to date. 60 fps looks fantastic!,5.0
At first you will be very bored with the game becuase it does not start with action no sword no sheild nothing just random quests and it did not pull me in but I knew if I could get past that it would be good and it is wonderful.,5.0
"Good art book, good sound track and a good game!",5.0
Bought for my kids. They play it all the time. AWESOME game. And kirby is a hungry little fella. Your kids will love this game.,5.0
simply awesome,5.0
great game,5.0
"Marvel has had a lot of success in the video game industry, and a lot of failures too. I'm a big Marvel fan, and what I can say about this game is that it's the best damn Marvel game you're gonna play. Of course, I don't expect you to be a fan of ALL of the characters in this game. I haven't even heard of a lot of the characters in this game, especially the cheesy enemies. But you can really learn a lot about the Marvel Universe just by listening to the dialogue and learning from your mistakes in the trivia. I've learned a lot about all of the different characters after beating the game. Now I can understand the segment in Robot Chicken about the Watcher. It is VERY fun to play with more than one person, because you can team up with the computer or just stick to two/three people, or even play with FOUR people. Marvel fan or not, this game is way too awesome not to own. I can't wait for the second one, and if you're reading this when Ultimate Alliance 2 already came out, then I definitely have it!",5.0
"The characters, plot, mechanics, everything is perfect about this game. Unlike the sequel, this game thrusts the player into a sense of grave urgency -- the world is about to end, and it is up to the player to stop that from happening. The side quests and romances make this game all the more enjoyable.",5.0
"I have played this game since it came out when I was 4, and it has never gotten stale. The graphics are wonderful for this era of game, and actually are comparable to some of current times.
Whether you are a die-hard Spyro fan and just missed out on this game, or you just heard of the series and are looking for an ideal game for yourself or as a gift to another video gamer, I highly recommend this game. As a child I enjoyed the colors, sounds, and smooth gameplay; as a young adult, it is fun to challenge myself to completing the game. The replay value is pretty high, in my humble opinion; I've completed this game numerous times and still play again, and again. This is one of the three Spyro games I've found to be truly enjoyable (the first, Spyro the Dragon, and the third, Spyro: Year of the Dragon, are the other two - all of which make up the Spyro trilogy for the PS1), as the later games just don't meet the bar of excellence these three games meet.
Whether a seasoned video game player or someone looking for a great gift, Ripto's Rage will deliver.
Game play is not difficult for younger players, and there are many bonus challenges and interesting goodies thrown in for the more advanced players. Boring is an adjective that cannot be used for this installment to that lovable purple dragon's series.",5.0
"I love this item. It shows wear from it being a used item, but it works wonderfully. Ordering a new face plate is easy (see fresh plate applied in picture with case). Great battery life and ULTIMATE portability.

Buy one if your a GBA fanatic.",5.0
Gears of War is just so fun to play. There is lots of action in this game. I think it is one of the best games for the Xbox 360 so far and it's also one of the best third person shooters out there. The game is so intense and it feels like you are in the battle. If you have liked playing halo you'll love Gears of War.,5.0
I love it. The single player history was excellent. But i didn't like the change done on the multiplayer because they obligate youto buy the map pack to play in multiplayer.,5.0
the game was great and loved the graphics and the sword fighting was amazing. the nemesis system when they remembered you after you'd fought them before. great affects to the game. even if your not a fan of lord of the rings this is still a great game to own. excellent for all gamers who like adventure in their games. thumbs up!,5.0
I like playing star wars battlefront it's pretty good game I wish they had it for Xbox 360 it be better playing it online with other players.,5.0
"Yes the game feels like roaming in paradise. It is a great beauty. Controls are perfect. Every aspect of the game is implemented with so much care, bar for racing/action games is raised to a new high.

The new crash mode is one of the two best improvements. If you plan carefully and with a bit of luck you can crash for a half-hour stretch. Second thing is online. Ooo hoo. You can be online do what ever you want to do as you do in your single player campaign or just go on a head on crash or race each other. So much variety. Content wise this game is huge, it will take couple months to try out every thing.

First must by title of 2008. The new online lobby system, camera integration, wide open world racing etc. etc. So much innovation has gone into one game. We need more pioneering games like this. Hat's off to Criterion.",5.0
Great item for collectors and south park fans alike. the cartman statue is a great size for displaying.,5.0
Works well. No complaints. Would buy again. In fact this is the second one I DID buy as my son is using the other.,5.0
"I enjoyed the game very much, good graphics, puzzles were very challenging and fun. I would buy other games from this vendor",5.0
"This game is all I hoped it would be. I wanted some new challenges but also some of the old features as well. This game does it. There are old courses from the DS, SNES, and Game Cube, and some new ones as well. Old features that were missing from Double Dash were added (like trailing an item) and new ones were added (like the ability to do flips after a jump). An overall great game.",5.0
Many Wii games require the Nunchuk controller so I ordered two. These items came quickly and are very easy to use. Still working great!,5.0
Great game.. LOVE IT.. Bought all 3.. well worth the money.. Tho make me feel a little old remember waiting at the door for hours waiting to the store to open so i can get it with my mom..  a MUST buy,5.0
Works perfectly,5.0
Great game!  Love this series.,5.0
"While the ending was weak, and this is an ancient PC console port by now, the game itself is still fun. TR4 - The Last Revelation has the honor of being one of the few TR games that is set in essentially one location (Egypt). This allows the developers to really have fun with the environments and create a unified experience with unique puzzles that other TR games still haven't matched (rotating tube room, anyone?).

Besides TR2, this is the second best TR game in the early series (1-5), and you owe it to yourself to play this game.",5.0
"The cable works great. Sharp, smooth, and clear. However, I wish they just included it along with the PS3. Most televisions offer this by default. The Xbox 360 came with one, why doesn't the PS3? Same with HDMI. But hey, as long as it works it's fine I guess.",5.0
"Thanks so much for the item, im so happy with it and hope to get more item later. appreciate it.",5.0
excellent product I recommend very good ..,5.0
"Great Upgrade from Madden 25, Feels more like I'm playing in a real game, Madden 15 Challenges you more than 25.
I think the graphics are a little better and I love knowing the knowledge of the game, and it teaches everyone with the skills challenges.
Offense is great in this game, You just can't score 60 points a game like you could on 25 and when you score if feels more rewarding. You have to put more touch on the ball when passing, You cant just throw bullets or they will be intercepted.
Defense is the biggest upgrade from 25 to 15, Playing defense is fun and the hits and the pass rush are better than 25. Playing defense in 25 just seemed worthless.",5.0
"Reviewed for Big Boss Games By: TRC

Tales of Phantasia is a tale of the past, present and the future.

For the first time in the USA, Tales of Phantasia is gracing our shores with a quest of revenge and time travel. This is the first installment of the ""Tales of ..."" series from Namco.

You start out as Cress, a young boy, and his friend go on a hunting trip, only to find that when they get back that their town is in ruins and everyone is dead.

This game has been the most fun I have ever had with GBA system. Tales of Phantasia has enough action and adventure to keep you glued to your GBA for 70+ hours.

The battle system takes some getting used to. You must assign your special attacks to certain button combinations, for instance: up, down, left or right plus B or B by itself will perform the special attack that you have assigned.

You can assign the same move to all the button combos if you want to. For standard attacks you will press up, down, left or right plus the A button or the A button by itself.

You can stop the action in the middle of an attack to give your team orders. Like you notice that you are almost dead, so you stop the action to tell your healer to cast a spell that heals your wounds.

Scores:
Graphics - They are great for the GBA, 8/10.

Sound and Music - The voice acting in the beginning of the game hooked me in for the long haul 70+ hours of musical bliss, 8/10.

Gameplay ? Battle system is perfect. Puzzles were tough enough for you to rejoice after you figured them out, 10/10.

Overall ? The most enjoyable game to grace my GBA, 10/10. Perfect score! Run don?t walk to get this game.",5.0
"I check this site almost hourly waiting for a pre-order, and still no luck.  Wish we could design our own packages.  I already have the Star Wars item on order, and would prefer more controllers.  It will definitely be worth the wait.  I purchased both the SNES and N64, on their release dates for 199.99, only to have the price drop several months later.",5.0
