reviewText,overall
"I got this game because I've always been curious about it and could never afford it when I was younger. It satisfied my curiosity but I won't be spending much time playing it.
Sadly instead of keeping the controls the same like Street Fighter did on the GBA by using the triggers for heavy kicks and punches, it used the triggers for grabs and mixes left and right kicks into a single button as well as combining left and right punches into a single button. This just about ruins the game.
I was impressed that they pretty kept the exact same engine as Tekken 3 on PSX, just lowering the graphics and frame-rate a lot. If they had just kept the controls the same, this could've still been a great game that would've been very similar to Tekken 3.",4.0
"I don't think it's genuine Nintendo product, i can't see any markings.
The control stick has some play to it.
But it works and if fine for now.",4.0
"Final Fantasy:

The Good -- This version of the game is fun. My wife and I had a blast playing and even leveling up (which, on the easy setting, wasn't often). The fights, dungeons, and boss encounters excited us to want to stay up a few extra hours to keep the game going.

The Bad -- The main characters have no pre-set character. My wife and I named each of the four and gave them our own backstories and such. While having no restrictions was freeing, I wondered why the heroes would even want to do good other than for goodness's sake, which is lame, but not enough to not recommend this game.

The Ugly -- I knew how to play only because I played the Nintendo original way back in the day. That was 20 years ago. I forgot a lot and even with the in-game clues, I was sometimes lost. Playing with a walkthrough helped immensely. A good game wouldn't need an external, unofficial aid. Using one felt like cheating, but was necessary at certain point because I had no idea where to go or what to do next. Just one blemish on a very good game.

Final Fantasy II:

The Good -- This game has a much more elaborate storyline than its predecessor. The characters are pretty one-note, but at least they have character.

The monsters are unique, surreal, and quite disturbing. That's where the Final Fantasy series shines, in its bestiary. I didn't cringe whenever I had a random encounter because I wanted to see what creep (or band of creeps) I'd have to fight. No, I cringed for an entirely different reason . . . .

The Bad -- Let's just skip to

The Ugly -- Final Fantasy II is unplayable due to its convoluted and not fun leveling system. In most Final Fantasy games, leveling the characters up is simple: just fight enemies. Here, you have to hone a particular skill. For instance, if you want someone to be proficient in using an ax in battle, they have to use an ax in battle . . . over and over and over. Magic users have it worse as they have to use their spells (which cost Magic Points) over and over to make them stronger.

This system allows a cheat of sorts, but the cheat is a time-drain that does nothing to inspire me to continue playing. I quit and have no desire to ever pick this up again.",4.0
"First let me say that this is one of the best golf games you can buy for the PC.  If you don't have any other TW title and money isn't the deciding factor then this is the one to get.  If you do have some of the more recent titles you may want to sit this title out.  If you are looking to enter into the TW universe and money is a factor you would probably be better off picking up 06 or 07 as the last three incarnations have been very similar and previous versions can be picked up at a much cheaper price.

For those that have some of the more recent PC versions of TW... they have made slight improvements over previous versions but I'd be hard pressed to say that they are anything that warrants buying it at the current full retail price. In some ways this is a good thing.  They didn't ""fix"" anything that wasn't broken.  Oh the other hand they didn't do much to merit the full retail price of a new game either. They've mixed up the presentation of the scenarios a bit this year but it really amounts to the same scenarios of the last 2 or 3 versions of the game.

I believe it was 05 when they had the scenarios separate from playing the legends (which were arranged in a pyramid).  The next version still had both but they were mixed together. Things really haven't changed since the version where they mixed them together... it's just that they update it with a new interface each year. One year it was time travel. This year it's a honeycomb.

The graphics have improved a bit but following in Maddens footsteps EA didn't take the PC version of the game to the next generation's level.  My now somewhat dated PC can still run the game quite smoothly so I can only assume that they are doing this to ensure that those of us with older computers can still play the game.  I guess I have somewhat mixed feelings on this.  It would be nice to have next gen graphics but not at the expense of not being able to play it without massive upgrades.  It seems like they could have developed it with paths for older systems to run it at reduced levels while giving those with better rigs the ability to take it to the next level.

I haven't noticed any difference in the game face character design going on a 3rd year now. I don't think they've even so much as added a new hair style or single piece of extra clothing.  I haven't seen the new feature that allows you to import your face yet.  I believe it is absent from the PC version.  That and the absence of next generation graphics may push many to opt for getting one of the console versions of this game.

Experience points develop your attributes using the same system as '07.

Sad to say that the commentary is the exact same as the previous 3 or 4 years. ""You've gotta be happy with that birdie, you've got to be happy with any birdie"" ""What do you see? I see a straight shot, 150 yards to the hole, and I see dead people"" (yes, they've probably been doing that one since the movie came out in '99).  It's pretty bad when they don't even update the commentary parts that date it to a movie that came out 8 years ago.

They've changed the on course HUD to match the game's honeycomb motif. One improvement that I did like was the honeycomb that is dedicated to telling you the current distance that your club will hit the ball. In previous versions you had to mouse over the club selection, adjust your shot, re-mouse over the club selection to see what your adjustment did, and repeat until you got it right. Now when you adjust your shot the distance is updated right on the screen. No more back and forth.  This is the only feature that really made an improvement on the game for me.

The other new feature is the confidence meter.  I haven't found it to be very useful.  The HUD seems to be just as touchy as it has been in previous years.  When using the click golf swing method you have to take extreme care to make sure you don't accidentally initiate your golf swing when doing things like changing clubs, adjusting your shot, or changing the shot type.

You also have the ability to jump right into the FedEx playoff.  That didn't appeal to me too much since you play tournaments all the time in PGA mode.  It didn't really add to the game.

This is a fun game for me.  For those that haven't experienced TW, pick it up.  For those that have you'd probably be better off waiting for a price drop.  If next gen graphics are your thing, definitely go with one of the console versions.",4.0
"This is great for FPS games,  but rather pointless with other games.  It is s bit finicky to get working correctly at times.  In several FPS games I've played, it is a nice boost to have footsteps and reload sounds boosted and easily audible.  I tried it with a cheaper headset and I can still hear the sounds, but lost the ability to tell direction.  Overall, if you play FPS games and have a higher end headset, this is a handy item.  If you play other games or have a lesser headset, I'd suggest you don't waste the money.",4.0
"this game falls inline with the rest of the Ghost series. its kind of Exactly like Ghost Recon 2 for the original xbox. if you liked that game then you should like this one as well. im not much for the Campaign mode, i play online...and THATS a blast to play as well rather your competing with other players or on a team with them doing a Co-op. rather THIS or any of them are better than the Very First Ghost Recon...i cant say lol they're all pretty much the same...and tend to get alittle boring like every other game..but still great fun while it lasts..

iLL .",4.0
Good call of duty but not the best.,4.0
This is a really cool game. Totally unique. The only con I have is that you can't shoot while you drive. But it's a good game and there are a ton of side missions so it will take a while to complete everything and beat the game.,4.0
"I watched my brother and his wife play this game, I have not played it yet, but it looks like a good game.",4.0
"If you like boho fashion this is the pack for you, has some great items, not much movie stuff tho, popcorn maker and a new screen tv with movie options.",4.0
"Ok I did not like the fact that we had to play the game solo to earn multiplayer, but at least there is a multiplayer option. Racing games are no fun alone or on line only. SO I love the game simply beccause i can race people in my house.",4.0
It's good,4.0
"I stumbled upon syberia II 5-6 years after playing part 1. It was both good and weird to meet with the game`s characters after all this time...the game bought good closure to the first part, but I must say the puzzles were less satisfying than part I in particular the final music puzzle was totally unnecessary. Enjoyable game overall",4.0
"In the shadow of the overhyped big released like Gears 2 and the not as good as the original Resistance 2, this game is a great find. It has great gameplay, sharp HD graphics, and a great story. The monters really scare you and are really intelligent, they will find and hunt you down unless you fight back. The opening scene is one on the best I have seen in modern video games. Ignore the bad reviews this game gets, it is great and you will not be disappointed.",4.0
"This is a fantastic game with many revolutionary changes never before seen in video games.  The most obvious is the advanced face recognition software that was used to capture even the slightest facial movements for you to determine if the suspect is lying or telling the truth.  I love how the game is broken up into separate cases, but in addition, there's also a contection from one case to another, adding another layer to victims who have similar M.O.'s.  The details in every clue become very important.  And all of these factors are thanks to the advancements in graphics and HD gaming.

The mini-cases add a little variety so it's not soley one case at a time.  Just like a GTA game, you can enter any car you want and say it's for ""police business"" but doing this too much will take away from your intergrity.

Though I haven't completed the game yet, I'm worried that the cases are still too easy.  The notebook your character keeps organizes the clues for you, but almost too well.  It doesn't really leave much room for you to do anything thinking on your own.  And even if you completely botch an interview, you'll still figure out who the suspect is because they're the one running away.  It would have been nice to have different difficulty levels to add more of a challenge for those who wanted it.

Perhaps the game's biggest flaw is its lack of replay value.  Your only motivation to go back and re-play a case is to try and get more questions right to get more stars.  But after the criminal is behind bars, why would you?  Understandably, it's hard to make a game like this that could be replayed since all the clues are pointing to one person in particular.

Of course, the game is not without flaws, but the 40's LA feel (complete with music), graphics, and game play still make it very enjoyable and completely different than most other games on the market.  My hope is that Rockstar will add on to this amazing start and we'll soon see additions similar to what they did with GTA IV.

UPDATE - 5/3/12

Now that I've completed the game and the retail price has been reduced, I thought I'd come back and add to my first review.  I'll agree with most reviews in that cases are repeatative, the outcome of a case doesn't change the story at all, and now that the game is beat, it sits on my shelf unplayed.  When I first played this game, I had it on the ""easy"" mode where the controller shakes when you're near a clue and the music changes when you've found them all.  This makes the game extremely easy, but I wonder how difficult it would have been without this support.  However, now that the price has been reduced to $20, I think it may be worth your money.  I think my initial review (and perhaps some of the others out there) would be very different if I hadn't bought it so soon at full price.  I think when you consider the price, the value is now worth it.",4.0
"I sent back my Strafe for this. I prefer it 2X as much.

Pros:

Multimedia buttons
Volume scroller

Neutral:

No function keys
Two USB's required to power this
No spill resistance
No USB for a mouse
The price

Cons:

The logo
Keys aren't fully lit",4.0
Really easy to beat. Did it in about 3 days just playing a little at a time. Graphics were good.,4.0
"A rather controversial game for those who are fans of the previous Devil May Cry games. Personally, I do have a few minor issues with it, but the game play and graphics are excellent.",4.0
"Diablo 3 was over-hyped and did not live up to D2 mainly because it lacked the pvp and had no goal past endless grinding for gear and loot but still there is something about the game that makes it enjoyable to play for hours, If you buy the game do it knowing you are buying a game with a diablo theme and story, not its gameplay.",4.0
"Nice fps western much better than GUN, at this point the game should be able to be purchased for no more than 7 bucks and at that price is well worth it",4.0
"pros:
graphics
intuitive cover mechanics
excellent controls
beautiful set pieces
story
voice acting
great pacing

cons:
cliched supporting cast
trial and error QTE's
useless RPG style leveling up
puzzles too easy
poor character development
game freezes
framerate drops
only 25% fighting
no bonus for game completion

after playing for an hour, the framerate dropped massively playing on my ps3 super slim; then got glitchy and finally would freeze after couple of hours. it was jarring to see lara becoming a skilled assassin instantly when only moments before she was a scared inexperienced young woman. i finished the game at 99% completion first playthrough on normal difficulty. second playthrough on hard without upgrading a single skill or weapon was more enjoyable, albeit more challenging (shanty town battles were crazy). after completing the single player, you're not rewarded with infinite ammo nor a NEW GAME+; not even new outfits or other cool unlockables. ""you want new outfits? show me the money! you want other useless items? show me the money!"" despite it's noticeable flaws, i can't wait for the next installment.",4.0
My grandsons likes it.,4.0
"I went from a wireless six-button mouse to this wired gaming mouse, and I have to say the difference is significant. Where my wireless would do weird things like not recognizing clicks until I moved the mouse, and dropping out every once in a while, this wired mouse with increased resolution never does either of those things. It's incredibly responsive, and makes me glad I decided I could ""live with"" having a cord on my mouse.

The buttons are handy, and easy to reach. The feel is a little more blocky than I'm used to, but it's still comfortable. The mouse just feels like it's tracking far better than any I've used in a long time-- There's no ""jumpy"" feel to it in lower DPI settings, and less of one in the high setting than on my wireless mouse. It's kind of cool that I can switch DPI on the fly with a button.

In games, I noticed my response time was better, especially for circle-strafing and mouse-looking. While I'm not a huge FPS gamer, I did get some better control with this mouse in Team Fortress 2, and I felt a HUGE improvement in the way the mouse felt for Oblivion. Clicking on small icons and buttons on the in-game GUI isn't as tedious with the Sidewinder X5.

I use it in both OS X and Windows XP. Despite what the package says, the mouse does, indeed, come with drivers and control panels for OS X (not that OS X needs drivers, but the control panels are handy to assign buttons).

There's one button that I find sort of stupid and useless on this mouse. It's near the back (under your palm, when the mouse is being used) and its purpose varies depending on what OS you're using. It's not reassignable, either. It does what it does, and that is all. In Windows XP, all it does is launch the Intellimouse software; That's the mouse control panel, which you can normally reach two other ways (click the desktop/Start menu icon, or go to Control Panel). That's all it does. I hardly see why a button was needed for this function. In OS X, the button just pops your pointer up to the top left corner of the screen, and again, you can't reassign this button. It's just sort of a waste of moving parts, if you ask me.

However, stupid button aside, I dig this mouse. I think I may stick with it, despite losing wireless freedom compared to my old mouse. This mouse just works better!

Oh, I should mention that this mouse has two red lights on the bottom, near the back, and one on top. They remain on as long as your computer is sending power to the mouse, and this might be annoying for some people who don't want their mouse to be all lit up. It doesn't bother me much, but it is curious that Microsoft would put bright red lights on the mouse when the laser tracking emits light that is invisible to the human eye. These lights aren't part of the tracking hardware: They're just decoration. I guess it's supposed to look cool or something. I just think it's sort of a waste of power.

A good mouse, but not for the office or conservative desktop. Definitely a step up for gamers, though.",4.0
I'm not a game player just ordered for the nfl package. I tried to play it once more like the computer playing for you. You really don't have time to do anything I give it 4 stars cause hey I got the nfl package with it so the game was pretty much free lol,4.0
"great color, works well",4.0
"So, I hadn't played the other Theaterhythm games, and I basically bought this because I was bored and had some money burning a hole in my pocket. Turns out, I was pleasantly surprised! The game is basically Rock Band with a Final Fantasy soundtrack and a couple different ways of interacting with the controls. It has multiple play modes available that change the best way to interact with the songs, and a thin veneer of a storyline that does an adequate job of explaining and justifying why you have the main characters from 17 different games making music while fighting bad guys.

The repetitive nature of the game makes it hard to play more than a couple songs at a stretch before getting a bit bored, but the length of the songs and the style of the game makes it pretty clear that the designers realized this as well and set up the game in such a way that you can pick it up and play for the length of a car ride, ferry ride, plane trip, or spell in a waiting room and then close it up and come back later without missing a beat.",4.0
"The one zipper didn't wanna work when I first got it and now it seems to be working fine. This case is great, holds my 28 in one game case plus nintendo ds lite plus cell phone and charger and stylus!",4.0
"Good game . Not to easy , but then not the hardest to play. Well balanced .",4.0
"I have not held an original NES controller since 1989, but this controller feels pretty dang close to the original! It feels a little lighter and the buttons have a clicky type feel rather than a soft feel like the original. All though it does feel accurate. I tested this playing Batman, Catlevania, Rad Racer and Contra. Had no problems and the diagonals worked in Contra. D-pad seemed just fine. I will update if I run into problems down the road. I did not buy from Amazon because of the reviewers mentioning that it didn't come with a Retro-Link controller, so I got mine from ebay.",4.0
"I once tried the game ""Mobile Suit Gundam: Zeonic Front"" and it was quite good, if not complicated and difficult. But ""Zone of the Enders"" puts that game to utter shame. The powers and weapons that you receive for the Orbital Frame (giant robot) are awesome and the way it moves is incredible. You gain control of the Orbital Frame called Jehuty and you basically battle against a whole bunch of other Orbital Frames. Most of them aren't that challenging at first, but later the enemies receive upgrades and become considerably tougher. The leaders are a whole other story.
There are about 5 other Orbital Frames that Jehuty must face off against: Tempest, Tyrant, Nebula, Neith, and finally Anubis. Tempest and Tyrant are very large and powerful and Nebula is kind of like a huge jet Orbital Frame. Neith and Anubis however are very similar to Jehuty: bipedal, very fast, powerful, etc. The story of the game, which is quite good, revolves around a young boy named Leo Stenbuck who lives in a space colony outside of Jupiter called Antilia. After he accidentally gains control of Jehuty, he has to deliver the machine to the people who created it in order to keep an invading army of Orbital Frames from acquiring it. Leo then meets up with his remaining friend Celvice and along with Jehuty's AI system codenamed ADA, faces off against the invading army while also defending innocent civilians from destruction.
Another good thing about this game is the controls. They are very easy to remember and are not complicated at all. The only thing you should know is that to use the special weapons you acquire throughout the game, all you have to do is press the circle button (the game doesn't really tell you how to do that unless you read the manual). Jehuty is much more powerful than any Zaku or Gouf you may control in those Gundam games and is not nearly as difficult to control. The only thing I don't like about this game is how you have to go back and forth basically all the time in order to accomplish missions, and sometimes you might find yourself wandering about thinking ""what was I supposed to do?"" or ""where do I look for that program?"". As long as you keep your cool and read the objectives and hints listed in the MISSION area of the pause menu, then you'll do just fine.
Now, I plan on getting ""Zone of the Enders: The 2nd Runner"", since the ending of this great, yet extremely short, game kind of leaves you hanging. Chiao!",4.0
"Sega definitly had a good thing going when they were still marketing this system. Not only did it have a backlit screen (an 11(!) year old system having a backlit screen...are you listening Nintendo?), it also had a slew of great games, and a really cool design. I took mine to school a couple of weeks ago (freakin' finals.) and people were actually willing to trade their GBA's for a few precious minutes with my Game Gear! That's amazing. Even though I only have 3 games now (I actually had about 10 but I let somebody 'borrow' most of them about 5 years ago and he never gave them back), it's still fun to play.
  But, with every system, there's always a few drawbacks. To start, this thing is BIG. No, it's HUGE, and it gets even bigger when you use a battery pack. Next, the sound isn't great, it's only decent, and it doesn't get much better with headphones. Lastly, if you buy used games, test them FULLY before you buy (with Sonic 1&2 on mine, I have to leave the cartridge sticking out about 1 or 2 mm., or it won't even play at all).  But overall, I've had a lot of fun with my Game Gear over the last decade, especially with the Sonic titles, and I plan to have even more fun until my system finally gives up. Would I recommend it? In a word, yes. If you can get around the fact that it is huge, and that it is basically dead, you and your Game Gear can, and will, have a long, happy life together. I guarantee it.",4.0
"The case was just like I expected to be. I love how it looks, blends perfectly with my PSP Slim 2001.

Pros:
- Great build quality
- Nice looking design
- PSP and UMDs fits tight into the foam
- Convenient holes for the power button, charge and headphones inputs.
- You can play while the PSP is into the case.

Cons:
- In order to use the USB port you have to open the case, but still, there's little to no-space to plug a cord. And if you manage to plug one, it feels like you are forcing the port, which might cause some wear in it.
- It's hard to pull out the screen protector. It can get a little bit tricky.

Overall:
Buy if you don't intend to take out the PSP too often, and love how this case looks.",4.0
muy buen producto. rapido facil y a tiempo la entrega. sin contratiempos en todo el proceso. lo recomiendo a a,4.0
"I got this for christmas, and I've enjoyed it thoroughly. The way you pick which side you want to be on(good or bad) is fun, but I don't like how it ends up the same either way you go. It has a little language, but nothing deep. The gameplay and graphics are pretty nice. Overall, the game is pretty good.

Score

Gameplay  8.4
Graphics  8.2
Story  8.1

Overall  8.2",4.0
