reviewText,overall
controller works. no oo oo oo o o o o o  o oo  ooooo  o  ooooo o oot too shabby.,4.0
"Game is 6 years old but still hold up very nice in 2017. At its heart the game is a fantasy open-world sandbox that presents you with countless options to whittle away the hours as you please ranging from resource gathering, crafting, exploring, tinkering with skills and builds, etc. The strength of this particular though is the main storyline with a decent narrative that you can always dive into once you grow weary of the 'side' stuff. Game also looks fantastic when played on a PS4 PRO on a 4K TV with HDR as it can run on native 4k.",4.0
"Product was in great condition, fun game but not a really good fighting game, still enjoyed it.",4.0
good,4.0
"Very psychedelic and colorful, very interesting, and cool storyline, plus it's cheap brand new! Recommend downloading the demo 1st before buying and if you do you should buy this.",4.0
"When Dead Rising first came out, HD tv was still on it's way. It was available but not everyone had upgraded. This was one game that you might have issues with if you didn't have one due to the incredibly small text that you needed to read. It is a fun experience, but it hasn't aged very well if you ask me. While there's bound to be some that consider it to be classic(it is), I'm betting there are more who will try the second one and never look back. Still, if you own an Xbox 360 then you should add this to the library. It's worth the price for what you get.",4.0
"The Telltale Games experience since ""The Walking Dead"" has largely been the same.  They tell complex stories with good episode-to-episode cliffhangers, all through a simple technically-flawed gaming engine.  I don't play their games for innovations in gameplay; I look for a good story at a relatively low price.  ""The Wolf Among Us"" fits the bill, quite admirably.  I won't elaborate too much on story and give you some bullet points that I think will help those of you on the purchase fence:

*  STORY AND ACTING
In a nutshell, ""The Wolf Among Us"" creates a film noir type of murder mystery involving fairy tale characters.  Bigby Wolf (you) are the sheriff trying to keep order in Fabletown however you see fit.  Without spoilers, you'll encounter characters such as Beauty and Beast dealing with marital secrets and woes, and Tweedle Dee and Tweedle Dum as private detectives unafraid to get their hands dirty and their pockets filled, and Ichabod Crane is politician personified.  The story might feel bogged down from time to time with detective sequences that ask you to explore every nook and cranny, but since this is a detective story, it actually feels like a logical pace as opposed to padding out the chapters.  Players get to make certain choices throughout the game which change the experience dramatically in a couple episodes.  The final scene in Chapter 5 is the same no matter what choices you make, but it's preceded by a scene which wonderfully examines choices the player has made from start to finish --- it's a well-written, organic reflection of your experience.  The vocal performances are mostly good, though Telltale's made a few choices that don't really help them in terms of visuals.

*  PRESENTATION
There's no getting around it: Telltale's game engine isn't doing their games any favors.  Action sequences and camera changes get choppy.  Characters move a tad stiff.  And worst of all, there is no longer an option to turn off the ""Will Remember That"" messages during crucial conversations.  I don't mind post-episode stat tracking to compare my choices versus other players, but let me enjoy subtleties while I can.  On the positive side, though, ""The Wolf Among Us"" uses a very pleasing color palette to compliment the seedy undercurrents of Fabletown's secrets.  This is a good-looking game that feels both like a comic and an artistic expression of videogame storytelling.  It might not animate too smoothly, but it's a pretty portrait.  I can't recall the music too well outside of a few tracks, but I don't remember finding it out of place, and remember finding it appropriate to the experience.

REPLAY FACTOR
*  This mostly depends on your love of the story but I would play this story again someday.  Players who want to earn 100% trophies will have to find all of the Book of Fables entries, which requires replaying certain scenes and choosing specific decisions.  In a weird way, I liked doing this so I could explore a few alternative possibilities.  They're not complete game-changers but nice deviations from my initial playthrough.

DISC VS DOWNLOAD
*  I've seen downloads go cheaper from time to time on the PSN Store, but I'll always prefer discs because it's nice to have a hard copy backup in case your system goes bad.  Plus you don't have to wait for downloads and installations.

*  RANDOM EPISODE THOUGHTS
I love Episode 1's suspenseful lead up to its final fistfight.
That Episode 1 shocker might not have been worth undoing.
Episode 3 is probably the most high stakes of the game.
Episode 5 features probably too much action sequences, but somehow everything is brought to a proper finale.
Did I mention that penultimate scene in Episode 5 where everything you've experienced in re-explored?

*  COMPARISONS TO OTHER TELLTALE GAMES
I prefer both seasons of ""The Walking Dead"" over this game, but I'll take ""The Wolf Among Us"" over ""Back To The Future"" or ""Jurassic Park"" any day.  You'll have to take my recommendation with a grain of salt because I actually liked ""Jurassic Park"" as a dumb B-movie experience.  Telltale hasn't finished releasing ""Game of Thrones"" or ""Tales From The Borderlands"" as I type this review.  So far though I enjoy my time with Bigby and the mysteries of Fabletown more.

FINAL RECOMMENDATION
I wouldn't pay more than 15 bucks for ""The Wolf Among Us"", mostly because of the technical imperfections with Telltale's gameplay and presentation.  But in terms of story, it's a good one.  The fantasy elements surpass their origins to create interesting characters and the morality choices play out in mostly logical narratives.  Wait for a dark evening, dim the lights, and explore the shadows of Fabletown!",4.0
"The Order is a very competent game on every level. Instead of rating a game on what you think it should be, trying rating it on what it is being offered. The Order isn't a perfect game, but it offers an entertaining, beautiful, intelligent, simplistic experience. All of the weapons handle differently, I had fun using all of them, which is rare for a game like this. The voice acting is top notch, near flawless. The character movement is a little sluggish, but that is the only negative I can think of. There are a lot of QTE's, dialogue, characters, all of which I had no problem with. If you enjoy a linear game with horror themes, that is exquisitely crafted,  with acceptable weapon variety, I would highly suggest this game.",4.0
"I'll steer clear from all the Securom talk and just focus on the game itself, but just to state that I didn't have any issues installing or running the game and the game hasn't crashed once.

Dead Space is a very good game.  The story line is really well done and the game play is done well too.  It's pretty scary throughout the game and I never found it boring. There are some neat areas where they do things with zero gravity, and the ability to slow things down.

Sadly though the game has some horrible controls.  Maybe it'll be patched, but at the moment the mouse controls are just super sluggish. It seems like they did a really bad port of the console version.  There are some work arounds by turning off VSYNC in the video options of the game and then maxing the mouse sensitivity.  For the most part that fixes a lot of the mouse issues, but it's still a little sluggish in some areas like around corners.

I chose to play the game on medium difficulty because of this. I didn't want to get overly frustrated with mouse aiming on a more challenging difficulty.  It's been a lot of fun and since it's not on extra hard difficulty I don't have to try swinging around and hitting 10 mobs at a time which is good.

The game also plays a lot like Bioshock in the ability to customize your character. You can upgrade your armor and weapons how you see fit (damage, capacity, armor, hitpoints, etc.)  Another unique aspect is the ability to shoot the limbs off all the mobs. The game revolves around this (shooting legs out to slow enemies down, shooting heads off, etc.)

Overall the game is fantastic.  If I had known beforehand, I would have picked this up for the 360 or PS3, but even though the controls are lacking, I had a blast playing it and would recommend people to try it out.",4.0
My husband absolutely loves this! The only problem we have is the controller charging cord is not long enough to reach from the ps4 to our couch. The controller doesn't hold a charge long enough to play half the day straight.,4.0
"Back in 2002 Luigi was given a second chance to star in his own adventure called Luigi's Mansion, and although it was a short journey it won the hearts of critics and fans. Now ten years later Luigi is summoned once again by the intelligent Professor E. Gadd to once again dawn his trusty flashlight and the new Poltergust 5000 to star in his newest adventure, Luigi's Mansion: Dark Moon. With a lengthy adventure, that easily surpasses the predecessor, combined with some humorous comedic situations and an elegantly crafted world timing with intricate puzzles Luigi's Mansion: Dark Moon is an excellent reason to purchase a Nintendo 3DS.

Professor E. Gadd has spent his life researching paranormal activity, but when a mystical dark moon disappears from the sky of Evershade Valley, his ghostly allies turn hostile. In order to restore order Elvin Gadd contacts his friend Luigi, who is comfortably sleeping in his chair, to collect the shattered pieces of the artifact. Although the Professor can spark a few laughs the true humor of the game comes from the wacky animations: Luigi getting thrown into the wall by traps that open hidden areas; peering through crack in the wall and seeing ghosts gleefully performing misdeeds. These concepts are complemented by the superb sound design and soundtrack, adding more favor to the silly events as Luigi hums with the spooky music.

The atmosphere of Luigi's Mansion: Dark Moon is its greatest accomplishment. The perfect combination of spookiness and child-like wonders adds charm to each of the well-designed capacious area. Suits of armor line the hallways waiting for unexpected trespassers and flashes of light cast shadows when shined in front of an object. Turning on 3D the effect allows for excellent depth-of-field in certain parts of the game, especially when the camera zooms out. Each mansion is saturated with large rooms littered with secrets that include traps, treasure, and hidden ghosts. The various safes, vents, plants, and other strange contraptions release bundles of coins, notes, and gold blocks that make interacting with every piece of the environment time well-spent.

However, exploring the mansions can be difficult since the mission structure follows a specific path and encourages you to follow it. The helpful map on the bottom screen ensures you don't get lost, but it would be nice if you were given more freedom. Each mission is divided into levels and Luigi is transported between them using a transporter called the Pixelshifter, which warps Luigi from one location after being converted in tiny blocks and then put back together. Although Professor Gadd constantly calls Luigi on his Dual Scream (a clever take on the original Nintendo DS) to inform him of his current progress and give him instructions for the set objective, it seems unnecessary to inform the player of everything they do. It becomes a vexing inconvenience after the first level.

Luigi has access to two tools to take the supernatural: his flashlight, whichcontains a dark-light attachment that reveals illusions, ghosts, and hidden objects, as well as his Poltergust 5000 vacuum. These are the only tools required to solve the many puzzles within each mansion and are properly equipped to handle any combat situation. By exposing the hearts of the ghost using his flashlight Luigi initiates a tug-of-war between the creatures and then suck them into his vacuum after draining all the health of his target, a power meter also appears that if charged can do a massive amount of damage for quicker battles. Missions all require a combination of catching ghosts and solving puzzles, ending with a boss fight that requires a combination of both. Anything in the environment can be important to your task, requiring careful observation and use of your dark-light. The puzzles are varied and rarely repeat the same pattern, offering new challenges as you progress through the game. Although Professor Gadd points you in the right direction, finding the solution to each problems is tricky but rewarding once you do.

Multiplayer is the most shocking addition to Luigi's Mansion: Dark Moon called ScareScraper. Up to 4 players are sent into a random mansion and take control of different color variations of Luigi to clear each floor all the ghostly inhabitants, locating invisible ghost-dogs or racing to find a hidden hatch to the next area. Whether playing online,  local or download play, teamwork is essential to pass through each level and defeat the bosses, but it's clear that these modes were made to accompany 4-player cooperative play and taking on the multiplayer mode with less players can lead to frustration.

Luigi's Mansion: Dark Moon is a wonderful sequel. It allows Luigi a chance at the spotlight once again and show gamers that he can be just as entertaining as Mario. A fickle difficulty curve and a poor checkpoint system can lead to annoying situations but these are mostly minor concerns. Luigi's Mansion: Dark Moon maintains the same charming formula that made the first game a success and returning to Luigi's newest ghost catching adventure is definitely worth taking.",4.0
"I had a lot of fun with this game, much more than I thought I would. Warcraft 3 is a good old-fashion real-time strategy (RTS) game, with a somewhat outdated resource collection model and base-building formula. It also aspires to be a roleplaying game (RPG), thought it is only partially successful. Overall, if you like RTS games, this one is worth a try. However, I found it not to be as good as some of the more recent games, like Rise of Nations and Warhammer 40,000: Dawn of War.

Gameplay: Warcraft 3 is remarkably like Warcraft 2 in a lot of ways, which is both good and bad. On the good side, it's fairly easy to learn and quite fun for a while. You choose one of four races to play (which are all distinct); gather gold, lumber, and food; build structures and units; explore the map; and conquer your enemies. It's a very typical 1990s-style RTS game. However, Warcraft 3 adds hero units to the mix, which greatly impact gameplay. These units can gain levels as in a RPG-style game and have special abilities. You really cannot win a game without them. Each race has a choice of 4 heroes to choose from (with The Frozen Throne expansion loaded) and there are neutral heroes that can be recruited. The hero model works quite well with the single-player campaign, since it weaves them into a broad story. However, it makes skirmish games a little awkward, since you are required to both build bases and find creeps (random monsters) for your hero to fight in order to gain levels.

The single-player campaign is both quite long and well done. Actually, it seemed a little too long once I played through the original campaign and the Frozen Throne expansion. The story is the typical good vs. evil theme, which gets really hard to follow by the mid-point. However, the missions are generally well done, with a good mix of RPG-style adventuring and a heavy-dose of base-building and conquest. The missions are designed to allow you the chance to play all four races, and I didn't get the sense that they were just practice for multiplayer online games. That is, for solo gamers like myself, Warcraft 3 has a substantial amount of single-player content.

Warcraft 3 is good, but does have some issues. Some of the single-player missions are quite hard and will require much reloading of saved games in order to complete. Still, the AI can be a little lame. There were countless times that my base would be invaded, and my units would not automatically move to fight the enemy. However, AI enemies do fight smart, often first attacking your units that can do the most damage to them. Rather surprisingly, the game does not have a pause feature so that you can look around the battlefield and give orders while pausing. And unlike recent RTS games, Warcraft 3 limits you to very small armies. You'll be lucky to have 20 fighting units at any given time. Additionally, the game just seems behind the times in other ways. The camera doesn't really zoom, graphics are cartoonish, and the micromanagement can be burdensome at times.

As with every other Blizzard product I've played, the game was perfectly stable and well polished, and I came across no bugs or typos. In addition to a single-player campaign that will last around 35+ hours for the average player, there are a large number of skirmish maps included, multiplayer capacity, and a map editor. As usual, Blizzard has supported the game well with patches and new official maps that are downloadable at their website.

Graphics: The typical Warcraft visuals. A bit cartoonish, but with a lot of vivid colors and diverse environments. Spell effects look convincing, and there are day & night cycles that give the world a living feel. The game is actually cute in many ways and is probably supposed to be that way. The graphics will not win any awards, but they do serve their purpose. As with Diablo 2, Warcraft 3 has some of the best cutscenes I have ever seen in a video game.

Sound: There is a lot of great voice acting in the game. Some of it is very funny. The music is also well done and appropriate to the mood of the game.

Overall, I recommend Warcraft 3 (plus the expansion) to anyone interested in RTS or fantasy games. It's a well-made strategy game with lots of challenges, a epic (though rambling) story, and an RPG element in the form of heroes (which, again, can be a plus or a minus). If you can get past all of the micromanagement that the game requires and some other outdated elements, Warcraft 3 should provide many hours of entertainment.",4.0
"Purchased this mouse to go with MSI laptop. Already have a G400s (which is awesome) that goes with a desktop. I have to say the DS100 is not too shabby in comparison, definitely in line with where it should be for 60% of the price.  I have to say that one of the primary reasons I gave this mouse a look was because of the attention to detail that apparently went into my MSI GP60 laptop.  Everything on the laptop works very well and is very cost effective.  In particular I liked the SteelSeries tactile feedback keyboard on it.  If MSI built a mouse that had the same practical/sporty feel, I knew I'd be sold, and so I was.  My initial impression was that it was a rather cheap mouse, and I didn't get much of a deal, but that eventually changed with use.

Pros:
-Textured coating on the top surfaces of mouse have a nice feel.
-Pleasant color options (Red/Green/Yellow/Blue/Teal/Purple) all look good.
-Good tracking with none of the lag issues some other users have run into.
-Good software (had a slight hiccup on install, showed ""program not responding"" but installed correctly after a couple minutes)
-Looks nice next to an MSI laptop :)  A touch of sexy without crossing the line into embarrassing gamey gaudiness.
-Braided cord is a good length and stays out of the way better than the standard rubber cord on the G400s.
-Lift off distance (how far you have to pick the mouse up before it stops tracking) is excellent.  I'd say it is somewhere in the range of 1.5 CD widths, roughly half of the G400s.
-The mouse wheel is grooved with a rubber coating and there is a very subtle click with each notch as you scroll.  This is the attention to the little things I was hoping for.

On the Fence:
-The low profile of the mouse feels sporty but I find the bottom of my thumb just grazing the mousepad because there simply isn't much room below the thumb buttons.
-Ergonomics.  Both buttons are slightly grooved instead of flat.  I think I'd actually prefer slightly convex to concave, but it's fine.  No crampy issues or anything like that, but the mouse doesn't scream ""comfort"" so much as ""sporty"" and I think it favors palm grippers over fingertip grippers like myself.
-There is minimal texture on the sides of the mouse.  No issues gripping/picking up mouse, but some will want more.

Cons:
-It is a laser mouse which means there is supposedly a little more interpolation/inaccuracy relative to a good optical mouse.  Having used the G400s, I can say that internet connection and fatigue are far larger factors.  I haven't noticed much if any difference.
-If you leave the LED on, the mouse surface heats up slightly, causing sweaty palms.  Leaving the LED off fixes issue.
-The mouse is surprisingly heavy for such average-sized mouse and quite tail-heavy.  When I purchased I was hoping the 130+gram weight included the cord...not so.  If this mouse were about 80g (like a G100s) and kept all its features, I would probably rate it over the G400s.  As it is it is this is still a very minor gripe.

In Summary:
I don't foresee having any issues with this mouse after a few weeks of heavy use.  While there is a TON of competition at the $25-30 range, I have no regrets with this purchase.",4.0
"Update! I hope they add in auctions so people can sell liveries. Fun game and beautiful graphics.

Just got mine and will adjust rating accordingly. For those complaining about credits, you will be emailed 500k and inside the box you should have another 500k-1mill. I'm in a 12+ gig update. Will update this review afer I get track time and not just bonuses. Hope this game is great!

Update! I like it, super fast load times. I really need 4k, my monitor doesn't do it justice. Really nice graphics, I wish there was in depth tuning like old motor city online days. Also a drag strip would be nice. Fun game, definitely worth picking up if you are a casual player.

A few quirks to mention, penalties seem to favor the aggressor, Been in races where I seen a 27 second penalty from multiple hits from others, they put you into the wall you get s 5 second penalty.  Still a fun game, I'm sure they will patch this.",4.0
"This game is great to unlock easy achievements for XBOX 360 users. In a day where most achievements have to be earned online, this game offers less than 100 points for online use. I picked up 395 points in one game. LXLUTHR on XBOX Live",4.0
"Prior to testing out the headset I installed the firmware update for the Xbox One controller.  It was very easy to set up and get the unit working with Xbox.  Sound quality was very good with pleasant sound - not too bass heavy or unbalanced.  The unit was fairly comfortable though a little tighter on the head than I would have preferred.

My only minor complaint is that I wish the headset would have been designed to be completely wireless.

All in all this headset works well and it is a lot of fun to use.",4.0
