reviewText,overall
"...what ""Final Fantasy Tacitcs"" was to the Final Fantasy series!  They both didn't have a lot to do with the series they were based off of. Yet they are both so addictive and fun you just don't care!  ""Phantasy Star Online"" is one of Dreamcast's best game and it's a no brainer as to why it was!  First of all it was made by Sonic Team (Which is lead by video game master Yugi Naka!), who has a record of making games based on how fun they are (Games like ""Sonic Adventure,"" ""Samba de Amigo,"" and ""Chu Chu Rocket"" to name a few!), and not on how good they look (Although they do look good too!!!)!  The main idea is to log online with up to four friends and chat with them as you kill monsters, unlock doors, find rare weapons, and blow up boxs!!!  Although this sounds like it would get boring fast it actually keeps you entertained with the chating part as you and your team-mates can make jokes, flirt with each other, cuss out the bad guys(Although there is a cencor that blocks cussing!  Sorry, but kids could be playing!), creat your own charicter, and blow up boxes!!!  Sound fun yet?  Well if this doesn't sound fun to you yet make sure you still have a pulse, you may be dead!  Although I do admitt that unless your online this stuff will be more than boring after 30 minutes!  And since the story is so non-existent playing this game for the story doesn't make much sense either!  Basicly, unless you plan on playing this online, you won't get your moneys worth if you play it offline!  But Sonic Team has proved one thing:  They sure do make some darn good games!",2.0
Its made cheaply . Some things made in china are not made to last.,2.0
"Adorable, good texture but they're too big for the PS4 thumb sticks if the original rubber is worn away. Maybe better if you put them over the original rubber but who thinks of this before they need it? They slide around and move so accuracy is unattainable and its quite annoying. I will be returning and going to the KontrolFreek phantom or alpha ones that snap totally over the plastic thumbsticks and see if those are more secure. Sad because these are so cure and felt good on the thumb, just not tight enough to keep any accuracy.",2.0
"Stunning graphics coupled with very clumsy controls make this game a feast for the eyes but a major bust when it comes to engrossing game play.  In a  world dominated by such near master works as Lucas Arts' Indiana Jones and  the Infernal Machine, different is not necessarily better and the third  person perspective Nocturne offers is as creepy as the games beautifully  dark images and spine tingling story line.  I suppose the object was to  give Nocturne a cinematic edge offered by some of Hollywood's best  horror/thrillers, but cutting from place to place using numerous movie  angels as our gruff but hardly lovable anti-hero ""Stranger"" runs through  each scene (ground level, over-head, etc) trying to mow down swooping and  snarling creatures of the night, simply doesn't work here and would likely  earn any film student a solid D for effort!  With one additional option,  first person perspective (or even second person), this might have been a  great game, without it, Nocturne swiftly becomes little more than a tedious  test of your 20/20 vision and manual dexterity.  Bottom line, if you can  get it cheap (one major home electronics store recently had it on sale for  $9.99), or can borrow it from a friend, check it out for it's amazing  cutting edge eye candy.  But just like any fine work of art hanging in  some posh museum, you'll pause to consider Nocturne's brilliant textures,  along with it's use of light and shadow but eventually you'll move on to  something much more stimulating and rewarding, like an amusement park.",2.0
"Hello, In a word, awesome! Great learning curve ( GOW, was very steep curve) I have an awesome rig and cranked it to MAX! It ran flawlessly (after a defrag) I like first person shooters but lately the creative curve on first person shooters is dead flat! The days of ""Disruptor"" seem long gone. This game does make use of all the buttons and sticks...some times all at once. As I stated not for teens. It's nothing but graphic killing. Enjoy! UPDATE: I see what people are upset about. The game crashed and now the reloading is running the the ROM drive hard, really hard. I'm sure it's put three years of wear on it in the hour and a half it tried to reload.",2.0
"Package arrived damaged, disc was floating around.",2.0
The analog throw is very inaccurate. Do not get unless you intend to mod with the custom circuit board kit,2.0
"Go with a name brand or a Steam controller, these off-brand 360 receivers are hit and miss, I have one and I have several friends who got one and nobody is happy with it. Sometimes it will not connect, if it does connect there is ALWAYS a lag in the controller! spend the extra money on the Microsoft receiver or get a wired controller.",2.0
"This game is similar (and I mean really really similar) to the first Metroid Prime, except even more annoying.

The translation of style from sidescrolling Metroid to 3d was handled beautifully.  Art, sound, level design, etc is all top notch, and the game sports some of the most impressive visuals to be found on the gamecube.  Beyond aesthetics though, the game falls apart.

It's simply not fun to play.  It has a somewhat awkward control scheme that even after you adjust to, is simply subpar to games that were being made in the N64 era.  Nentendo tries to say that this is not a ""First Person Shooter"", but a ""First Person Adventure"" game.  Well, you do occasionally have to shoot things in the first person perspective, and it's handled quite poorly, leading me to believe Nintendo's statement is really just a euphimism for ""Bad First Person Shooter"".

As already mentioned, the control scheme is poor.  You cannot strafe and move at the same time (unless you're locked onto someething that moves your view while you're strafing), so enemies (the vast majority of which are extremely agile) can very easily get behind you.  Aiming (which you also cannot do while moving) is so incredibly slow that it forces you to rely on the game's lock-on targetting system.  Unfortunately, too many enemies (especially bosses) have moves that negate your lockon targetting making re-aquring them a painstaking effort.  In addition to general slow aiming, your upward/downward viewing angle maxes out at about 30 degrees above/below the horizon, so when enemies get above you, it's very difficult to deal with them (as many flying enemies or bosses will often do).  It makes the game challenging, but not in a fun way.  It's challenging kind of like running a 20 mile marathon after having someone break both your knees with a sledgehammer.

And then there's backtracking.  There is way way too much backtracking in this game.  It's one thing to spend an hour in a game exploring new environments without making progress, it's another thing to constantly be forced to backtrack an hour through previously explored territory to retrieve a single item, and then spend an hour getting back, only to get another item, and use it to backtrack an hour someplace else, etc.

Making the backtracking even worse is the frequent forced encounters where doors will lock preventing you from leaving and you have to fight a particular enemy (Dark Pirte Trooper) until you either kill it or it leaves.  Either method takes upwards of 5-6 minutes, because like many other annoying enemies in the game, it spends most of its time being completely invincible.

Metroid Prime 1 was a basically good game with some large flaws.  This game took it upon itself to be a copy of the first game, and increase the size of all those flaws without adding anything good.",2.0
"the only thing I feel after put 20 hours to this game is I finally find a game this medicore. This game, fallout 3 probably has all the medicore contents in it, I mean, seriously I can think about too many things: mediocre combat most of the time, mediocre dialogs, medicore characters, mediocre setting, mediocre landscapes, mediocre enemies to fight, oh, and mediocre quests (some are even laughable, like that alien quest in one of dlcs, I mean does this kind of quest has any subtle meaning?). But I have to say I enjoyed it more than oblivion, maybe because the environment is actually good. so in one word, if you have time for video games and don't know any good games to spend your time then it can be a viable substitute. Otherwise don't waste your time.",2.0
"I think this game is juvenile and boring. Maybe for kids it is good. But as long as you are an adult player, just stay away, and do not waste your money.",2.0
"Save your money on this one..I was so excited for this game, one of the reasons I bought a next generation console and recommended it to my friends..but I feel like I went through all the missions in about a week, the PvP is terrible, missions are repetitive, there is absolutely no story, the grind is worse than I had ever imagined, you can spend 3-4 hours playing missions and come out with nothing to show for it..I gave it an extra star because it does look beautiful and it did keep me somewhat entertained for a good amount of hours, but nothing like I expected or from what I've seen in other games I've played so far..save your money for something else..wish I had knew this before I purchased the digital guardian edition.",2.0
"I expected much better. I am so disappointed in this mouse that I'm replacing it with a Logitech after only 6 months.

Software is buggy and annoying, not tied to Windows account login, but with an online account. Very annoying, especially considering one must rely on the software to switch between sensitivity. Terrible for a gamer.

The mouse lacks an onboard sensitivity switch, meaning you have to repurpose another button for this function, or leave the app to go to the aforementioned buggy software.

And, after only 6 months, the scroll wheel is not functioning properly, lacks any precision, and slips.

Lastly, the mouse has hiccups in it's movement, almost like an old mechanical mouse that had become dirty. The mouse is in perfect shape, mousepad is clean, yet is still sticks.

I'm moving up to a Logitech, a brand I've had great service from for many years. But given the apparently disposable nature of the Razer DeathAdder Chroma, you would be served just as well by one of the discount gaming mice that fail within the first year.",2.0
"I bought these USB adapters for the 360 in hopes that they would, well...maybe, just maybe, WORK! These work for the first few months, then just...stop working. They are obviously inferior quality, because on one of my controllers I have had for 5 YEARS the breakaway cable still works, while this one doesn't. I have tested this by observing that whenever I switch a USB adapter with this one, the controller mysteriously no longer works. Do not get this. I would recommend getting a new controller instead.

I am disappointed, because this is probably the only bad review I have written yet for an amazon product. Usually, they turn out fine, but not this one. Don't get it. Maybe, if you are lucky, it might work for a year, but then ka-boom.",2.0
"The game is a typical real time strategy/tactics. It combines elements from familiar Microprose games (e.g. Masters of Magic) with real time components. The major drawback of the game is that there's really not much to do - the game kind of plays itself. You only contribute by building buildings and telling them to produce units. The mechanism for controlling the units is kind of awkward, even if somewhat different than other games. You set a price on a territory to explore or a bad guy to kill and the units respond based on their character. There's no way to give specific commands to units. The game gets old really fast, the variations in strategy from one scenario to the next are negligible. It's interesting at first but gets boring very quickly. In addition the scenarios are kind of easy. I gave it up after the first two hours. I think you can find tons of better RT strategy games. I am a huge fan of the Microprose titles and this was a big time dissapointment.",2.0
bla. it's not very good and the gameplay combos are almost exactly the same as spiderman 1 on the ps1. plus it's soooooooooo soooooooooo soooooooooo soooooooooo hard,2.0
It can be considered fun but it gets boring after a while.,2.0
This game is so repetitive!  It's extremely easy to beat!  There's  nothing to do!  PERIOD!!,2.0
"The games are fun the selection sucks because they have really only half the games because they only give u parts 1,2,3,4 of a couple.",2.0
"I really wanted to like this controller.  I bought two of them for a Raspberry Pi build and planned to use them wirelessly.  However, this was a bad idea.

I'll start off with what I like about the controller.  It feels really good in the hands.  Ergonomics are great, and for the most part the buttons all feel good as well.  The D-pad and analog sticks seem better than average.  The L2 and R2 triggers have a loose wobble to them when you're not pressing down on them, but this wasn't a big deal.  I like the backlighting when it works.  It's attractive and looks quality.  The only complaint I have is that the Turbo and Clear buttons are very easy to confuse with the Start and Select buttons when you're not looking; over time I got used to it however.

The real problems I had with these controllers happened when I tried to connect them.  I will warn you right now: these are not properly made to connect two USB dongles/controllers at once.  I couldn't get both to connect for the life of me, and the few times I did it was short lived.  Sometimes one would connect but press all the buttons twice, which I can only assume meant that it was connecting to both dongles simultaneously.  I tried putting the dongles in different ports, angling them away from each other, everything, to no avail.  Then, to top it all off, when even one of them was plugged in I would get terrible wifi transfer speeds  Next I tried to connect one via bluetooth to my Raspberry Pi.  I got it to pair, but it would only work in the shell menus and not in the controller configuration dialog.  Finally I decided to try one wired.  While it worked, the controller charges while tethered so the lights continually blink on and off until it's charged; I found this quite irritating.

To conclude, this controller has promise, but until the connection issues are resolved I can only recommend buying one at most.  Any more will give you headaches.",2.0
"Move over, ""Super Mario Sunshine."" There's a new king of mediocrity in the world of almost-always-amazing-but-occasionally-not Nintendo. Okay, so maybe mediocre is a little too harsh for the description of ""Super Mario Sunshine,"" but it's likely a tad generous for ""Metroid: Other M""--Nintendo and Team Ninja's ambitious joint project. In the months leading up to its release, fans were promised that this entry would be both ""the ultimate Metroid experience"" and that it would be a ""return to the series' roots."" Unfortunately for fans, neither promise was fulfilled, as I found out for myself two nights ago when I finished it. In this comprehensive review, I will try to cover all of the game's major aspects, both the good and the bad.

First, I'll go over the story, since Nintendo has made it evident that this is one of the most important parts of the game (don't worry, I'm not going to spoil any of the surprises). The game starts off with an amazing CGI cutscene, depicting the end of the climactic showdown between Samus Aran and Mother Brain at the end of the SNES classic, ""Super Metroid."" After Mother Brain's destruction, the game fast-forwards a little bit to Samus recovering from her battle and setting off once again to search for any, new bounties. Suddenly, she receives a distress beacon, which she immediately follows to a giant space station, called ""The Bottleship."" After landing, Samus meets up with her old squad, of which she was a part in her earlier, military days. The squad is led by her former commanding officer, Adam Malkovich. Deciding to join forces, Samus assists the group in finding out what has happened on the station. That is when her adventure begins. Throughout the game, Samus continuously has flashbacks that are meant to flesh out her history for the gamer. These are done through the use of CGI cutscenes, like the one in the introduction. These cutscenese all look fantastic; it's obvious that Nintendo made this a priority in helping tell Samus' story. Nintendo has never been known for story-intensive games, which is why this change-up is a little bit refreshing. However, in every cutscene I saw, I never found myself actually liking Samus any more. Mostly, this is because she is depicted as a rebellious punk in her youth. Also, as each flashback unfolds, Samus gives the narration, which is overly melodramatic and only carries a tone of depression. Yes, as a kid, Samus was rebellious and bitter, and now, she just mopes around all the time, speaking poetically to everyone, who will listen to her. How is that likable? How is the player supposed to connect with such melancholy? It's as if her true mission is to make every gamer as depressed as she is.... I think we may be onto something here. Additionally, the present story aboard the Bottleship takes far too long to develop. It does start to pick up toward the end, but in all honesty, it's a bit silly. Although Nintendo went to great lengths to make story a much more important factor than in past games, this one mostly fails to have any resonation with the player.

Next, I will discuss graphics and sound. In all fairness, for a Wii game, ""Other M"" looks okay, but when you compare it to other first-party games on the console, it doesn't meet the bar (it's amazing what developers can do with the Wii's graphical power, when they actually try hard). Also, the character designs look atrocious. I understand that the team probably wanted a simpler look, since ""simplicity"" was the main theme Nintendo wanted to incorporate for this game, but why change the look of characters just for the sake of making changes? Regardless of the team's intentions, the characters and creatures look terrible, with absolutely no detail or life to them. Unlike the excellent Prime trilogy and Super Metroid, ""Other M"" has absolutely no memorable music or atmosphere. Maybe I'm just spoiled by the Prime games, but it's very hard to accept downgrades of this number and magnitude. If you played the original Prime, you may remember what it was like exiting the claustrophobic, fiery Magmoor Caverns and stepping out into the wide-open, chilly Phendrana Drifts; there is no such moment or any of the Primes' other great moments in ""Other M"". Also, you will not find any of the near-perfect level and creature designs found in ""Super Metroid."" As for the voice-acting, Nintendo has not made many strides in catching up to the rest of the industry. I normally would not ridicule Nintendo for this, because they did try, but because they insisted on making this such a story-intensive game and because there is so much dialogue, I have to place it in the equation. In both the areas of graphics and sound, the Metroid series has taken a major step backwards.

Lastly, I will discuss the game play. For most Nintendo games, this section would take up the majority of a review, but in the case of ""Other M"", it gets an equal share. I won't say whether that was a slam or a compliment. After finishing the game, I still can't quite figure out who this game was meant for. On the one hand, it seems like Nintendo wanted a ""simple"" feel, forcing players to hold the Wii remote horizontally, without the use of the Nun chuck. On the other hand, the movement and combat that's required all feels more complicated and extremely awkward, especially at first, when the player is trying to adjust to the controls. If this was a true return-to-roots sidescroller, this control setup would work, but because players are often running through 3D environments, it becomes nearly unmanageable. The nun chuck attachment would have certainly remedied this offset. Regardless, combat can be real pain. Without a doubt, the most frustrating part of combat is firing missiles. In order to fire them, players are forced to turn the Wii remote and point it at the screen, switching the view to first-person. And because the Wii remote is the only controller allowed, the player cannot move while in this view. Also, the player cannot fire missiles at will. Instead, he or she has to hold the ""B"" button to lock onto a creature or destructible structure and then fire. Obviously, this can cause problems in intense firefights, in which missiles are required. You can literally lose one or two seconds in the process of switching to first person, actually locating the enemy, locking onto it, and firing the missile (or in some cases, charging up a shot to fire a super missile). Another complaint about the combat is auto-firing. Because of the strange 2D-meets-3D setup, players are forced to fire at enemies automatically, using the ""A"" button, without any precise aiming required. Yes, this is simple, but because enemies aren't always visible on the screen, auto-firing won't always detect them. Aside from combat, another sore spot for the game play is the process of regenerating health and missiles. In past Metroid games, players could destroy enemies, which would then drop items that Samus could use to recharge herself. In ""Other M"", however, enemies do not drop anything when they are destroyed. Instead, if the player wants to recharge Samus' missiles, he or she has to hold the Wii remote up and hold the ""A"" button. After between three and five seconds, Samus' missiles will be completely replenished. In the same manner, Samus can replenish her health, but there's a catch--in order to recharge Samus' health, the player has to come within an inch of dying (about 30 HP), and after three to five seconds of holding down the ""A"" button, Samus' health will only partially replenish itself. In the case of most battles, this becomes problematic, since most enemies aren't going to stand around to let the player replenish his or her health. It's obvious that the developers had the mindset that if the player's energy gets too low, then he or she deserves to die. However, you can replenish both Samus' health and missiles at navigation stations, which are also used to save your progress. Just hope that you can always make it to the next station before your health gets too low. Lastly, exploration has been largely scaled back. For some people, this may be more of a preference than a complaint, but because this is a Metroid title, I felt it was worth taking into account, especially since players were promised that this would retain all of Metroid's core elements. As for what does work, there are new moves made especially for this game: sense (a quick, evasive action), lethal strike, counter-attack, and overblast). All of these work well and become almost automatic for the player, thanks to Team Ninja's expertise with Ninja Gaiden's combat system.

""Metroid: Other M"" is an ambitious change to the familiar Metroid formula. It seems like there were opposing viewpoints for what should be done with the series, instead of a united, cohesive effort. ""Other M"" could have been an amazing game; I'm almost sure of it. I think that if Nintendo and Team Ninja were intent on working together on this project, they would have been better served choosing one control layout--either simple, 2D side-scrolling or full 3D exploration, with the nun chuck. Instead, what we have is a mish-mash of good and bad ideas, mixed with underdeveloped visual design and audio, and wrapped up in a mostly bland story. To me, it is shameful that Nintendo would allow this series to take such a fall, especially since the Nintendo development team behind this is the same team responsible for all of the early 2D Metroid classics, as well as Metroid Fusion for the Game Boy Advance. I sincerely hope that Nintendo learns from this mistake. If the company can retain its focus on solid game play and take gentle, productive steps on injecting more presentation value, I think it can keep its key franchises fresh, while making sure that gamers always see what makes each one so special.",2.0
