reviewText,overall
"I gave the N64 version of this classic wrestling title 4 stars because this version of the game unlike it's PS1 cousin has very smooth graphics, shorter wait/loading times, and the overall presentation flows better. I don't have to worry about lag like I do with the disc. The default controls were a little hard to pick up on but once you find out what buttons do what, you're pretty much good to go. This version has the same amount of wrestlers in it as the PS1, same every thing. I'm very glad to have found this version of the game. The game did lack in game play modes and moves variety but this did give you all the arenas of that era and a load of backstage areas and weapons to pound your opponent into submission. It was built more like a fighting game vs a wrestling simulation.",4.0
"I bought this out of the art style, I like the character design. The story and the missions are good. But one thing I did not really like is the lack of lock on icon. Most of the time, I missed the target with the diving kick and kept on flying past the target.",4.0
"Apparently some of these reviewers thought this was gonna be some new and improved or completely original take on Sid Meier's civ games.  No.  This is a console version of a great PC game.  As such one has to expect some differences.  That doesn't mean, however, that this game doesn't include all the aspects that make up a CIV game.  But I would say, if you like the computer version stick to that, if you're looking for something a little different, read on.

To answer another reviewers question, ""Why was this game made?""

As someone who always found Civilization games extremely massive, confusing, time-consuming, difficult to navigate, and impossible to grasp completely - THIS IS OUR SALVATION!!!!  All the fun of the Civilization franchise in a simple, intuitive, easy to learn, addictive, and yet still complex console game.  The graphics are beautiful (in the civilization's own cartoony way), the game has tons of replay-ability, and the setup/interface is so well designed that I actually quickly learned about elements of the game that I never even realized were a part of the old pc versions.

In my opinion... it's the way the Civilization games should have been designed since the very beginning.

*Just make sure to go into the options menu and mute the voices of your advisors and world leaders who talk in nothing but gibberish or you'll soon find yourself yelling profanities at your television set*  =)",4.0
I really enjoy it but wish it would come with a bigger memory card that's the only reason I didn't give it 5 stars because you have to go out and pick up a bigger memory card to download the games that come with it.,4.0
"The Neverwinter Nights (NWN) game engine represents what I hope to be a new era in computer gaming: platforms that invite users/players to create their own games with near-complete access to the game engine.
Sadly, while the NWN platform itself was a major breakthrough, the included gameplay was routine, uninspired, and sometimes even silly. Shadows of Undrentide (SoA) shows that the Bioware crew can not only create a great technical product, but also deliver a solid story.
Unlike the original NWN storyline, SoA has a coherent plot that, while short of ""compelling,"" kept me interested. The fact that it was written for single-player mode meant the storytellers could focus on developing non-player characters rather than try to have the story work with lots of different players (not an easy task!). While many have complained about the lack of multi-player support, personally I've been unable to commit to that kind of gameplay anyway, and the few experience I've had were disappointing.
The fact that NWN is both a generalized toolset and a game means a lot of tradeoffs: one is that the graphics and environments become pretty uninspiring after a while because they re-use the same assets over and over again. To me, this is almost a blessing, as it forces story developers to focus more on the story rather than dazzle players with graphics.
Toolset enhancements and expanded assets (monsters, spells, etc.) make this expansion essential for those of us creating content.
Although not approaching the peaks of the Infinity Engine series of games, the NWN platform still has a lot of room for growth, whatever the power-gamers who want shiny graphics instead of good stories might say.",4.0
"It was a little hard to figure out first, but after messing with settings, it finally worked, it can HARD to get working for windows 8, it took me a few hours, some people may not wanna buy this if you not good with computers.",4.0
My favorite brand for headsets.  They are much better than the price so you make out on this deal.,4.0
"We reached the end of the ""Arkham"" Trilogy and Rocksteady is pulling out all the stops! Unfortunately however effort alone isn't what makes a game great.

Without giving away spoilers I will discuss some pros and cons of the game and explain why ultimately I am giving it the WEAKEST of 4 stars.

Pros
- Rocksteady did their homework. Riddler challenges that rely on a lot of Bat History is a cool plus for a die hard Batman fan like myself. However this can be challenging and or frustrating for fans who only are casual Batman fans.

- Terrific voice acting. Batman sounds the same as he does back when Conroy was still doing BTAS, Scarecrow sounds creepy and menacing, and Troy Baker. I don't even need to explain anything there. However my one complaint was Gordon. Although I do love Breaking Bad and Better Call Saul, I felt Gordon's voice did not match the character but that may just be my personal preference.

- The Villians. Another surprise was the use of not only well established villains but more recent and comic book entries. Apart from the typical two-face and penguin we are also treated to some surprise villains during the ""Gothams Most Wanted"" missions which I love how Rocksteady interpreted them into the Arkham Universe.

Cons

Annoying Riddler Challanges- It was the final game. I didn't want to just see the secret ending on YouTube, I wanted to earn it. I was wrong.... For all the trouble I went through the ending was just not that special to justify the frustration I went through. At the end of it all I was hoping Batman would break his rule and Kill Riddler, kidding (sorta...). Which brings me again to The Riddler...

-Riddler Batmobile races. Like I said before I wanted to personally murder the Riddler when the game was completed and his Challanges involving you racing against the clock only furthered that anger. I was lucky I managed to complete even the hardest of the races after a few tries but there are people on YouTube still stuck trying to beat certain Riddler races.

- Arkham Knight. I promised there would be no spoilers and I intend to keep my word. However with that being said, the reveal of Arkham Knight is not only anti climatic but underwhelming. I understood why they chose who they did and honestly I don't think I could have picked someone better, but still. It's resolution is clunky and quick.

Mixed bag

The God Damn Batmobile (Points if you get the reference) - Ok so at first I hated it. Clunky hard to drive, hard to turn, just not the best driving experience. I admit I got used to it and did enjoy it later on in the game. But I prefer soaring over Gotham, and grappling up buildings. Being forced to do so many Challanges with the car was not only annoying but could be frustrating when just starting out

Remember everything from the previous games? Well you better hope so because Rocksteady decided to just give you all your cool toys at the beginning of the game and hope you remembered how to use them. I discussed this with a friend who also agreed this tactic makes the game feel slightly rushed. I enjoyed the previous iterations where Batman had to get each weapon over time, instead the game is more focused on Batmobile upgrades.

So there you have it the pros and the cons, while its a good game it's not the best in the series. Personally it would be City, Asylum, then Knight for me. The game reminded me a lot of Dark Knight Rises which isn't the best thing in the world but still a fun time

There is enjoyment to be had but just don't expect this to be the best game in the series. Also on a side note. Although I compared this to ""Dark Knight Rises"" did anyone else pick up that Scarecrows plot is essentially the same exact one from ""Batman Begins""? Fear toxin all over Gotham etc

Anyway thank you for reading and please leave a upvote or comment explaining your feelings towards the game and this review!",4.0
"If you are a fan of both survival horror/adventure and Role Playing, then pick up a copy of this interesting video game. If not, don't even bother. It's a fantastic experience that almost everyone can enjoy.",4.0
"Goofy checkpoints which make you unnecessarily replay big chunks of the game when you die and clunky, messy in game map.. Other than those two complaints this game is pretty damn well perfect and loads of fun!!!",4.0
"I was surprised and pleased with Mafia 2.  I went in without expectations (I picked it up for $10) and was satisfied in the end.  The story and voice acting are very well done and I liked the direction they went with it.  As opposed to many games that put you on the wrong side of the law, Mafia 2's story has a sense of realism to it.  Don't expect to do 10 missions and have more money than you could possibly spend in-game.  Money in Mafia 2 is earned the hard way, and every time you think you're getting somewhere in life (or the game, rather) things start to go awry.  I enjoyed the fighting (hand to hand and with firearms).  It's really satisfying when you canoe some dude's head in this one.  As a period piece, the game also does a good job, from the cars, to the radio programming, and even the liberal use of racial slurs.  A lot of time went into making the game ""feel"" authentic, and it shows.  Overall I would recommend fans of open world games a la GTA to give this one a try.",4.0
"I initially bought this game as a bday present to myself.  I played the base game and i liked it well enough to spring for the game of the year edition. Installation was easy enough and i had no issues with dlc itself. Aside from the occassional trademark fallout crash the base game and  the dlc went perfectly fine, mind u my computer isn't a sick rig since im on xp service pack 3. Having played all the dlcs, my favoriate one had to be poiny lookout hands down. The uniqueness of that dlc, compared to the others could not be matched, in my opinion. I gave this game 4 stars because, although the dlc ad ld more things to do, it is essentially the same thing round and shoot things. U spend alot of time running and or walking, ugh don't get me started on that stuff. Operation anchorage was beaten in less then an hour. Mothership zeta was also to short and very cliched and unimaginative. Poiny lookout was nice but wasn't expansive enough, and broken steel was a disapointment in so many ways. None of the dlc contents crashed for me. The price for this bundle was very resonable and it kept me entertained for a few days to a week tops, lol. I don't think ill be making the leap to new vagas, even though my pc can handle it, since i don't have the paitence to sit through yet again watch my character train for a runathon.",4.0
"When Oblivion first came out for the 360 i put 80 hours into, finished all of the guilds and most of the side quest, after over saturating myself i took 8 months-1 year break, and decided recently it was time to get back into it and I have beat Knights of Nine(which is also on this very same disc) and am half way through Shivering Isles.  And here we are...

Knights of Nine

-Good-

~Lengthy quest (5 hours), fun beginning, cool ending.  You get a new outfit with fairly nice benefits, nothing jaw dropping though.

~Kind of boss fight at the end in a cool environment(i don't want to spoil it)

-Bad-

~Half of the quest deals with you traveling all over the map to touch shrines(to become blessed), you have to find 8-9 of them.  You get a map, but the actual locations aren't marked on your main map so sometimes it takes longer then it should to find one.  Became some what tedious.

~More fetching type activites then actually meeting interesting characters, go in this cave to find this, go to this other cave to find that, etc...

~Everying thing besides the new boss where you fight the boss, and armor, you've seen before.

Shivering Isles

-Good-

~Very interesting story, great ideas and concepts.
~New environment, new weapons, new armor, new tougher enemies, great dialogue.
~Great main quest, and some entertaining side quests ( the first side quest i did; i was told by a distraught civilian that he hated his life and wanted me to kill him, but he didn't want to see it coming)
~You come across some interesting characters as mentioned above.
~Lengthy, i've put 15 hours into so far and am probably only half way done.
~Decent price, you get what you pay for, after all, $30 isn't cheap for an add-on.

-Bad-

~Review after review stats how different the two worlds are, mania(happy/energetic) and dementia(sad/angry), but honestly, they're not that different.  Don't get me wrong, you can tell which is which, but it's not nearly as extreme as i was made to believe.  Let's take leaves off trees and paint the vegetation in darker shades and call it dementia.  So far that's my only complaint.

For $30 this is a good deal because you actually get what you pay for.  An additional 30-40hours to an already extremly lengthy and well made game.  One side note, i bought this game downloaded it onto my 360, brought it my friends place and downloaded on his as well(he also had Oblivion).  Therefore, if you know someone else who wants it you guys should split the cost because you just download it on your hard drive and don't actually need the disc to play the game(you only need the Oblivion disc).",4.0
"Obviously the pricing isn't ideal. However, I would suggest if you haven't decided on a memory card size yet for your Vita then do yourself a favor and pick up the 32gb. There was a 4gb card with my Vita but I knew it was too small so I went and bought an 8gb. I had hoped that this size would last for awhile and save me the money from investing in the large size. It didn't.

Between the content in the Playstation store, movies, and music you'll probably end up storing on your Vita the 32gb is the only answer.",4.0
Please see my review of the Platinum edition of this game for my thoughts about the game itself. The one advantage to buying this copy of the Gold is that it comes with a printed manual. The hardcopy manual is far more convenient to use as you do not have to drop the game screen to open and read the electonic pdf file that comes with the Platinum one. Probably would be different if I had a 2 screen set up for my PC.,4.0
nice,4.0
"I had been looking forward to this game ever since it was announced.  I loved the Stick of Truth.  That game got me interested in turn based combat games, a genre I never thought I would enjoy.  My hopes were very high, perhaps too high for the Fractured but Whole.

I'm sad to say that this game is not nearly as funny as the Stick of Truth.  There were some laugh out loud types of moments in the first game.  The humor in the Fractured but Whole fell flat though.  There was only one point where I laughed out loud.  The rest of the humor either completely missed the mark or occasionally made me chuckle to myself.  Even the character classes fell flat.  In the original, you could play as a Jew.  Since I am Jewish, I enjoyed playing as the Jew.  The classes in this game all felt very trite and it was like the creators didn't even try to be funny in coming up with the classes.  You develop a character sheet throughout the game, but those choices have no impact on how the game plays.

The one improvement over the original is the combat mechanics.  They are much improved over the original version.  It's still turn based, but you can move your character to different spots on a grid, as opposed to staying in one place.

There is nothing broken in this game. The combat works well and exploration is fun.  The game just isn't funny and the story isn't interesting.  I was shocked that after several years of development, this game fell so flat.  It's also relatively short.  I explored all of the nooks and crannies and completed all of the missions in about 25 hours.

Overall, this game feels mediocre.  It's only mildly entertaining.  I recommend picking up a copy once the price comes down, but to me, this game is not worth the new-release price.  If you haven't played the original, I highly recommend picking up a copy.",4.0
"I couldn't decide between Mad Max and Gear Solid V and I went with Metal Gear on launch.  I'm a casual gamer.  I'm not into stories or get in depth with characters and backstories.  I want to play a game not watch a movie.  Games should be games.  I'm a huge fan of the Hitman Series, Just Cause series, Crackdown series, etc.  I like games I get get in blow things up for a few hours and get on with life until my next couple of hours of gaming.

Saying that,  I never got into the Metal Gear series because I didn't want to sit through 9 hours of cut scenes.  THIS Metal Gear DOES NOT have the cutscenes like previous games and in fact, it stuffs the back stories, main elements of the story into analog tape files you can listen to at your own leisure.  This games is PACKED full of side missions and main missions, as well as, a mini-game fixing up your mother base.  It's a game though first.  In every way imaginable it's pure gaming heaven.  You can take on each mission or side mission one at a time.  Which means, I can spend two hours playing a mission and walk away feeling satisfied.  Considering I'm a casual gamer this game could literally take me a year to beat and play all the way through (side missions and everything).  Honestly, I don't even pay attention to whatever story is in the game, I don't really care but that's the beauty of it.  They built this game to be pure game first and story second.  That hooked me because gaming is what I want in some spurts.

I will say this, I ended up buying Mad Max.  I was reallllly hesitate to buy it based on all the bad reviews.  I was on twitch watching a guy play Mad Max and asked him, which game do you like better?  He said Mad Max hands down.  I couldn't figure out why.  So I bought it used at Gamestop (So I could take it back if I don't like it).  IN ALL HONESTLY, I LOVE MAD MAX better than Metal Gear Solid V.  I'm going to get alot of heat for this but I do.  Gamers that like Just Cause, Crackdown type games are going to LOVE Mad Max.  People that want to find loot, upgrade your character and car with special moves and abilities, if you like massive explosions and brutal fights and you only have a few hours to play every night or week, MAD MAX is to me....  addicting.  I'm having alot more fun play Mad Max then Metal at the moment.

I bought the Witcher 3 and played it for a week and was bored out of my mind.  I just couldn't do the story and riding the horse bugged the snot out of me.  I returned it and bought Batman.  I wanted to love Batman but returned it.  I bought Metal Gear and love it and will keep playing it, perfect couple hour spurt game BUT I ended up settling on Mad Max and love it.  It tickles all the right gamer buttons for me.",4.0
"While I enjoy this game it's just not the same as Spore. I understand they wanted to try and go with an Action RPG style for it, but that was what I loved most about the original Spore is that it didn't force you to follow a story or layer on complex controls. This game is pretty awesome and I intended to finish it, but it's not gonna be at the top of my backlog of games to finish.",4.0
"The Just Dance franchise continues to strike gold: this game follows along in the tradition now of good, fun family games, but this version does have some negatives. Note especially that this game is made up of downloadable content from Just Dance 2, so you don't necessarily have to go out and buy this as a whole set, simply select the songs you'd like online. However, if you want a hard copy backup of these tracks, this is a good idea. All in all, as I see it, this game can be broken down as follows:

PROS:

-FUN: There is no doubt that this game, like all others in the franchise, is fun. It's a great way to get members of your family dancing together, having fun, and exercising at the same time. Song selection, as always, has something for everyone, so every member of your family will enjoy some aspect of this game.

-COORDINATION: The coordination of the game with the Wii Remote is as with Just Dance 2. That is, this is a very good game in that the movements you make with your Wii remote are very accurately picked up by the Wii sensors.

-HARD COPY: The benefit in buying this as opposed to online, of course, is that you have a hard copy should your hard-drive crash.

CONS:

-EXPANSION PACK SIZE: As an expansion pack essentially (you don't need any other version to make this work, however), it only has a fraction of the games present in an original ""Just Dance"" game. The tracks are listed above however. They are fun, and this  game is priced reasonably enough considering the track size, so don't hesitate to buy it if you are looking to increase the number of tracks you possess.",4.0
"Socom 3 as you all know is the sequel to Socom II. They have improved the gameplay somewhat and the Single Player is funner in this game than Socom II. When you go online and register a name, they ask you for a credit card number to get a rank, stats, friends list, etc. What the heck! Oh Well. Another bad thing is that there is no maps from Socom II which was disappointing. All the maps in Socom 3 are from the Single Player Missions. A good thing is that there is better hit detection than Socom II and there is more weapons and attachments like scopes, front grips, M203's, etc. Also you can swim and dive underwater. Finally they have vehciles and tanks!  I'll break it down for you.

Graphics: 5/5 They have certainly improved the graphics in this game from Socom II. All the gun models are very nicely done along with the vehciles and tanks.

Sound: 5/5 The explosion and gernade effects are nice. Also the sound movement. When you are crawling through bushes, you can here the crunching noises and when you're in water as well.

Control: 4.5/5 They kind have mess with the controls somewhat, but good overall. There is some of control options you can adjust.

Fun: 4/5 Overall Socom 3 is fun, but it doesn't have the replay value as Socom II does. It gets a little repetitive sometimes and has some lag issues. And online, the stats never count and the ranking system is screwed up. Look at the message boards on Socom 3 and you'll see what I mean.",4.0
"She just started watching pokemon and wanted to play the game so I bought her a copy of this game, she likes it but shes having a hard time grasping some of the concepts which is why I gave this 4 stars other wise it shuts her up for an hour or two after I pick her up from school.",4.0
"I have enjoyed this game immensely. It is beautifully executed, has just the right amount of difficulty, and broadens the FPS genre. The use of sound in the game is particularly interesting - I would say this is the first game in which I have noticed the design of the sound, and how much it adds to the game overall.

This is a linear FPS. The creativity comes in deciding how and with which weaponry you can defeat the enemy. I don't think you can just blast your way through. You actually have to plan your use of death-dealing machinery.",4.0
"On almost all of my wii posts I say the same thing. If you want graphics you need to buy an X-box 360. Nintendo wii market is not for those looking for HD graphics that make you think you are in the virutal world. With that said, this game is a lot of fun. My youngest son (age 5)plays it and likes that it is an ongoing adventure. You navigate your way through the set to reach various levels by fighting, eating, and running around. Loads of fun, even for me at thirtysomething.",4.0
"Everything is great, the only issue I had is as a adult male I would say these are too small. Great size for medium to smaller head sizes.",4.0
My son has the other The Show games and he says that there are some stuff that 13 doesn't. It has the Rawlings on the bat and he likes it a lot and enjoys the game as well.,4.0
"The graphics, amount of characters and special moves, amount of fighting options, and sheer quality of this fighting game is borderline crazy. You get so much for a portable game thats two inches square.

Having Street Fighter with over 30 characters for on the go is awesome. You cant ask for anything more... well you kind of could.

The only thing that stinks in this game, and its a big stinker, is the control. On a console controller or in the arcade i could bust out 50 fireballs in a row without a sweat. This game is a different story. The small size of the GBA/DS makes performing these special moves extremely tough. After 10 minutes of this game i feel like i need Bengay or some cream from the arthritis that this game is giving my fingers and hands. ;)

All in all this is a terrific title for short periods of time even though the control of some of the moves are painful to pull off.",4.0
"No issues, this was exactly as advertised.  The cartridge works perfectly (the game plays and saves), and is in good shape.",4.0
very good,4.0
