reviewText,overall
"More sonic re releases.  I think we've played Sonic 1,2 and 3 if we wanted to by now.  Same with Sonic an Knuckles and the rest of the junky games you get on this disk.  It's not worth the money unless you see it for 2 dollars at a garage sale.",2.0
"I never could get in to this game.  I think the ""top down"" view just didn't seem right to me.  Plus the graphics aren't all that great.  This game basically fell into the large pit of boring PSP games that everyone complains about.  I can't think of any redeeming qualities that this games possesses.  It's just boring.",2.0
"not what i was expecting... the first Condemned was a pretty solid/decent game but this one was a little slow, boring and really repetitive! don't waste ur time buying this one.... its a let down",2.0
ok I guess,2.0
"Oh dear, where do we start. My brother bought me this game on a whim because he found it for four dollars. Where did he find it? donno. But apparently four dollars can buy you one hell of a frisbee.

Graphics:
Obviously, the first impressions of a game are going to be the graphics. Being released in 2006 should give you a vague idea of what it looks like.  It's kind of stuck between current and next generation engines. They just missed the mark. Not incredibly bad, but no wow factor, especially for today. Being able to see heat is probably the only notable thing about it. Think Far Cry meets Call of Duty... 1. Actually CoD1 looked better than this.

Story:
Laughable. Even for a videogame. I swear a 9 year old must have written this monstrosity. Something about super soldiers, rebels... and that Nazis have to die. I honestly have no idea what it is about. Honestly. I think you play as a german in WW2, but you fight against germans. That's about as much as you are going to get out of it. Then they go off and kill off the only character that you found remotely interesting in a weak firefight... but i swear you see him later in the game... or that may have been someone else... I don't know... all the character models look the same. But in all seriousness, they don't explain ANYTHING. It's a clusterf*#% of bull$@&%.

Game Play:
Run of the mill FPS. You run, you gun. You spray, you pray. The inventory menu is something like PREY where it shows you what weapons you have up top, but you can only carry one of a certain type of gun. That's lame. I mean, I want the cool heavy machine gun, but I only have 7 bullets for it, and I KNOW I'm not going to find any ammo for the rest of the level. So I have to stick to the gun that every german soldier that I encounter has so I have plenty of ammo, but it has terrible aim and I need to unload an entire clip into a guy to bring him down. Stupid. Just let me carry all the guns. The story is unbelievable enough; let me believe that my ""super soldier"" can rambo it and carry loads of steel. Also, the enemy AI is a tad too aggressive. Especially when you can spit more accurately than shoot. This is the first FPS I've played where aiming down the scope doesn't actually help. You walk into a room, or stand in front of a door, and you know a handful of baddies are going to run in, and they all know exactly where you are. Even when you are hiding behind something, they pour bullets on top you with pin point accuracy. Maybe I'm supposed to make use of my 'superpowers' or should I say 'superpower,' the time shield, an interesting concept. By pressing the Q button, I can put up a blue bubble around my character that stops bullets from reaching me. Okay that's pretty neat, but give me something else! Geebus I was bored with it by the second stage, in fact I forgot that I even had it because it only lasts a few seconds before it has to recharge. And what's with the HUD? I can understand the health and ammo numbers, but what's the blue bar? Does that have something to do with my time shield? What are the skulls and symbols for?! SOMEBODY CLUE ME IN ON THIS... PREFERABLY THE DEVELOPERS! and saving... don't get me started. I got hella far in a level, and had thought that I hit a check point because a small message appeared when I reached a certain area. But when I walked up a stair case some nazis shot something that exploded right next to me, killing me instantly. I thought to myself, 'okay, that's alright, the devs probably just wanted to make it fun by having me learn from my mistakes and retry the area knowing the ambush awaits.' However I was pleasantly pissed when I found that I had to restart from the beginning of the level. I shut it off and walked away. I can only take so much crap in one sitting. Is it so hard to make an auto save feature?

Level Design:
...or lack there of. Each location is tedious and awful. Some doors open up to rooms with absolutely nothing in them, no ammo, no health pack, nothing. Just some chairs, and maybe a window. They serve no purpose and in these types of games I don't exactly feel like exploring. This beats the doors that don't even open. I normally wouldn't nit pick at that, but when the doors that are painted onto the walls look EXACTLY like the ones that do open, it gets a little frustrating. Change the color, put a symbol on it, make it flash, SOMETHING. The general layout of each level is either predictable or awkward. Narrow alleys, maze like complexes, long stretches with no cover, it never ends.

Audio:
The FX is decent, but the voice acting is what I really wanted to rant about. This is some of the, no this IS the worst voice acting I've ever heard. I would say you need to hear it to believe it, but I hope you don't subject yourself to this game in order to find out. Just take my word. It lacks emotion, proper casting, and general talent. Some say that it is on par with Far Cry, but i respectively disagree. It's so far below, and I thought Far Cry's voice overs were awful. I cringe every time the protagonist speaks and the female lead does a wonderful job at making me laugh with every line. The Nazis don't help either. They sound remarkably like... Americans.

Bottom line, this game is not worthy of your time, nor hard drive space. Even if it were gifted to you, I would say it could be used for something else, like replacing that sugar packet that stabilizes your kitchen table.",2.0
"Bought the controller in March. Now it is completely unrecognized in Windows. No lights come on when connecting it, even to other computers. It's a shame because my previous Afterglow controller lasted probably 5 years.",2.0
"Like others said, it's a $30 game (at most) with a $60 prices tag.

Pros:
- Excellent Graphics
- Good controls
- Online Battles are fun (though get old quickly)
- One of the only PS4 games that allow single-console multiplayer, (I WANT MORE OF THIS!)

Cons
- NO story mode what so ever.... I mean really? Nothing? From a franchise that is built on story... I mean sooo much story they somehow couldn't come up with anything for this? Even a one-to-one story of the original trilogy would have been better than nothing! Minus 1 Star
- Maps are quite small, and not enough of them. Minus 1/2 Star
- Extremely limited on what you can actually do, you pick where you want to battle, you pick which character you want to play as, and that's basically it. Minus 1/2 Star
- Single console multiplayer doesn't have nearly as much content as online multiplayer, in fact most content is reserved for online play... turnoff for me, especially if you don't have an online account. Minus 1/2 Star
- At $60 I was expecting a lot more game. Waste of money in hind sight. Minus 1/2 Star

I got bored with it after about an hour of playing. The $15 single console multiplayer game I got to justify multiple controllers was more fun than this. If you want a real game go buy MAD MAX, I got that game for less than Battlefront. Its perfect for those who got the ""disappointed because it did not live up to the hype"" blues. Granted, no multiplayer but hell of a good story compared to none at all.",2.0
"I have to admit, for the 10 months that this headset (which I purchased for about $120) was functional, it sounded great. Other than it being a bit uncomfortable (I have a larger head with a hat size of 7 3/4) and a little warm on the ears, it was very solid and I was pleased with it.

After 10 months of use, however, the right can popped right off while removing it from my head. I'm not hard on peripherals, I store them carefully and be sure they aren't dropped - there's no reason the can should have broken off. After some research, I've learned I'm not alone, that many folks have suffered from this design flaw.

In short, good headset, but for the price it should be considerably more sturdy.",2.0
"After working through an arduous verification routine and dealing with customer support I was able to get the game to work. I played the games for several hours hoping that I would experience the same fun that other reviewers expressed but it is just ok.

Nothing groundbreaking here. It is basically the same game as the first StarCraft with better graphics. In some ways that is a good thing but they could have done so much more. It ended up being repetitive and boring and I soon lost interest.

We'll be seeing this game in the bargain bin.",2.0
i am a call of duty[MW2] fan having good controller is absolutely necessary so i bought this product thinking it would enhance my gameplay  but i was wrong.this controller feels right it's very sturdy pairs easily with my ps3 but when playing online i noticed that aiming was very difficult this product does not give you the precision aiming like the sony controller especially long distance kills overall this is a good controller for basic games but when it comes to CoD[MW2] i would recommend sony controller,2.0
"I've been playing PC games since around 1991, well before Windows came out.  The first Max Payne was a world changer, and MP2 was even better.  With these games, I don't use multiplayer at all, so I can't comment on that part of it.
But for the Single Player, for me the game is ruined.  First off, I don't like games that have no Player Saves.  This one has way too many and too long graphics movie segment.  In some places, all the movement from one scenario to the other is a cinematic set piece, so there is little problem solving necessary, which is part of the fun  of these games for me.  The player is then thrust into a shootout, without any familiarity with the locale.
If you like only the shooting part of FPS games, you'll likely  like this game.  If you  like a complete game experience, including solving the problems of landscape and strategy, they've removed most of that from the game.  It's a shame.",2.0
This is not a game it is a completely computer rendered movie with good Dialogue decent story and wonderful music.  The problem is I play video games to play and this title lacks gameplay in a woeful manner.  You switch modes so there is some upclose gun battles alot of em in fact thats all the gameplay really consists of besides wandering around.  The hunting mode is fun for about ten minutes until you master it.  I would buy this game for under  twenty bucks and be happy with the entertainment value I got from the FMV's and the soundtrack both of which are incredible.  If you are looking for a scary little movie that you push along you might just like it but rent first.,2.0
came deformed. Rubbed controller. Good grip though.,2.0
its very boring and its not easy to undrstand,2.0
"Spider-Man has been in a lot of games in his career, from his first adventure on the Atari to the recent game for the Playstation. Between the two, this Genesis game came out and it didn't exactly set the gaming world on fire. What you're looking at here is a very average game that doesn't do our friend Spidey justice. The gameplay is just too bland and repetitive for it to be fun. While it does have plenty of his best villians, it doesn't make it any more enjoyable. Graphics are good, sound is okay, but there are better games out there. Sadly, the Playstation Spider-Man game has been the only game to truly capture what Spidey's all about. If you have a Playstation, pick that one up. But for you Genesis owners, you're out of luck.",2.0
"I bought the dreamcast with high hopes. Mostly because of Street fighter and sonic games. The only good games are Sonic Adventure 2 and Dead or Alive 2. Sega has made systems that all have failed. Like the recent Saturn. For the first couple of days its good.
Cons:
Very Loud
Not may places to rent games
Not many games
Not many demo disks
Pros:
Good Graphics
Easy Controls
Easy to hook up
Easy to hall around
Overall the dreamcast stinks. If your looking for a system with fair graphics,lots of games,good games,easy control i'd buy the playstation.",2.0
"MY OPINION:
I've tried to like the whole Dead Rising series but have ultimately never been able to last more than a few hours past the first few games and now this.

Combat is not that exciting to me due to the fact that it just doesn't seem very interactive its just slashing peoplw with a button etc. Sure the weapons are interesting but they expire.

At this point I'd save up for a different game instead",2.0
"I ordered this direct from Sony last Nov when it was released. After using it for both a PC monitor, and 3D game display for few weeks I noticed it would blink. The screen would flash black for a second or 2. It would happen once or twice a week so it wasn't too big of a deal, but I Googled the issue and found others had similar issues and faulted it to the HDMI. So I lived with it for awhile and tried a few different HDMI cables and still had the same issue. Still the problem was so infrequent, I could deal. Well over the past few weeks things have taken a turn for the worst and it not flashes at least 10-15 times per day. Is it dying on me already? Im calling Sony on this Monday, and hoping they deal with the problem. I've had nothing but horrible customer service from Sony in the past, so I fully expect them to give me a problem. Do not buy this TV. This flashing/black screen problem is very widespread. Just Google it and see for yourself.

""UPDATE!!!!""

Since this review I have contacted Sony. I gave them a call and to my surprise they didn't give me an issue. The sent me a box with a pre-paid label from Fed Ex so I could ship it back to them to get the problem fixed. I shipped this display back on a Friday, they got it the following Tuesday and shipped me a brand new one that day. After using the new 3D display for a little over a week, im starting to get the exact same blinking problems as the old one. Im going to hold off a bit before calling Sony back again. If/when this blink gets worse, I plan on calling them back. Two different displays with the same exact issue, plus countless complaints online about the same thing. Sony must know this is a major issue and to my knowledge hasn't even acknowledged it. I will post updates as to what happens.",2.0
Not what I expected considering the potential this game had. For a square Enix game for me it did not deliver.,2.0
"REVIEWERS NOTE: Throughout this review the product is referred to as Dragon Quest VII and not Dragon Warrior VII.  They're both the same game, but the truth is: the series is called Dragon Quest.  So don't get confused.  I also refer to the other games in the series as Dragon Quest and not Dragon Warrior.

Dragon Quest is huge in Japan.  The games actually have to be release on Sundays or Holidays because of how big they are.  The Dragon Quest games are not nearly as big in America.  The other Dragon Quest games are actually a real treat--particularly the SNES games that never made it to the states.  Dragon Quest VII does not hit the height of the NES and SNES games in any way shape or form, mainly because this game in particularly, does nothing to actually make the Dragon Quest games mature, and that's really sad.  It's great that they got it together for Dragon Quest VIII, but it can't stop the seventh in the series from being the black sheep of them all.

It's really sad to because of all the Dragon Quest games, the seventh installment is one of the only ones to have a satisfying storyline where things actually progress and you don't spend a lot of time running around so lost you don't know what to do.  It's not a deep story by any means, but it does have more focus here than other Dragon Quest games.  Because of the structure of the story, there's not too much you can explore from the get go, and thus you're limited.

The first thing about Dragon Quest VII that people will note is that the game looks absolutely horrible.  For a late generation PSX game going up against the likes of Chrono Cross and Final Fantasy IX at the time, this game looks like a rejected Super Nintendo game, and it may be because it was originally in development for that particularly system.  The towns look really bad, the textures are mostly pixelated, the character sprites look horrendous.  Simply put, this is just a terrible looking game.  The sound effects are even worse.  You'll dread each time you have to pick up a barrel and toss it.  You'll dread opening a door.  The games framerate isn't even steady.  The only thing to the games graphical credit is that some of the enemies don't look so bad, and that it's colorful.  Still, even for those who don't base their judgment of a game on graphics will have to take a moment to get used to just how terrible they really are.

The second annoying thing is the menu system.  It's the exact same one that was used in Dragon Quest VI, and it's just a pain to navigate.  In a world where games like Final Fantasy VII made navigating the menu as easy chewing food, Dragon Quest VII makes it a tedious task.  Characters are limited to what they can hold and I don't want to go into the nightmare of equipping and re-equipping characters over and over again.  The menu interface is absolutely horrible.  It seems like such a dumb thing to complain about, but in an RPG released on the Playstation, inventory management shouldn't be so difficult, nor should I have to spend more time in the menu than actually exploring a dungeon.

Combat is also a big problem.  It's not that battling isn't fun.  Firstly, you don't get into a battle for quite some time.  In fact, you'll spend the first couple of hours of the game roaming around not battling anything.  It'll be a miracle if some gamers can even hold out that long.  Especially because it's an RPG with little story exposition in the beginning.  When you do make it to that point though, you'll be met with mixed feelings.  For some odd reason battling is fun, but again, the graphics really make you wonder sometimes.  The battle system is essentially the same as it was on the NES and SNES.  The problem here is simple: This isn't either of the two systems.  I don't mind the combat being menu based, but the fact that you don't see your characters and that they don't physically go up and strike the enemy makes battling feel a little... empty and uninspired.  Some of the enemies actually look pretty good, but I'm bothered that the battle engine is exactly the same as Dragon Quest I from way back when.  Dragon Quest VIII certainly did a far better job in at least making their battles look good.  Here, you just feel as if you're not involved enough.  It's simple, and it is fun because the combat is surprisingly deep and strategic.  Even better the game is a challenge.  But all the while you can't help but thinking you're playing an NES game on a system that is capable of so much more.

They say it'll take you about 100 hours to plow through Dragon Quest VII.  The game is, in fact, huge.  There's tons of sidequests, and just when you think the game is getting stale, they do manage to throw something else at you that gets a little more involved in the gameplay.  The job system, for instance, comes along hours after you've begun your quest, but it adds a lot of variety when it's finally added in there.  Enough to keep you busy for hours.  What a lot of people don't mention about Dragon Quest VII, however, is that a lot of those 100 hours are spent on heavily raising your party to getting better levels and stats.  Dragon Quest is known for making gamers work, and Dragon Quest VII actually does that.  For example, the game will not let you overpower your characters job classes.  There's a point where they do cut you off and you have to advance forward.  However, you've still go to worry about their normal levels, and you don't gain a whole lot of experience or gold from these monsters.  Thus, of the 100 spent to plow through the game, you'll more than likely spend more than 50 hours just leveling up to take on the next challenge.  And Dragon Quest VII is not an easy game.

While the sound effects are bad, the music of the game itself is quite good.  Dragon Quest has always had good music and Dragon Quest VII is no exception.  The game falls short in almost every category except music.  Here's where the game truly shines, and not only that but Dragon Quest fans will recognize some fantastic tunes from other games.

The bottom line is simple.  Is Dragon Quest VII a good game?  The answer is surprisingly, yes.  You just have to really be able to get passed the fact that you're playing an NES game on a system capable of so much more.  Simplicity has kept the series alive at least, but the game seriously looks like a rejected SNES title that they felt they needed to dress up in tattered clothes and shove onto the Playstation.  The game isn't bad, it's just that by the time Dragon Quest reached the seventh installment, one has to wonder why the developers didn't actually make it look or play like a Playstation RPG.

If you can look past the NES appeal, Dragon Quest VII is a great game.  It's fun to battle in (despite it's graphics).  There are tons of mini-games and sidequests to do, and there's so much variety that you'll want to play just for the sheer fact that you KNOW you haven't uncovered anything.  Still, the old school nature of this game is going to be hard to swallow, even for old school gamers.  The game is slow, the menu system is horrible, the graphics are subpar, the battles feel like you're doing nothing.  With these kinds of cons taunting the game, it's hard to recommend it even to die hard Dragon Quest fans.  Fun to play, but it's asking a lot gamers to look past its glaring shortcomings.",2.0
"I will start by saying that my sister is an addict of this game. So is my friend, who has not only moved into town but has already payed off and made an addition to his little virtual house. I, personally, can't stand this game.

I have played this for maybe 30 minutes, and that was enough for me. Very slow paced and boring.",2.0
"SO. I am a mouse freak. I'm a collector for some reason. My favorite mouse of all time is my EC1-a by Zowie.  My hands are 22cm. Other mice in my collection: Razer DA Chroma, Logitech G303, Mionix Castor, Mionix Avior, Zowie Benq FK1, Zowie ZA12, SteelSeries Rival, Microsoft Intellimouse 3.0 [rip :( ]. Received the Finalmouse 2016 a few days ago. I wasted my money but luckily for me Amazon has a great return policy and I'll be getting it back. Luckily for you, I'm here to save you money and hassle by telling you to avoid this product.  First off, let me say that through testing this mouse, the performance was great thanks to the implementation of more smoothing in the 3310 sensor which actually I didn't find attractive, personally. Nothing new about the shape. Same old generic OEM shell slapped with a 3310 sensor and sold for 3 times the cost with ESports written on the package. I haven't had the 2015 but I've heard about the poor quality in several batches. Unfortunately folks this one is no different. The side buttons are bad. Real bad. They are a bit loose and rattle when the mouse is shaken. You can also see the white light from the scroll wheel LED in the gap between where the side buttons and the shell itself. The weight sure as hell isn't 74g either. More like 84-87g. Another issue: the left click and right clicks are like loose teeth. Especially the left mouse button. It is wobbly and makes me feel like I'm playing with a cheap 13 dollar mouse (well, because it basically is). They are also horribly soft and way too easy to misclick. Cherry on top: my hands are too large to hold this mouse comfortably. If your hands are 21cm or larger and you're a hybrid claw grip player you won't enjoy the shape. The right side needs to be flat for me. I can't stand the ""ergonomic curvature"" of the atrocious glossy right side. You CAN NOT have this mouse on your desk and feel good about it. At least I can't. And like I said, I collect these things. Filed for return. I'm looking forward to Zowie hopefully putting the 3360 sensor in the next refresh of the ec series mice. I'm also looking forward to more 3360 mice to hit the market. This will be the Finalmouse I ever purchase from Finalmouse.",2.0
"I have been a 2k fan since 06. I watched the game go from good to great then ok. The game, gameplay wise, started declining slowly since 09. 10 and 11 had the real true crew mode which was very fun, although, I played myplayer pick up the most. The games are very buggy and the online servers are complete trash. Now they packaged a false crew mode and reduced your attribute caps so they can nickel and dime your with jewelry and game boosters. Damn 2k has changed into a EA like company.",2.0
"Let me begin by saying I loved SSX on other systems, namely Gamecube. This has bad, unresponsive controls. I like games that are easy to pick up & play-don't have too much time to spend learning controls. And, I have been gaming for years; but, the graphics are only ok.",2.0
