reviewText,overall
"Ether One is an interesting title.  While many would call it a ""Walking Simulator"" these days, it's actually a bit more involved than you would think.  I'd love to give Ether One a glowing recommendation due to the incredibly tough subject the story tackles about dementia and the effect it has on individuals, but I'm unable to recommend this title on the Playstation 4 console as it is completely broken.

As a collector, I am currently attempting to obtain all titles published by Soedesco as I am finding myself falling in love with many of the independent titles they're bringing to consoles.  Ether One caught my eye when I came to this page and saw one of the developers (Pete Bottomley ) attempting to get more information from people claiming the title was a buggy mess.  This interest the developer was taking in an attempt to fix this port, quickly lured me into a purchase.  Just to clarify in advance, I purchased this game knowing full well that I was going to experience a game that was nearly impossible to complete due to several game-breaking bugs that I already read all about before purchasing it.  As a gaming enthusiast, this was my attempt to provide the developers with as feedback as possible, so they can get this brilliant title running how it should.

I will now proceed to provide that feedback here as I do feel as a consumer, people should be warned about what they're potentially getting themselves into if they decide to purchase this title.  There will be no spoilers regarding the games story and while I was unable to finish it myself-- I saw several videos of people completing it on Youtube (so I could see the story through) and read the other plot points on the games Wikipedia page.

My first hour within the world of Ether One was smooth and I thought I might get lucky to not encounter any issues after updating to patch 1.02.  It wasn't until I took a break just a few puzzles before the dreaded ""candle puzzle.""  I saved my game from the menu and uploaded it to the cloud as recommended by the trophy guide, due to the games extremely high chance of bugging.  When I returned to the game a few hours later; upon loading my file, I immediately noticed the sound was glitching.  Various sound effects were popping-in and out rapidly; I paused the game and calmly reloaded my save.  This resolved the issue-- or so I thought.  While following the platinum trophy guide on Youtube, I noticed that one of the characters that speaks to you throughout the game was not speaking on my game and her subtitles weren't showing as usual.  I knew this was bad news, but I pressed-on as it seemed like the puzzles were still allowing me to proceed.

I proceeded with extreme caution at this point and began saving on save file 2, in an attempt to keep my one good file that was working fine before I took a break.  As I proceeded to the candle puzzle I mentioned above, this is when things began to plummet quickly.  Following the video walkthrough (and several texts faq's), I was completely unable to get the puzzle solved.  The projector that is supposed to repair itself, would not do so-- regardless of any actions I attempted from the various guides.  This is when I began digging deeper on this puzzle specifically.  I found dozens of threads on Steam about some desperate individuals even attempting to restart the entire game and were still unable to complete this puzzle upon their return.  I followed any trick people said they got to work for them and still had no luck.  In a desperate and anger-filled rage, I began placing the bible on any flat surface in the area and frantically lighting candles and then quickly blowing them out; after 20 minutes of mindlessly attempting to trick the game (by using quick and frantic actions)-- eventually, it worked-- the solution made no sense as the correct amount of candles were not even lit and the bible was not on the correct podium as instructed by ANY guides.  I thought I may have been in the clear as this was the most discussed bug in the game.  I was very, very wrong.

This would happen several more times during the game and the final straw happened just about an hour before completing the game.  It was always a similar situation.  I noticed it always started around the sound glitches it seemed.  Every time the audio popped or characters would stop speaking like they were suppose to (based on the guides I was following), I knew I was about to get the game-breaking bug.  Every time I knew I was going to get hit with it, I did. I would complete the puzzle and since the audio effect that occurs when completing a puzzle wouldn't go off, the projector wouldn't repair itself so I could move on to the next puzzle.  At several points, I actually heard the audio queues and the projector still wouldn't do anything.  I could even scroll down in the video guide and see people complaining about the same bugs in the Youtube comment section.  Some people getting by just fine and others furiously leaving their frustration behind.

It seems the game just doesn't register the completion of its own puzzles correctly.  Not only are some of them so obtuse (I seriously don't know how some people figured many of them out at all), but everyone seems to complete them differently-- and it's not that the puzzles are random, they're simply just broken.  The projectors never seem to trigger consistently, every time that one actually repaired itself without having to reload a checkpoint, I was thrilled.  That is how exhausting it is to play this game on the Playstation 4.  It seemed a lot of PC players are still struggling with the candle puzzle, but that version sounds far less broken then what console gamers would eventualy receive.

From what I hear, it was more of an issue with the developers jumping from Unreal Engine 3 to Unreal Engine 4.  Even with that sympathy in mind, I'm still not quite sure how they didn't catch this.  Ether One needed several more months before being launched.  Especially, as a free PS Plus title; I'm even more shocked that Sony (with it's stricter QA policies) allowed this one to get by.  The digital version suffers from many of the same issues, it's not unique to the physical version published here by Soedesco.

Even with all this ranting; this game is worth playing, if they can manage to fix it.  I know how it ends and the story is fantastic and the voice-acting is some of the better I have heard from an independent title.  The game looks beautiful as well and the color palette is stunning at times.  I was most impressed by the games steady framerate.  I mean, it runs perfectly-- until you encounter one of the many bugs that is!

While I am determined to get through the bugs and complete my save file of this title, I can't say I'm not disappointed it turned out even buggier than I could have imagined, even based on what I read.  Mr. Bottomley, your team has far more work to do; though with that said,  I'm fascinated by the daring attempt at telling a story of this magnitude and complexity.  I highly anticipate the teams next venture into this entertainment medium and hope these issues do not haunt your talented studios next amazing project.  Good luck and until I can report otherwise, proceed with extreme caution gaming enthusiasts!",2.0
"No way near the caliber of the Michael Jackson Experience.  Just Dance 2's graphics are cheesy and most of the dance routines are silly. The dance routine for the song ""Funkytown"" is completely ridiculous.  After playing that song I wanted to throw the game away. Many other songs have mediocre dances to them.

After excelling at the Michael Jackson Experience, I found it difficult to adapt to the jerky dance styles in this one.  There is no emotional connection to the dancers.  The dancers just come off as being annoying and silly.......and they want us to mimic their hair-brained dance moves.

Just Dance 2 is definitely a fun party game and a great work-out.  Almost all the the music is upbeat and very nostalgic, with hits from the 70's (and possibly earlier) to now.

In my opinion:

Pros:
Fun party game
Great work-out

Cons:
Cheesy and slightly ugly Graphics
Song list contains a few extremely odd song choices
The dancers' hands look like blobs of color most of the time and it's hard to tell how they are specifically positioned during the dance.
When correctly performing a Gold Move, the Wii-mote does not vibrate like in MJ Experience.
Most of the dance routines are silly and consist of jerky movements which don't seem professional",2.0
"Had this mouse for 3-4 months. While it worked, it was great. I didn't write a review because all of the other reviews echoed my thoughts on it. A great mouse while it worked. However, it is currently broken (after about 150 hours of use). The drivers aren't recognized by any computer and some troubleshooting revealed that a lot of users get the ""(device descriptor request failed)"" message, which means something inside the mouse is broken.",2.0
"- Making the combat system dependent on one-time use stickers was a colossal misstep, especially when some stickers have a very low drop rate, meaning that it's difficult to master certain moves
- Kersti (the Navi of this game) gives completely useless hints when a puzzle isn't completely obvious. In general, the game and its use of special items (bowling balls, fans, etc.) doesn't attempt to give any sense of hints. If you don't have the right item for a boss, you could be SCREWED.
- One particular area of the game stretches on forever (World 3). This section seems artificially lengthened to make the game seem substantial.
- There's no advantage to combat: you don't level up, you don't get incredible drops (most of the time), and you lose the stickers that you use in battle. Guess they forgot what made 'Thousand-Year Door' one of the best games on Gamecube.",2.0
Good movie if your into watching movies instead of playing video games.  To me it was like watch movie pick choice watch movie pick another choice.  There wasn't much time spent playing a game.  I don't like watching movies when I am supposed to be playing a game.  I was bored and aggravated the majority of this game.,2.0
"The design and concept are very good.  The portability is nice and the design is sleek while supporting functionality very well.  However, as has been noted elsewhere, I began receiving ""Disc Read Error"" within 6 months of purchase.  Unfortunately, I was beyond the 90-day return limit for my purchase (from a retail store, not Amazon), and I only experienced a problem with select DVDs (all games worked fine), so I didn't pay the issue much mind.  Then, due to life circumstances, I rarely used my Ps2 Slim for about 8 months, outside of two Ps2 games that I played sparingly.

So... after that time period I came back to using my Ps2 Slim with regularity.  The problem had magnified, and now the system would only irregularly play Ps1 games, it wouldn't play most DVDs, and it started showing errors on select Ps2 games.  I keep all of my games and systems in good condition, so wear and tear was not an issue.  And as I'd mentioned, I'd only used the Ps2 sparingly in the months prior, so it hadn't experienced substantial use.

Anyway, the condition gradually worsened until it verged on unusable.  I contacted Sony about the issue, and they wanted to charge me $50 plus shipping to fix what was clearly their own defective product.  I ended up ditching it and (thankfully) finding a decent-condition ""chunky"" Ps2 to replace this dud.  So, ""buyer beware"" with this one.  This poor experience, particularly the lacking customer service aspect, has actually led me to think twice about purchasing a Ps3...",2.0
"-If you watch movies in the dark there is no back light.  Absolutely terrible oversight!
-The buttons are in an unexpected order.  They go Play, Stop, Pause instead of Play, Pause, Stop.  Hitting stop on accident will ruin your night, trust me.
-The buttons also go Scan, PREV/Next then slow-mo.  I would expect PREV/Next, then Scan, then slow-mo.
-Any button turns on your PS3.  Why not only the PS button?!  Turn on the PS3 on accident all the time...

+ Bluetooth, so sight lines don't matter which is cool.  Wish my other remotes were like this.

It's a remote and it works, not rocket science.  It's better than using the dual shock 3, but I wouldn't buy it again unless they added a back light!  That's 4 minus and one plus.  The lack of the back light is my biggest complaint.",2.0
This game is definitely too slow for me to enjoy. Gave it a 2 star anyways because I remember it was fun in the 80s,2.0
ok,2.0
"I mistakenly played Return to Ravenhurst before I played thee first Ravenhurst game, which is this game. I expected there to be some sort of gamelplay in this game, but there wasn't much! All I did was find hidden objects in different rooms and solve puzzles (which the puzzles, I didn't like much). There was absolutely NO exploring of the house or in the game, no gameplay. So all there was to do was 1.) hidden objects to find in a room and 2.) puzzles, but nothing in between!

If you like games that ONLY find hidden objects with no gameplay, then this game is fine for you. Just not what I prefer.",2.0
"Being a die hard nfl fan i always get madden on the release date. Even after hating the demo,buying the season ticket and hating that i still went ahead and buy this game. I pre-ordered on walmart.com and the only good thing that came out of getting this game was walmart sent me two copies for the price of one so i basically doubled my money.
To the game review
The graphics are very good,but the gameplay is terrible. Its super unbalanced.
The passing game is super hard and the rushing game is super easy. In my franchise mode i used matt ryan and had 2tds and 11ints after playing 3games. Its not me since iv seen allot of people saying the same thing. Every time you will throw it it will get batted or picked.
The rushing game seemed unfair just as much. I had adrian peterson on my team(i do fantasy draft)and after 3games i had 500yards and 10tds but not one broken tackle. You cant truck anyone at all. All it is,is breaking through holes.
The commentators are pretty bad as well. They say the same thing about the same player over and over and over""karlos Dansby out of aurburn is a really force to be reeking with""every single game. Also gus says a few racist comments like when a black guy is running for a td he says""hes got run away from the cops speed""
The new thing iv heard about this year was the team entrances but they are pretty lame. They make the game like your watching it on tv but not once have i watched a game and you see the team running out like they do in madden12.

Overall this game is trash. After hating madden11+12 i may be done with madden all together.",2.0
"I was addicted to Contra as a kid.  On the old NES, there was hardly a better game, and I spend hundreds of hours on each one, fighting, shooting, blowing stuff up.  I was so excited for this one I could hardly stand it, and I didn't care if it was 2-D.  In fact, I WANTED the game to be exactly the same as the old ones. I bought the game, put it in, and started to play.
Then I got bored.  Fast.  I couldn't believe it.  I played for about 20 minutes and couldn't take it anymore.  I shot some stuff, but it just wasn't fun.  One of two things happened.  Either this game is horrible compared to the old games, or I just plain grew out of Contra.  I hope it's the former.
This game is hard, but in a frustrating way.  I don't recommend buying this game--rent it once and you will be sick of it before it's due back, even if you're a die-hard Contra fan.",2.0
It wasn't really what I thought it would be. The humor is bleh and the gameplay is repetitive and gets boring really quick.,2.0
Worked for 3 months and now its dead. Vita can not even read or recognize it.,2.0
"A great board game / RPG combo.  The game creators had a great sense of humor and the art is really fun.  You work your way around the world to save it from evil, bashing each other all the way to try to stay on top.  The game uses rock-paper-scissors as it's base and all contests seem to be some form of this game.

The game is balanced to be rather easy to play, expect to kill a lot of the bad guys in one hit.  To balance this the creators threw in tons of ways to curse and hinder each other.  It make cooperating almost impossible, the best you can do is avoid hurting each other, but even that is inevitable sometimes.

The game is rigged to boot, even if you're a halfway decent player, expect the game to pound you to pieces to ensure you never get out of last place. It's designed for whoever is the game's 'favorite' of the chapter to pull ahead, if you're not the favorite then there's little hope to get anywhere.

It's really sad because the game has so much awesome packed into it! But rather than having an honest random number generator, it's got that rigged nonsense that will leave you trying to get into a castle for months on end while the AI's zip around the map getting perfect rolls every time.

The game also gets a little crude by having the girls wear next to nothing in some of their outfits. Quite lame.",2.0
"I really loved FEAR and had high expectations for FEAR2, and was very let down. First of all, it doesn't look any better, and possibly looks worse than the first one. The AI is ridiculously dumbed down, and you can tell there was little work put into the PC version. It was practically impossible to get it to recognize my mouse buttons, and had to work around it by mapping keys in another program to my mouse buttons, then mapping those keys in the game. The other problem I had was the requirement of Steam. I do have Steam, and love it, but what about people who don't want to use it, or don't have a dedicated connection? This game fell to the wayside after less than an hour, and I don't plan on giving it a second chance for a long time.",2.0
What you see on the cover is what you get. It's all blood and gore with no skill or interactivity involved. It's a one player mode game with the same repetitive motions.,2.0
"Purchased these for my 9 year old son for Christmas. We both game on an Xbox One. So I have used these a little bit as well. We don't use these heavily. Maybe 4 times a week for an hour or so and than they are put away in a safe place.
Using them right now and had to finally leave a review. They are comfortable. But Sound would be great. If it was t for constant crackling. I haven't heard so much distorted noise and crackling since purchasing a cheap pair of in ear headphones at a gas station when I forgot mine at home.
I don't know if we got a defective pair or what but at 50% volume every little noise comes with some distortion. Reading so many positive reviews we must have gotten a bad pair with a blown pair of speakers or something.",2.0
"Bought 2 of these for my Wii.. buttons seem a little weird/clunky...
shipping seemed high...
1 just randomly stopped working after about 2 months.

eh.. you get what you pay for",2.0
"My 7 year old is mario crazy and wanted this game, worked fine, just not sure it really compared with some of the newer Mario games and he lost interest quick",2.0
"Nothing special. The king of Disney should be playable in every playset. Attacks are lackluster.
Getting tired of figures that are only usable in toybox.",2.0
"Tiny bottom friction surfaces, cheap feeling. Terrible cord.

They have stripped away all the quality of the previous versions of mic with this sensor.
The precursor was much better make.

Not recommended.",2.0
"I bought a pair of these for my XB1 controller. It worked okay, but wasn't as good as I had hoped it would be. So I decided to do some research to see if I could find a better option. After a little looking, I found a better (imo) grip called Striker Grips, it is a little cheaper and seems to be a bit better too.",2.0
"MW3 the biggest launch in gaming history.  Supposedly the best,  but that is what the sheeple mainstream would have you think.  Ultimately I wasn't expecting much from this game from the skeleton crew of MW3, Sledgehammer games and their lack of FPS experience before hand and the fact that COD has become nothing more than a mindless run n gun with bad plots, forgettable characters, more explosions per frame than actual filler, not only this but BF3 blew me away.

The campaign is about 3-5 hours long on normal and probably about 7 on veteran.  It's your standard COD campaign filled with explosions and cheesy voiceovers, the singleplayer feels more like a COD deleted scenes with BF3's multiplayer in it.  What I mean by that is they try to hype it up to be WW3 but there's only about 3 missions with actual huge intense battles.  Everything else is just shooting galleries and corridor shooting.

I never tried specops in my 2 days playing this but I played MW2 so I think I get the gist of it.

The multiplayer is the same thing as MW2.  The only difference is theater mode, a few perks, guns, and maps.  Back in the 90s a game like this would sell for 30 bucks and be called an expansion pack.  It's fun don't get me wrong but as a game this sucks.  They haven't changed anything at all.  Besides from the killstreaks and terrible community there isn't really anything special about this game, it's got almost nothing going for it.  The maps make it so going with a rifle or LMG is almost impossible and the maps are tailored specifically for crackheads hyped up on doritos and mountain dew running around with SMGs.  All it takes to do good anymore is just to spray n pray with an SMG.

This is why Halo lost it's throne back in 2007.  It became a spray n pray.

If you can enjoy slow paced games with depth, substance, replay value and more fun buy BF3 or Skyrim.  It's too bad if this sounds like fanboyism but I wasn't impressed.",2.0
"I've always enjoyed the karaoke revolution games, but this one fielded a poor choice of songs. There is.. 2-3 Spanish songs, which makes me applaud the company for respecting diverse communities.. But come on, it's an English game! So far about 10 people have played this game, and no one has touched the Spanish songs. I would suggest American Idol encore if your going to buy a Karaoke game for the Wii, but to be sure you should check out each of the game's song list prior to purchase.",2.0
"For most games, for example, Wii sports , Wii kart and so on, the screen will black out from time to time, which makes the game almost unplayable.

Contacted Mayflash customer service, never got any solution to this problem.

Recommendation for people seeking a Wii VGA cable: try some other brands or use a TV set instead.",2.0
"Lately there have been a number of games made based on classic movies (From Russia With Love, The Godfather, Scarface), and they've all had mixed results, and for those expecting anything halfway decent out of the video game adaptation of Quentin Tarantino's debut film should steer clear of Reservoir Dogs.  The game basically runs parallel to the film, with many of the scenes from the film re-done in full CG effect, though many of the cutscenes look pretty bad.  Your job is to carry out missions based on events that you only heard about in the film; ranging from car chases, dodging cops, and above all, taking hostages to survive.  What's really sad about Reservoir Dogs is how quickly boring the game gets.  While you can choose to be a violent psychopath or a smooth professional criminal, either way the game gets pretty boring pretty quickly, and taking hostages doesn't really do much to the already lame AI.  The best thing about the game is by far the audio and voice acting, even if Michael Madsen is the only cast member to lend his voice to the game.  The graphics are choppy and the controls serve their purpose, but beyond that there isn't anything here that we haven't seen or heard before, and it hardly does justice to the source material.  All in all, even if you're a die hard fan of the film, this is better left on the shelf.",2.0
"My kids didn+t like this game... They love Minecraft, but not this one!! ;(",2.0
"I wanted to like this so bad, because Lego Batman 2 was incredible. It is one of the few games I completed to 100%. I only got into the first few chapters of this one. The storyline is all over the place, and it's just not as funny as Batman 2. The environments were not as well thought out as Batman 2, and it was a lot more cluttered and distracting. I don't mind a Lego game being difficult, but the checkpoints were so far apart that I found myself falling asleep a few times while I was playing it. When I start falling asleep on a video game, I know it's time to move on. Go for Batman 2 if you're just getting into the Lego video game series. It's one of the top 10 games I've ever played. Of all the Lego games I have played, here are my favorites (in order of preference):

1. The Lord of the Rings Trilogy
2. The first Indiana Jones Trilogy
3. Batman 2
4. The second Indiana Jones Trilogy
5. The Hobbit

Just FYI, I also gave up on the Marvel Superheros Lego game. Yuck. That one put me to sleep, too.",2.0
