reviewText,overall
"I played the beta for about 4 hours when this came out, and then I pre-ordered it from PS4 as a present for my significant others birthday.  Opening night I knew I had to work early the next morning so I created my character and went to sleep.
First off  I enjoyed the video clips, they were extremely well made and unlike in many games, I didn't roll my eyes and start button mashing to make them go away.  Next was character creation.  Im a female and if given the opportunity I will almost always chose to play a female.  I guess a little background here  I like RPGs and am VERY VERY bad at shooters.  If you are reading this you have probably killed me many times on Star Wars Battlefront.  I am at home on games like the Dragon Age series or old school Final Fantasy (PS2 and older). My man was able to convince me to try this by pointing out that it is advertised as an RPG.

So Character creation  There were 5 female heads to choose from and like 5 hairstyles (none of which included a pony tail, pony tails make perfect sense in the post apocalypse world). I tried making a Caucasian female that looks a bit like me only with a tattoo.  I ended up with a female that I think might be Asian and who looks like a muddy 12 year old boy.  Let us just say I was a bit let down by the character creator  but I pressed on.  I figured, this is a game designed for guys and most of them probably aren't worried about if they can make their person look like they want.  So after making my girl and opening up in Brooklyn  I went to bed.

Apparently this is when all of the servers crashed because I heard an earful about it the next day.  I would have had no idea because apparently they weren't down for too long.  I went to sleep and my man was playing, I got up at 6am and he was still playing when I left for work.  I got home from work and he was so far ahead of me that I decided to play by myself until some of my friends got online.  This is an important thing to note  this game requires internet.  If your internet is down, sketchy or non-existent  don't get this game because you won't be able to play it.

So back to the game  I started out in Brooklyn by myself.  The world was I don't want to use the word pretty for a post-apocalyptic game but the visuals were amazing.  Attention to detail and realistic artistry gets an A+ from me.  Then I start running around.  Okay so it took me a bit to figure out how to run, how to find my way around, using the map and the options button.  I was disappointed that I couldn't find more of a tutorial because Im not used to shooting games.  The movement of my character looked good but I kept finding myself crouching against things facing the wrong way.  Glued to the wrong wall or trying to run under cover and leaping over a wall on accident instead.  The first 3 hours of me playing by myself involved a LOT of dying, the game looked great while I was dying, but I wasn't having much fun.  I finally screamed for my now level 15 counterpart in the next room to come explain to me how to throw a grenade.  He gave me a quick tutorial on the buttons (which apparently you double tap  not mash) and tried to get me to comprehend the duck and cover strategy of fighting.  Once I gave up on the duck and cover making sense (how the hell am I getting cover from a chain link fence?) I was suddenly much better at the game.  He also told me that I wasn't insane  there really wasn't any way to run while ducking or crouch.  So after accepting these oddities I finally made it to Manhattan.

This is where I was joined by three of my friends.  They were one level ahead of me so we were more closely aligned as far as unlocked skills.  This is when the game became fun to me.  We worked together to rescue some people, unlock the wings of our bases, discussed the distribution of skills so that we were well equipped for the next firefight, figured out crafting together.  And we were winning battles  not easily, but we were winning.  This is where the game shines.  It is clearly built to run with teams.  I discussed with my man  and he said that he and his friends tried to solo several of the missions and its almost impossible. The game is built to play with others.
I realized that I actually can play a shooting game and that in order for me to be able to play well  I have to just accept that my person has no sense and that I cant duck and cover where I want.  Clearly she doesnt know how to go prone, cant run while crouching and won't step down two feet off of a curb but can parkour like a champ.  I just have to accept her for who she is (or he, if it really is a 12 year old Asian boy) and play her the way she is meant to be played.

There is SO much to do in this game that I imagine it will keep me busy for quite some time.  If you like duck and cover games, playing with your friends and shooting bad guys for a LONG TIME (seriously, my man was in an hour long firefight in the next room) then this is the game for you.  If you want something to play solo then this is not the game for you.  Also there is supposed to be oodles of new stuff added to the game so as it gets added, hopefully I will remember to come and update.  We have the season pass so its on!

**UPDATE 1**
So I was level 12 in PVE when me and two of my friends tried out the Dark Zone.  My two friends were level 16 and 18 at the time in PVE but none of us had been in the Dark Zone, which meant we were all DZ level 1.  We wandered into the lv 1-14 Dark Zone area... and everything went bad for me.  Apparently since they are above the PVE level 14 - I couldn't see them and they couldn't see me.  I have since been told that there is a way for us to group up even though we are in different level brackets but have not managed this yet.  Needless to say I walked into the DZ with two friends and discovered I was suddenly soloing.  So I figured I'll just scout around and see what the deal is.  I died very quickly to some mobs. It was awful... and I never saw another player.  SOOOO, I hop out and see that I have some other friends who are the same level as me on.  I jump in with them for an hour or so and we head to the DZ.  This was so much more fun.  We killed lots of mobs, extracted 3 times (that's a hell of a firefight every time) and then accidentally went rogue.  I say accidentally because one guy in our group intentionally shot and killed another player - thinking he was a boss (or so he claimed) then suddenly we were all rogue.  Now I hadn't killed a player, but there was a bounty on my head.  So we ran like all holy hell and hid until the timer ran out.  Later we had a guy kill one of our team and we took out the rogue.  The whole thing was not the blood bath I had envisioned.  First of all most of the players we ran across were just as nervous about us being there as we were of them.  I'm told in the highest level PVP areas it is more of a bloodbath, but at the beginner area where I was, I managed to make it in and out with a team.

Also in PVE - we discovered that the mobs level scale to the highest leveled player in your group.  I don't like that, I would prefer it did more of an average.  There are people I play with who don't work (retired, disabled, in college, etc), they race up through the levels and now unless those of us who are only able to play a few hours a day or less can play with them is to accept that we will be fighting mobs 3x the normal level.  Example - last night at the end of the evening we had a level 7, 12, 13 and 21.  It would have made sense for the baddies to be level 14ish - instead they were level 21.  My poor friend who was level 7 was dead most of the night.  Me and the Lv 12 struggled and at times ended up in a never ending rez chain while our lv 21 friend had to pretty much do most of the killing.  This prevents people from being able to group up with friends that they may want to play with just because of level disparity. For a game that is built to play with your friends - this seems to go against that, forcing you instead to find similarly leveled strangers.

**UPDATE 2**
I have now been in the endgame for quite some time.  They have added:
-The Incursions which are difficult at first but a lot of fun to figure out with a team.  On Challenging they drop high end gear.  Falcons Lost is 15 waves of bad guys you have to defeat which include drones all the while an APC is shooting at you.  The other one is a constant stream of bad guys who are trying to prevent you from putting two boxes into a container then you kill their heavily armored boss.  Not as much fun as the first but still entertaining the first few times.
-High Value Targets, both weekly and daily with the weekly again dropping high end gear.  You gather intel then buy the location of the HVT and go off to take them down.  Generally there are 4 waves of enemies and on the fifth wave the boss appears.  These pop randomly through a group of predetermined locations throughout the map - the locations can certainly turn an easy fight into a very tough one quickly (cleaners on top of the building anyone?)
-Supply Drops in the Dark Zone - race everyone and their mother to a location of a supply drop that generally has pretty good gear in it - fight off the bad guys protecting it and all of the other agents trying to get to it first.
-Cutting the rope in the DZ - so now you can hijack other people's extractions, but if you plan on doing it come with your A game, because most people don't like their stuff getting stolen, and will fight to get it back.",4.0
Good game,4.0
Great product!,4.0
"Work exactly as they're supposed too. I bought these only for my PS4 controller. At first they were difficult to put on but a neat trick is to flip it inside out, and flip it back out to normal as you place the grips above the analog. After I set them on my controllers I immediately tested them out only to find out one of them was slightly too thick. When I move the analog 360 degrees the rubber hits the edges of the analog boundary and slows down rotation. Overall this is a great product.",4.0
"Like the description says, this is a collection of three Metal Gear Solid games. It contains the original Playstation version of Metal Gear Solid, as well as the two director's cut versions of the Playstation 2 installments of  the series - Metal Gear Solid 2: Substance and Metal Gear Solid 3: Subsistence.

When I say the collection contains the original Playstation version of Metal Gear Solid, I really mean the original Playstation. This is surprising considering the age of that system and the fact it's on two discs. A PS2 port would have allowed players to rely on a PS2 memory card and allowed the game to fit on one disc. If you don't have a PS1 memory card, you're out of luck. Fortunately, the game is playable on the PS3 using the system's built-in memory card feature.

All three games are, as the boxes say, ""tactical espionage action"" games. You can try to blast your way through the enemies, but that really isn't very bright. If you're seen by an enemy, they'll call for help, and from that point on, an endless stream of enemies will come to find you. If you're able to successfully hide long enough, however, the enemies will return to their posts.

MGS is the simplest of the games, relying primarily on an overhead view to essentially make the gameplay 2D. You can't shoot in first-person, but Snake does automatically track his targets. In addition to the main game, MGS also has a VR Training mode, where you not only learn a few basics, but can also challenge yourself to obtain better times in each of the ten courses.

MGS2: Substance, greatly improves on the gameplay by adding the abilities to shoot in first-person, climb small boxes, dive, shoot from cover, and hang from ledges. Soldiers can also be shot in different parts of the body for different effects. A head shot will kill an enemy in one hit, but aiming for the body will require you to use more ammo. Substance also has a great deal of bonuses. There's a VR training mode, greatly improved from MGS. Initially, you can play as either Snake or Raiden, and as you complete more courses, new characters are unlocked. While the course layouts remain the same for each character, enemy placement changes to provide varying levels of difficulty. In addition to a Stealth and Eliminate All Enemies mode, the VR training also provides weapon training courses where you use the games many weapons to destroy targets. Another of Substance's game play modes is Snake Tales, where you play through the Big Shell, one of the game's areas, as Snake instead of Raiden. Finally, an amusing skateboarding mode turns the Big Shell into a sort of Tony Hawk Pro Skater course allowing you to skate through with Snake or Raiden in an attempt to complete various tasks and earn points for performing various skating tricks.

Finally, MGS3: Subsistence takes you back in time to the 1960's where you play as Snake's father, Naked Snake. In the Soviet jungles, Naked Snake has to use camouflage and his survival techniques to infiltrate enemy bases. The game requires that you treat your injuries and keep your stamina up by eating food. This means you have to hunt for food and raid enemy storage houses for medical supplies. Naked Snake also knows a fighting style known as close-quarter combat (CQC). This allows Snake to grab enemies and perform a variety of moves from there, including interrogation, using the enemy as a shield while you fire on his comrades, or just plain slamming him into the ground and knocking him unconscious. The abilities granted by CQC add a new dimension to the game that makes fighting your way through enemy bases much more feasible.

The games are fun to play once you're accustomed to the controls. Substance and Subsistence have so many controls, that they are overwhelming to new MGS players. If you take the time to learn them, though, you'll find deep games with an endless amount of possibilities.",4.0
"It feels cheap, but it works. I can't imagine it can take too much abuse before breaking, but if it does, I'll just get another one (usually only around $5-10).",4.0
"Works great, only problem is it doesn't come with adhesives and can be easily dislodged from wherever you put it in your entertainment center.",4.0
This is what I call an addictive game when you play out the scenario of each stage. Nice game for the buck!,4.0
"I chose this rating because even as awesome as it is. It still felt a wee bit too expensive. The value you get out of it is how much you travel. If you don't travel or go on Deployments as I do. Then this will actually be a Buyers Remorse type of thing. At first I felt guilty buying it because of its price. Though later, it really helped because I do travel a lot. So for those that Travel, Its perfect. Those that don't and stay at home all the time. Don't think about buying it unless you just want to blow your money up.",4.0
"Pros: Excellent sound quality for the price, very comfortable (although not quite as much with glasses), very good build quality, good aesthetics (subjective), and mic quality is also very good.

Meh: Cans could use just a tiny bit more room if you have big ears like me, this makes them a bit uncomfortable after about an hour.

Cons: The mic feedback option is great, but it picks up EVERYTHING. Can hear my wife rummaging through a plastic bag in the next room as if she's 10 feet away. Haven't found any way to modify sensitivity for Xbox One. Headset doesn't seem to remember volume settings once controller is turned off or disconnected, and the default volume is way too loud. Takes several seconds to fully reconnect.

Overall: A few areas with room for improvement, but overall an excellent choice, especially for the price.",4.0
good,4.0
"I didn't expect the game to operate using Windows 7 OS, since the spec indicate Windows XP as the compatible OS.  Surprisingly the game operates perfectly.  I am having trouble installing Hitman 1 but the other games work fine.  Also, the ENABLECONSOLE AND ENABLECHEATS don't work with Blood Money.",4.0
So different from the thousands of RPG hunt-and-fight games with a beautiful hand-drawn art style.  It gets a lot of play at my house along with Zelda and sports (tennis).,4.0
"works fairly well, some of the buttons are not as responsive as i'd like, but still functional.",4.0
"I bought this case for my 4-year-old to keep her DS and games together. It keeps everything in very tightly - perhaps a bit too tightly for a younger child. When she wants a game even the DS or Stylus removed from the case, I have to do it for her because the black protective foam holds everything like glue. For a slightly older child or adult, this wouldn't be a problem. Good Product.",4.0
"not the best controller out there, it gets the job done though, you won't be needing much in the wii",4.0
"If you're a fan of shootem up style games then you'll definitely enjoy this game. Levels feature lots of enemies and a big boss at the end of every level. It can be very intense especially on the later levels, but overall it's a very fun game to just pick up and play. It's short(you can beat it in about 30-40 min.) and there's not much to the story, but it's the gameplay that will keep you coming back.",4.0
The best of the series.. great hide and cover game much improved graphics over the previous 2 games. Highly recommend this game.,4.0
"It's the New 3DS with a download code for the new Animal Crossing game as you would expect.

If you are buying this bundle just to get the regular n3DS, just so you know that it doesn't come with a plain white face plate.",4.0
"Kirby made his short and sweet debut on the Game Boy in 1992 with Kirby's Dream Land. At the same time, a new Nintendo franchise was born. Before he was a cute, pink puff ball he was just a plain old white ghost looking ball who had to rescue his homeland from the clutches of his nemesis, King Dedede. While the Kirby games were better efforts, the first one proved there was something about him and his platform game that was simple and fun.

Kirby's Dream Land lets you control Kirby through 5 stages filled with enemies, pitfalls and spikes. Kirby can inhale his enemies and either swallow them or spit them out at other enemies. He can also pick up health power ups and 1-ups to help stay in the game. At the end of each stage, you face off against a boss and use a simple pattern strategy to beat it.

The PROS: A platform game that didn't star Mario would normally mean it wasn't going to be good. This isn't the case with Kirby's Dream Land. From the bright and crisp graphics to the pleasant music and solid controls, this game pleased anyone who managed to play it from beginning to end. Nintendo knew they had a hit by keeping things simple for the time being and for that, it's a game that is fun to play.

The CONS: With only 5 stages, it's over before you know it. And while you had to beat it in one shot (no passwords, save system or continues here), it wasn't a hard game at all.

It was short and sweet but fun at the same time. Millions of copies were sold and only prompted Nintendo to make sequels, which were better efforts overall. So if you're curious about where Kirby started out and you have yet to play this game, search for a used copy and pop it into your Game Boy. You won't regret it.",4.0
