reviewText,overall
"There have already been some excellent reviews of both the good and bad parts of this game, so rather than repeat what everyone else is saying, I wanted to point out a few aspects of the game that haven't received as much attention.

Pros:
 - Much better storytelling. I know that some people are disappointed by the lack of an overarching quest, or a main antagonist, but I love the fact that Bioware is trying something new here. This time around, the story is told in bits and pieces, with apparently minor sidequests actually laying the foundation for the bigger conflicts to come. At first it's confusing, but in the end you really get a sense of the scope of the story. Bonus points for the story-within-a-story framework, which is rarely intrusive but does create a couple of genuinely funny moments.

 - A darker plot. In Origins (which I loved), the plot could basically be summed up as ""Wow, that's an evil demon, we'd better kill it."" This time around, the goals aren't so simple. Trying to be a nice guy sometimes has unexpected consequences, and the bad guys frequently have good points to make. Your companions, too, are much more morally ambiguous - good people do terrible things, and most of the time you're powerless to stop them.

 - There are now cooldown times for potions. I know some people hate the new, faster combat (I did at first, but eventually came to enjoy it), but the potion cooldowns help to keep the battles more strategic. You can't just send your tank in to kill a dragon and have her chug potion after potion; she can drink a potion, and a mage can heal her, and then you'd better find something else to distract that dragon for a while. Generally speaking, I found the combat to be easier in this game, but when the enemies really start swarming, there's something incredibly satisfying about making your party work together to take everyone out.

 - Tactics are much improved this time around. Not only do you have more tactic slots, but you have more options. For example, you can set up your tank to activate a defensive sustained skill when there are a lot of enemies nearby, and then deactivate that and change to a more aggressive skill when the number of enemies decreases. Party members can also change tactics based on how many in your party are unconscious (dead), which is a huge help.

 - The dog is now a summon rather than a party member. Consequently, I now use the dog, which I never did in Origins.

Cons:
 - The game starts very slowly. All of your companions are initially kind of grumpy, and while that makes your developing relationships more rewarding, it also means that you spend the first few hours of the game with snippy people who don't seem to like you much. Plus, combat is pretty dull until you learn a few spells/talents.

 - Bioware annoyingly removed two sections of the journal: the transcripts of recent conversations, and the statistics page. Boo! The transcripts were pretty handy if you missed a bit of dialogue, and the stats were just plain fun.

 - The romances feel a bit rushed at the end, which is a shame because they start out very well. At the end I could ""complete"" my romance by promising to stay with my love interest, or I could dump him. Suffice it to say that by the end, I really needed an option like, ""Um, we need to have a serious talk about a few things.""

 - Reusing maps. Yeah, everyone mentions this but it needs to be noted. That said, it's not nearly as heinous as it was in Mass Effect, where the most sophisticated people in the galaxy somehow only managed to design two buildings.

 - No title cards at the end to tell you what happened to people. It made the end of the game seem very abrupt. Then again, I suspect that Bioware has learned to be wary of the end-game wrap up, because Awakenings and now DA2 contradict that information with some frequency. Yes, I am slightly miffed about the ""crazy templar"" from Origins who seemed entirely normal in DA2.

 - I got ""The Exiled Prince"" as part of my free upgrade, but trust me: you do not want to pay extra for this DLC. Yes, you get a new party member (Sebastian), but he's annoying, judgmental, and does nothing in a fight that Varric can't do better. I've heard that Sebastian can actually be a love interest, but who in their right mind would want him?

It's hard for me to score this game, because I agree with a lot of the criticism being leveled against it. On the other hand, a friend called me as I nearing the end of the game and I told him that I couldn't talk because a character just tried to give away his pillow and you KNOW that is bad news. (On a side note, my friend now thinks I'm crazy.) I don't give five-star reviews because a game/movie/book is perfect, because it never is; I give it a five-star review if it manages to temporarily transport me to another world where I care about the people and their problems. So for all its issues, this is a five-star game for me.

Update:
First I must apologize, because I wrote this review after one playthrough, during which I apparently managed to dodge a number of major bugs. If I had known about them (most notably the friendship bugs for two of your companions), I would have dropped my score. As much as I love this game - and I do, to a ridiculous degree - there's just no excuse for that lack of QA. Still, if you haven't picked up the game yet and you're worried about the bugs, you should know that Bioware has released a patch for each platform that fixes the worst of the issues (and you can now be friends with everyone), and a second patch for smaller bugs is also in the works.

Also, because I received the free upgrade, I didn't realize that the dog is actually part of the Black Emporium DLC. It's kind of lame that you don't automatically get him. I don't know what they're charging for that DLC, but if it's cheap then it might actually be worth getting. The dog is handy, especially in a few locations where you can find yourself with less than a full party. The Emporium itself is just a shop - they can stick it in your quest log all they want, it's not actually a quest - but it does offer a few interesting items. More importantly, it allows you to change your character's appearance whenever you want. This was a huge plus for me, because in the past I've re-started games (and wasted a lot of time) just because my character looked different in-game than it did on the creation screen. This is a great feature and I really hope that other games start using it...but again, I don't really agree with charging extra for it.",5.0
This game is still a fun game after all these years . This game has a killer soubtrack . Simple fun gameplay and since you can get it for so cheap why not this game is proof that Tony Hawk games used to be fun.,5.0
"this game is a MUST HAVE for people with gamecubes!!!!!
it has prettyful graphics,cool 1P modes,(except adventure,without giga bowser-_-;)
theres lots of characters,25,way more than the original.
u can collect trophies! like almost 300!!!!!
SONIC AND TAILS R NOT CHARACTERS!!!!!!!!!!don't listen to them!!!!!
kirbys the best char!!!!!!!!!
P.S:a super smash bros. is coming out for the new Revolution!!!:O
P.S.S:how can a game with jigglypuff be rated T?!?!
Starfishie""Star""^_~",5.0
All good,5.0
I have both Madden 2001 and NFL2k1.  I must say that without a doubt Madden 2001 is a better game.  The play is definetly more realistic and much more competitive.  The supporters of NFL2k1 keep saying how great the on-line play is for it.  I have never been able to play a complete game because of all the lag and slow down that occurs while playing.,5.0
"This brilliant adventure game has Jen as an intelligent 21 year old woman who learns she has supernatural powers - and must use them to keep the world from ending.
There are many ways in which this game shines. First and foremost, the plot and environment in which the adventure takes place has a huge attention to detail. Jen and her boyfriend are into the nightclub scene - he's a heavy metal singer - and the way in which the movie opens really draws you in. The club they're in looks exactly like a few I've been in.
The characters are extremely realistic, smart and savvy. This isn't a brainless bimbo having to 'learn about life'. Sure, she doesn't know about her supernatural powers at first, but she's quick on the uptake and takes care of herself. This is definitely a chick that girls can look up to and that guys will want to get to know.
Along comes Scree, a fun gargoyle that gives her a hand. The combination of Jen's abilities and Scree's special powers makes the puzzle solving and adventures even more fun, as you figure out which would be better in a situation. Yes, there's some fighting. But this is NOT a button-mashing game. The intro sequence definitely sets the pace. This is more like an interactive movie in which you actively affect the plot, rather than a run-around-gathering-coins brainless activity.
There are different worlds and different characters you meet, and the PS2's graphics have really been tested in this game. The heat waves that rise from torches, the steamy breath in the wintery world, the reflective lighting, the detail on the characters - it's all extremely impressive and helps immerse you in the game.
The sound is great too. Unlike other games that feel you need an action-packed thumping soundtrack while you explore a quiet environment, this game gives you the soft noises you'd expect - very realistic ones at that. It makes the times where something is jarring - like the snarl of a nearby monster - really affect you. The Heavy Metal thumping only jumps in during battles, where it doesn't seem intrusive.
The game definitely isn't for the wham-bam-thank-you-maam type of gamer. Puzzles won't be solved in 3 seconds by jumping up platforms. You have to really examine your environment and consider what might help you out. Which is good for most gamers, but will be frustrating for gamers raised on instant gratification.
Perhaps the most disappointing aspect of the game is that it wasn't QAed thoroughly enough before release. The game had numerous problems with freezing up and stuttering speech, meaning that I had to save frequently to ensure lots of work was not lost. Perhaps it's understandable with a game this complex, but another month of testing and fixing would have been well worth it.",5.0
"This game is EPIC. My husband bought this for me as a Christmas gift. I have wanted it for a long time now, since before it came out. This game is awesome! The map is huge and you can literally climb on anything and everything! I love this game. Dont judge me, I am a gamer girl! :D",5.0
A great game incredible visuals and nice story lines to continue the infamous franchise..,5.0
"A lot more details than the anime (you don't say!)
A lot of details intentionally excluded from the anime... wow.... those details are shocking.........",5.0
"This game has come up in my Amazon recommendations since shortly its release last year. Due to the cover art, I'd dismissed it as purely a game for kids. You know, something hokey, not very challenging, and probably more annoyance than anything. WRONG!

As I've found it increasingly difficult to get out of the house for exercise (heat wave, allergies, sun in my eyes, planets not in alignment, etc.) the pounds have piled on. So I went in search of a fun, low-impact 'exergame' to use with our Wii. The rave reviews and discussions in Amazon's forums convinced me to give this one a try. Man, I wish I'd bought it back when Amazon first recommended it to me!

The game is fun, and thanks to both the visual distractions (chips to collect and cash in on event capsules that populate your island with decor) and the rhythmic music (lots of bouncy songs), it's incredibly easy to forget you're exercising. Until the sweat starts dripping, that is, and even then the game pulls you forward in search of more capsules, more rainbow spheres, and more things to discover. It's just a blast, and yet it gets your blood pumping! Before I even realized it, I'd walked for 45 minutes to reach 5,001 steps. (Possibly more. I was having problems with my nunchuck.)

Now that I can exercise any time, day or night, without worrying about the weather forecast, the pollen count, irritating teenagers shouting rude things about my weight (assuming I work out when my kids are at school) or any of the other thousand excuses I can come up with to avoid working out.

But, as I mentioned, I was having problems with my nunchuck. I'm going to keep trying to use it for a few more days, and may try this with my Wii balance board (since I don't use it for anything anymore, LOL). Still, something tells me I'll be springing for one of those DDR mats... or maybe two, so my son can walk with me.

Well done, Konami! Now, get off of YOUR sofa and make the next release of this game!!!",5.0
"I never played the original Portal game.  I played similar game concept via Darksider and I loved it.

First of all, I am the kind of person who get sick play video games of certain engine, and Portal 2 get me sick, but this is still a fun game.

I haven't finished it yet, and the challenges are getting harder and more fun as I progress.

If you want a brain challenging game, not just the regular shoot and kill, this is the game for you.",5.0
"It's a gamecube controller what more can I say?!

I was hesitant enough to buy two of em coming all the way from japan! even though they were like $30 each I ended up buying two, and I thought I was better off doing that because ones here in USA are like about $100 for a brand new one which I thought they were out of their minds for that kind of price range. And used ones were around $20 with most of em being worn with rubber tops ripped off.

So I decided to buy these even though they came all they way from Japan, And boy I was not sorry for spending my money on these controllers. I still haven't opened one yet but i already have on the other one. Cause i already have 2 other controllers. I mainly bought these cause I wanted to play Smash Bros Melee properly cause I have another used genuine one but it's heavily worn. So if your looking for some genuine GameCube Controllers for your Wii or Gamecube then look no further and buy these babies!! :)",5.0
"this is by far the must fun zelda game i've played, the story is awesome, graphics are cool, and the music is catchy, definitely would recommend this to any zelda fan.",5.0
"Used to play this back in the day when it first came out it was amazing then and still is, if you like the blade runner movie you will love this game, takes place during the events of the movie but you play as a different character and follow a different storyline that connects  slightly to the movies events, I really think the game is way better than the movie. It also has multiple endings at least 4 wich is great. A lot of replay value and good voice acting.  Honestly I could go on and on about how awesome it is but I'll spare you.......Must buy!",5.0
Arrived on schedule in excellent condition. I'm very pleased.,5.0
Great game. My grandson loves it!,5.0
"Pros:
Comfortable
Mic is good quality
adjustable

Cons:
The mixer doesn't change much (other than mute mic)
The ""Chat Volume"" doesn't work in some games (Including csgo)",5.0
Game came in good condition. Thanks,5.0
This was a Christmas gift. This is what was on their wish list of presents. So they where glad to receive just what they wanted.,5.0
I love this game very good it is nice for the price,5.0
"Since PS2's and PS3's use the exact same composite or component cable, I figured this would work........ guess I was wrong. For more info read this review, not typing it all again:

http://www.amazon.com/review/R11MCQ8ESC5A3J/ref=cm_cr_rev_detup_redir?_encoding=UTF8&asin=B0017O5K0I&cdForum=Fx2RJZ1HUJHT04O&cdPage=1&cdThread=Tx158CF6U8RXSNC&newContentID=Mx1SF4QCPZ70QCN&newContentNum=3&store=pc#Mx1DX5EI2D5FV5N

EDIT!!: lol ok changing my review...... maybe the red video cord wasn't plugged in all the way or some weird crap, cause I unplugged the cords one by one and plugged them back in and when I hit the red one and plugged it in again..... poof I had color. I don't know..... but holy hell what a difference on my Sony Bravia. In Final Fantasy 12, things were so fuzzy on composite cable (the PS2's OFFICIAL composite cable, red/white/yellow) it looked ugly as hell. With this? it's as clear as it is on the CRT TV we still have in the living room....  but I did go to the ingame options and turn on flicker filter (keeps it from getting fuzzy when you/the camera move)then on my TV's settings turn sharpness practically to max. But I couldn't even get anywhere near this good of a picture with composite. In fact, I'm going to gamestop right now and getting a used PS3 (since they're the same cords) component cable so I'll have this one as a spare. lol

I DEFINITELY recommend getting a component cable for PS2's on newer TV's, if not this one then another.",5.0
"Super Mario Brothers was one of my favorite games when it first came out. With New Super Mario Bros DS, you get the game fun gameplay - enhanced - in a nice portable system.

This isn't just a remake - it is sort of like how the Wizard of Oz starts out in black and white in a gritty, quiet town and then turns into multi-color, sparkling larger than life song-filled splendour. You get the NES versions of the game with similar - but not exactly the same - levels that have been updated from 2D to 3D. You get extra features like ground pounds, and mushrooms that make you SUPER large - you don't have to jump to break blocks any more, you can just walk and crash into them. Other mushrooms make you incredibly tiny, to reach places you could not before.

The combination of old style classic gameplay and updated graphic, sounds, and features is really quite good. These games were stellar in the first place, with their addictive levels that were just the right balance of challenging and fun. Add in the easy to carry with you DS gameplay, the new features and hidden things to look for, and I really found this just about perfect for an arcade game.

Yes, you could complain that you can zap through the game in a full day of gameplaying. However, this game series wasn't ever meant to be a ""month long role playing complex adventure"". It was always meant to be short, easily playable sessions that you could fit in while you waited for dinner to be ready. You could save and exit when you had to run to school, and then pick up again when you had time the next day without having to review 8 pages of storyline notes.

This makes the game PERFECT for carrying around in your DS. If you end up waiting in line for 20 minutes, you get through another section. If your bus gets stuck in traffic, that's another level you can get through.

Plus, there is replayability here, while you try to track down the hidden items and coins.

I enjoyed the minigames as well. Certainly you wouldn't buy this game FOR the minigames, but heck, if they're going to throw them in for free, you might as well enjoy them! I'm not usually one for DS multiplayer games, but it's nice that they did include that as well for those who want to play with a friend.

In general I was quite impressed with this, and recommend it heartily!",5.0
"Some people complain about the head phones feeling cheap. They're actually sturdy. The sound is amazing. I haven't tried the mic feature as of yet. I've used the headphones watching anime, playing Team Fortress 2, watching Netflix and playing other games on Steam. They've sounded great.

My only CON isn't unexpected. They're not noise cancelling meaning if someone is in the room with you and they're watching something you might hear their stuff unless you have sound coming through the headset. Also others will hear your gameplay or video if you turn it up too loud.

OVERALL, I'm happy with the purchase and recommend it to anyone on a budget but looking for a great gaming headset.

Sincerely,
Lee.",5.0
Was a much happily received gift!,5.0
"the game-play on this GoW had a couple additions from the norm of GoW. these additons were mostly due to the gods that are defeated. however, the feel of the game remains the same: plenty enemies to kill, boss fights, the usual provocative scene with a female and plenty puzzles to solve. it is very enjoyable and educational(in terms of Greek mythology). As with all GoW's that i played, it was a work of art. i had numerous play-throughs.",5.0
"I have been a fan of the Ace combat series for ages. Unfortunatly many of them were pretty much the same game and very little new in them. That however is not the case with Shattered skies. The graphics are absolutly amazing, except for maybe the explosions which are a little dull when compared to the detail in the rest of the game. It is not too hard to learn. You have various difficulties to chose from and a large selection of aircrat and ordanence to buy. Gangs of fun. My only real complaint is that 18 missions is way too short. They could have easily done twice that many. The storyline that appears at the beginning of most missions is very interesting and can help pull you into the game. This game is alot of fun.",5.0
My son loved disney infinity and the figures were a great style.,5.0
"This is a spectacular game. It is horrific, but it's not so much ""OH, my god! Im gonna die!"" scary, it's more like, ""If that was me, I don't know what I'd do!"" scary. It kinda gives you that chills. Resident Evil was slightly more ""BOOM!"" scary. It scared you right then and there with no expectations. But Silent Hill, the story unwravels. It's more like a mystery, which makes it so scary. It is a game of which you are able to veiw your character ""3rd Person"", but at your apartment, it is ""1st person"". When you begin the game, you wake up in your apartment and figure out that you were locked in and the clues that the ? has left in your apartment leads you to different worlds that test you skills. The first is the train station. It is very confusing, but try to cut through the two trains as quickly as possible. It is okay if you loose Cynthia, the girl you meet earlier, but you'll find her later. I can't tell you anymore, but the game has a great story, and you later figure out after the subway world that you are not dreaming, you were sucked into hell's reality after you visit at Silent Hill, and others have too (Cynthia). The game is nothing like Resident Evil, it is more scary and has the scariness of the first time you see ""The Grudge"" and the mysteriousness of ""SAW"". Spectacular game. It really should be put into a movie. I would reccomend this game for advanced players. It is tough, so get some of your Xbox knowledge stuffed in your brain, because your going to have to use it in ""Silent Hill 4: The Room"".",5.0
"I'm a huge fan of Tomb Raider, I loved the Anniversary title for the Wii. Beat that one twice just for fun. So, this game, for those who have played the other Tomb Raider game, this is a piece of cake. Sure some controls are a little different, like the ""-"" to grab things drop from ledges, etc. BUT you get the hang of it in no time. The swimming has improved dramatically, it is so easy to swim now and fast too. Just use the joystick for actual swimming and the wii remote arrows for direction. I haven't gotten that far in the game yet, but I love it. There's less fighting in this one from what I can tell, which is okay, I primarily love this game for the exploration aspect and figuring out where to go and what to do next. Exactly why I just returned the 007 game because it was too much shooting and no time for regrouping and exploration. I look forward to coming from work and playing this game. It's very entertaining and mellow! Two thumbs up.",5.0
"This game is so fun. It has archery, bowling, basketball, swor play, skydiving, cycling, frisbee , wakeboarding, power cruising, golf, table tennis, canoeing, and air sports. I wish it had baseball. The grafics are better and you get this controller device called the wii motion plus that improves your motions with the wii remote. I reccommend buying this product.",5.0
"I have a new Xbox 360 game... ROCKSMITH! I've only been playing one week and it is fun and challenging!  I remember saying to myself years ago that Guitar Hero should have used a real guitar. Ubisoft delivers!!! I am getting back into guitar all over again from 20 years off, because my kids are interested. I have fallen in love all over again! This game is fun, challenging,  progressive (skill-wise), versatile, feature rich, made for guitar or bass and upgradable. It also acts as an amp, through the TV. That won't be a bonus for real guitarists, but it is for me. I don't play loud or demand much from guitar, YET. I bought an electric-acoustic due to its versatility and conditioning. In time, I'll buy my own amp. I am so grateful for this game! Now, I need another cable and mic so someone can do vocals! ROCK ON!!!",5.0
"Great amiibo, and it unlocks a great ability in the game.",5.0
"1 of the best hack & slash/beat them up third person shooter heroic game ever made. should have it now before its too late bcuz;
- best price to buy
- fast & safe delivery
- nice storyline
- easy to get achievement for full game score",5.0
"Had to replace the old ones, because they....got old.  They stopped working and so I bought this.  Our Nintendo 64 is once again fully operational! The controller works great, looks almost unused!",5.0
