reviewText,overall
"Two and a half years in development this game was eagerly awaited by the train sim community as the title which would re-define the genre after a long gap between genuine new releases.

Unfortunately I can only concur with previous reviews regarding the buggy and flawed game we have been given. It appears as if all the money and effort has been expended on the graphics engine, which does not look a whole lot better than improved MSTS/Trainz anyway, rather than the core features such as signalling to make a train sim work properly. The cabs are quite detailed and 3D but not many of the switches or levers work correctly. In external view the train often looks like a sprite floating over the ground and in both cab and exterior view there's a disturbing and nausea inducing side to side ""hunting"" of the track which, if it's supposed to represent the cab swaying, is totally wrong.

Sound is not much better. The HST is quite good but the Turbo DMU sound like it was sampled from a bin lorry. The Deltic is rather weak and the Class 47 just doesn't sound right. there's no distiction between the level or type of sound heard in exterior or interior view either. Track sound is awful a sort of disembodied tinkle every now and again or when you cross over points. A Gameboy would put it to shame.
The North American version is missing the York to Newcastle route of the European release with a version of Cajon Pass in California instead. Although the publisher (now working under the Rail Simulator Developments - RSDL - banner rather than Kuju) has stated they will release the respective routes at some stage (free or paid unclear) this creates an immediate incompatibility between the two versions for third party routes etc. which use objects not found in its transatlantic counterpart.

One reasonable point (which is why it gets two stars rather than one) is the train physics. The HST actually takes a realistic time and distance to accelerate and brake though the top end of the power curve is questionable on all the traction. They should just about hold top speed one notch below full power but they want to keep on going. steam physics is about on a par with MSTS, that is to say a reasonable stab but wide of the mark. It does not seem possible to induce wheelslip on any of the locomotives.

Where the sim really falls down is on the operations and signalling. The signalling is poorly scripted and implemented - it does not give proper warning of upcoming junctions and can easily cause your train to derail or collide with another even when you get the correct aspects. The German signalling seems to be derived from the UK signalling and is totally wrong for DB practice. There's a lack of proper warnings for upcoming speed limits. The ""Track Monitor"" is useless as it only shows the state of the line about 800 metres ahead.

Very few activities or scenarios are included in the box, some will have beginners scratching their heads with complex shunting while others are ""broken"" as a result of the pathetic signalling. It's not possible to run to a timetable and the game shipped without the proper tools to create such an activity. The development tools need to be downloaded seperately and only after signing a licence with RSDL - reason for this is not entirely clear, but seems tied up with ensuring any commercial third products sold for this sim pay a royalty fee back to the developer. Route building is not as intuiative or easy as MSTS and light years behind Trainz - everything has to be set up via blueprints and the documentation, which also has to be registered for and downloaded separately is quite muddy in places and seems more aimed at the technical high end (commercial?) orientated user than the little guy. The route editor itself is quite buggy particularly when it comes to joining tracks, creating junctions or laying roads and fences.

In conclusion it's a bit of a mess and a disappointment. There is potential there but it will take a bucket load of patches and/or a major rewrite of some of the code to get there. At the time of writing (Feb 2008) a patch is imminent but if you're really eager for a new train sim you might be better advised to wait and see what Microsoft have to offer in their proposed new train simulation some time in 2009.",2.0
It's a short game & not that all good. It's just not long enough for me.  It you like shooting buy it.,2.0
No me gusto,2.0
"can't belive this game is the remake of first ridge racer  game for the ps1 control are stupid.graphic's are  not for a xbox 360 quality over all ridge recer game are  a frustrade  experience ,with the exention of RAGE RACER game -that was a classic recer game for the ps1. not recomended",2.0
Couldn't get it to work.  Tried running the driver on Windows 7 mode and nothing.,2.0
"In my humble opinion, the original Crysis to this day remains one of the best FPS of all time for so many reasons that I couldn't possibly list them all.  There are some obvious ones, graphics, realistic game-play, enemy A.I., lush environments, non-linearity, destructible environments, etc.  But one of the things that's not so obvious is the following:  Most video games that I can think of start one off at the very bottom; little to no items, weapons, upgrades, abilities, etc., etc.  You basically have to build your character from the ground up and near the end of the game you become this real bad @ss.  The original Crysis completely shattered this formula.  In that game, you started off with everything on the nano suit unlocked, fully powered, and ready for immediate use.  In other words, you were a complete bad @ss right from the beginning.

In the first couple of levels no one has a real chance against you.  You really are completely superior to anything the game throws your way; and this makes total sense because that's what the nano suit is for, to make you superior in every way to your enemies.  And this is not to say the game was easy, because it wasn't.  It just meant that if you used your brain and all of the resources at your disposal, you were virtually invincible because again, that's what the nano suit is all about.  I recall climbing into the back of a jeep and taking control of a chain gun and attempting to mow down some enemies when all of a sudden a tall palm tree realistically falls down and instantly kills some of the enemies I had missed.  I soon realized that I HAD unintentionally caused this to happen because my gun fire caused the tree to fall, and as a gamer, this was a MIND BLOWING moment that cannot be replicated in Crysis 2.  In the original Crysis, if you were in a vehicle and an enemy shot at your tires, the tires actaully went flat and the vehicle was disabled.  I mean, you cannot find gameplay as simple and realistic as this is any generic shooter the current day.

So this is why I had to buy Crysis 2 on day one, because I have so many fond memories of the original Crysis.  But I have to admit I've made a grave mistake.  You see, Crysis 2 is INFERIOR in every way to the original Crysis.  Others reviewers have already mentioned it but it begs repeating, making Crysis 2 for PC a console port was a mistake of EPIC proportions.  Crysis 2 doesn't feel like Crysis, it doesn't taste like Crysis, it doesn't smell like Crysis.  The graphics are worse than the original.  There are NO detailed settings adjustments to be made.  Every time your aim changes, there this horrifying, choppy blur on the screen. The weapons are very inaccurate.  Helicopter's spot and shoot you even when you're cloaked.  I walked into this new area cloaked, and about a dozen enemy soldiers showed up near my position stating that I had been ""seen"" in the area.  Really?  I'm cloaked remember.  This would have been impossible in the original Crysis because being cloaked meant something in that game.  There are about six ammo dumps in every area, not to mention that enemy ammo drops, making it impossible to run out of ammo, or even a need to conserve and that gives this game a tremendous ""arcade-like"" and unrealistic feel.  The nano suit is a terrible downgrade from the original and actually makes you a much weaker character.  One example is when you use max armor.  In this game, you actually lose suit energy even if you're not taking damage.  In the original, the energy decreased ONLY when you took on enemy fire, which again, makes much more sense and offered greater realism.

You want to know what is the worst thing of all, the nano suit actually TELLS you what to do.  It treats you like the dumbest person on the planet that is incapable of thinking for yourself.  As a gamer, this is insulting beyond description.  Personally, I want to be able to use my brain in order to assess the situation, come up with an effective strategy, and implement that strategy as a spec ops soilder would in real combat.  In the words of Clint Eastwood (Heartbreak Ridge), I want to IMPROVISE, ADAPT, and OVERCOME.  I'm a grown man, I don't need my hand held especially in a game like this where you're supposed to man-up, after all, you're the savior and hero remember?

The more I write this review, the more disgusted I'm getting with this game, seriously.  ANYONE who thinks this is even a decent game has never played the original.  No more Call of Duty clone garbage for me, it's over.  With the exception of Uncharted 3 and Battlefield 3, I'm done with all of other shooters.",2.0
"First, I've been a fan of the Thief games since day 1, including fan-made missions. I cannot recommend this game though, because of the large amount of bugs that will likely never be fixed. Let's start with the game-play. Sometimes when you jump up to mantle a ledge, strange things will happen. You can either fall through the game world and fail the mission, or get stuck in a weird floating pose. When you're in the floating pose, you cannot jump and it is a royal pain to return the game to normal. Whatever immersion the game has instilled in the player goes right out the window at these points.

Of course, that is assuming you can get the game to run in the first place. This game does not like multi-core processors. Unless you either disable the other CPU cores, or limit the game to use only one core, you'll also have problems. Back when this game came out, we already had HyperThreading CPUs, which would cause problems like this because they show up as having multiple cores.

If the publishers/developers would stand by their product and patch these issues out, it would be acceptable. However, we got only one patch for this game, which fixed some AI issues. If you simply must play this game, I recommend buying it used in order to avoid supporting publishers/developers who don't fix glaring issues with their products.",2.0
"Well, while this keyboard has a decent feel, it is built VERY cheaply. Extremely flimsy plastic and customer support is virtually non existant. Save yourself the hassle and just buy a logitech instead. I expected so much more out of such a high priced keyboard.",2.0
"first of all, when this game came out, i was ready to play it nonstop. but i cant do that because i constantly lag and its just not fun when you shoot somebody and just won't die! the game is good but theres not enough support from the developers to justify buying it! this is the last game i will ever buy from EA again.
its not my connection. im usually the host IN EVERY OTHER GAME SUCH AS CALL OF DUTY> MGS4. wait for this game to go down to like $20..
ps. iam willing to trade the game if anybody wants it. i will take bioshock 2 or any other game, i just want to get my moneys worth and i cant do that with this game.",2.0
Work for a few days and then stop,2.0
"ok first off, THIS IS NOT WEAPONS GRADE PLASTIC.  i have family member in the SWAT team and i've held an HK G36K and i can tell you that this lancer rifle replica is not weapons grade plastic.  the chainsaw handle/ lever is so flimsy that you can snap it off with little effort.  the ""chainsaw"" sound sounds nothing like a chainsaw saw, picture loose platic vibrating loudly.

other than those three things, this product is awesome.  it's wonderfully detailed and feels good in the hands.  but like the title says, this is only for the fans that just have to have a little piece of the gears universe in their hands.  buy it to collect it.  play with it and expect to break certain pieces (chainsaw handle, scope, barrel, maybe even the handle itself as it's not made from one piece of plastic)",2.0
"I recently got right into the ""NBA Street vol"" games, and I figured it was going to be hard to top those games on PS2, but then I read a few of the 4 star reviews here and people seemed to be praising the game, and a few said it was even better then ""NBA Street"", and that this game supposedly had the best controls for a basketball game on PS2. What misleading lies I beleive those reviews to be now. I think a person or persons is having a laugh on this site by giving good reviews to such a poor game.

First off, this game is simmilar to ""NBA Street"", which is pretty much an adaption of the ""NBA Jam"" games. However, this version is only one on one play. There is one other mode of 1 on 1 on 1 that allows 3 players to play at once, against each other, but as much as it sounded interesting at first, it's as annoying to play as the regular 1 on 1 modes in this game, as it makes matches longer, more frustrating, and fewer points awarded to your profile to unlock anything you want to eventually do in the game with custom created players.

How long can one on one match ups last and remain fun? It took me 3 hours maybe before I was bored to death with the lack of options of gameplay this one here offers. I think I mentioned in my review of ""NBA Street Vol 2 or 3"" that an improvement could have been offering a one on on mode, but after playing ""Ballers"", it makes me think that the team of ""Street"" probably did explore that possibility, and found it to be as boring as playing this game here.

So, onto some other bad points. Loading times are ridicules. It takes about 3 minutes to power up this game and get through all the stupid copyright and intro screens before you are finally asked to press start, and even then doing so, more loading time for the games main menu. If you accidentally go back to the title screen, guess what, more loading time just to go back to the menu screen again. It's even worse when you pick players, but it's defaulted to the Eastern NBA stars, you then have to press O to go to the list of team categories, then select one with NBA stars, legends and custom players scattered all over the place. The selection menu is atrocious.

Once you do get into the game, and you have skipped the annoying MC Paronormal or something, you finally begin to play, but are then bombarded with pop-up boxes explaining what button does what... is there no way to ever turn that off? Then the action begins, and you are forced to pretty much just keep smashing the ball into your opponents face and running for the basket for a dunk, because for the most part, no matter what your chars stats are, they will miss a jump shot from anywhere. Even with new dunks unlocked, you feel very limited to what you can do after a while, and that's something this game will never hold a candle to when compared to the ""NBA Street"" series, it's controls where smooth, easy, and fun to use, where as this game here tried something simmilar, but feels less responsive to any variety of dunks you can preform. I also miss the turbo blocking, because block's in this game are just a random act of 50/50.

The create a baler I will say is about the only decent thing about this game. You can make better looking ballers then that in NBA Street games, however, later with the lack of options and moves to do, it's just nice looking set of graphics covering the dung programming hiding behind it. The create a ballers process also only provides you a certain amount of points to use for creating skills and looks, and then you have to play matches to earn more... why must video game makers beleive that is what players want? It's a no wonder the NBA Live series is so popular, at least when you created a player you don't have to play 10,000 matches to finally max out the created players stats, and by the time you do that, you are completely sick of a game. this game here allows you to start off by giving a maximum of 35 points in one skill level, later when you edit your character again you can advance up to 99.... why? someone tell me whose stupid idea it was and in what game they did that first where someone figured it would be more fun to make you earn your stats rather then just create, adjust, play!?

Filling up the rest of the disk where space could have been used to create more options, modes and more than just 1 on 1 matches are a bunch of pointless NBA videos of a bunch of guys you will probably never have any interest in ever watching their video anyway... it only took me a glance at looking at Dominque Wilkins 1 minute video of NOT the best highlights of his career and him saying, ""I love to play the game"" with that annoying ""letssssssssss get ready to rumbleeeeeeee"" guy talking over it.

While I'm on that, the music in this game is just horrendous. A bunch of nobodies rapping about how they gonna be the streets and earn money in the nba someday... gimme a break, PAY FOR A DECENT SET OF SONGS, there is no way anyone could have been paid to write and record that.

I'm done ripping on this game, i've said my piece, flipped it the bird, and thrown it's ballers in the bin.",2.0
"After playing ""The Longest Journey"" (sigh-I loved it) I was getting edgy for something new.  I wanted to see if there were any games out there like it. ""The Longest Journey"" is still my favorite game and I wanted something similar or better (if possible).  I read all the reviews of THIS game.  Half of the reviews seemed favorable and the other half hated it.  What to do...I contacted, via email some of the reviewers to ask them if they think I would like the game.  Consensus showed I should get it. Okay so here goes.....The game began with little graphic and exciting scenes of what to expect and then BOOM! The actual game had horrible graphics. I mean real bad.  It's so pixilated you can barely make out the Sphinx itself.  I proceeded anyway because I was kind of feeling the Indiana Jones hype and went further..to the first and obvious puzzle.  It seemed hard at first but I ""unlocked"" the puzzle in 5 minutes! That's right! 5 minutes.  Okay, I gave it one more chance...I tried to find my way to the next step and the 180 degree turns and slow ""Myst"" click and move steps got me so annoyed and lost it took me an hour just to figure out where I needed to go.  I could never get to the spot I needed to, because apparently I needed to download a patch to proceed.  I found out after calling some game stores at the local mall that you need a few of these patches to improve the game.  It is playable without them, but extraordinarily difficult.  I really wanted this game to succeed. I had done my homework, giving it a fair chance and it failed.  It really was like an Egyptian ""Myst"" minus the beautiful graphics, intellectually challenging puzzles and lacking a great plot.  I am still remaining open to new ideas from anybody.  I have since, returned ""The Riddle of the Sphinx"" and am looking forward to suggestions from other game reviewers.  If anybody has ideas for me please feel free to email. Thank You.  And to those of you who were so kind and helpful...I'm truly glad you liked the game..I guess it just wasn't for me.",2.0
"What I liked about the game: it has a good soundtrack and fine visuals. I liked the voice of the talking chip and not too many, but not bad weapons and I guess that was it. I finished this game only once, but it seems there are 2 endings in there, depending on one choice that you make in-game. That's a good feature however I will not play this game again just to see the difference.
The first time I've heard about the game I thought I'd like and would give it 5 stars for sure. But this game is boring, the plot is nothing more than just okay, the characters are also there but I didn't get attached to them at all. Some bosses were just really hard to kill on normal difficulty and you can't change this difficulty in-game. I also disliked all this button-mashing.",2.0
"The Sega Game Gear was a brilliant idea, ahead of it's time, but perhaps that is why it never took off.  The colored screen was magnificent.  As the previous comment said, Game Boy was hard to over take.  Yes Game Boy was in black and white, but it had all of the other things going its way.  For example, Game Gear is more expensive, the games are more expensive, it's bigger, and the WORST thing about a Game Gear is that it's not  much of a portable gaming system because it ran on 6 AA's I believe...and it died in about 40 minutes of play.  The screen being lit was nice for night rides but only lasting 40 mins or so was not acceptable.  A good system if you plan on sitting next to an outlet and playing but if you want to travel with it, I'd pass on the Game Gear unless you like paying more than the price of the Game Gear on batteries every couple months.",2.0
It a ok game if you don't care about the controls and the voice acting,2.0
"The game starts out rather fun. It was extremely promising, but after the introduction when you're supposed to go off on your own and choose your quests as RPGs often make you do, I was lost, and the controls (especially going into hyperspace) are hard to remember, and even if you can remember, the game is hard to control.

The story is cheesy, cliche sci-fi. Evil totalitarian government, check. Main character's deceased father was famous, check. Smartass pilot, check. Attempted but failed female sidekick who adds nothing to the story, check. unrealistically saturated colors, check. Terrible dialogue, check.

I didn't have a good time playing even though I waited for this game for months. Complete disappointment. One of the only things I got from it was 5 (Maybe 10) gamerscore for crashing into a planet.",2.0
"The look good, and only moderately difficult to install, but really do not seem to do anything. There are mods to the controllers that are much more useful.",2.0
"Prepare for a long download unless you have a stellar fast connection, claims to be 10GB, but with updates, patches and Hi res. add on, your looking at over 23GB. Then the game isn't really that great, basically a slot machine type of game ( as long as you keep spending money, you might have a chance of possibly, perhaps, maybe, with luck getting something out of it).",2.0
"The game is not as many other titles out there. In my opinion the game was released and not finished 1st. Not much difference from part 1 and this is unacceptable due part one was a little better thn this one. Overall the current price is really worth buyin for. But $50,$20 dollars is a waste of $$ for this one.",2.0
"I'm about 40 hours in to the game. Graphics are HORRIBLE, you have to read ALL the dialog, there is no dubbing of any kind...The areas you explore are linear.....a 5 year old could navigate these areas. Whoever developed the maps should get fired. The story is excellent, but they make you go through it 3 times! Gets boring. This is one of those games that I had to put down and come back to out of boredom. I would not reccamend this game to anybody...",2.0
"While Nintendo has a lot of exclusives , it just doesn't compare to ps2 or Xbox in my opinion. Plus some games have multiple disks because the gamecube disk memory is smaller. It is easy to make room for . Overall if you're gonna but one don't pay much for it. I just got one for 24.99 and i already am thinking why did I buy it.",2.0
