reviewText,overall
"This review is for the Hasbro Family Fun Pack for Xbox One. If you are interesting in getting this set of games, you know this is not going to be the same as a triple A title game (which also cost 3 times more). While the graphics are fine, they are definitely not the focal point of a video game based on traditional board games. Still, I was curious. I like Trivial Pursuit, Monopoly, Scrabble and Risk so this seemed like something worth checking out, and a nice break from first person shooters and role playing games.

These games are meant to be played with friends, I didn't even try to play them solo with AI players although it is an option if it's just 2 humans and you want to play with more players. There is also the ""live"" mode which requires you to sign up for a separate service which I found annoying. Still, once you get all set up, the games are easy to get going and play. Each game is fun and lively and has its own twist on the originals.

One of my favorites is Monopoly, with it's 3D rendition of the classic game, and the way the game has you play the ""real"" rules (this eliminates the constant arguments my family has with what the rules actually are), although you are able to make rule exceptions for certain things. The animations and general gameplay is whimsical and enjoyable and it really got me back into monopoly again after not playing it for years.

I also really enjoyed Trivial Pursuit, but unlike Monopoly it was not because it is similar in style to the board game version. This Trivial Pursuit is set up like a game show where you have to ""buzz in"" with the correct answer. It is very, very different from the board game and the questions are much easier than the Trivial Pursuit games I have played in the past. Still, it's a very fun, fast paced trivia game that 4 players can play and have a lot of fun with. This is probably my favorite game to just pick up and play really quick. Games can be as short as 5 minutes or as long as 10 minutes with the longer mode. I feel like the game is worth the price just for the Trivial Pursuit portion alone, although Trivial Pursuit aficionados may be turned off by its name being used on a totally different game show style game. To me, it's better this way. Traditional Trivial Pursuit is a great game, but I don't think it would translate well to a video game console as it is so basic in nature. The game show feature makes it fun and lively and I had fun playing with people aged 15 through 45.

The other 2 games I didn't play as much, but I did enjoy them. Scrabble is fairly traditional and was enjoyable to play. The Scrabble games seem to take about the same amount of time as a normal Scrabble game, without all the setup of course. Risk is also fairly like the board game and I played one full game of it with some friends and really enjoyed it. It does take a while, like Monopoly, but overall it's a nice addition and a classic strategy game that I would never think could translate well to console, but Ubisoft did a good job.

I should mention that if you have a smartphone, you can use the Microsoft Smart Glass app to use as a type of controller for some of the games, if not all of them. I only tried this on Monopoly and it works great. Another great use of near ubiquitous technology to augment the gaming experience.

I saw some reviews saying they didn't like the user interface, but I think that's personal preference. I think it's fine. I have no trouble navigating through the various games and the different options. I don't like that you have to sign up for that service to play live games, but that's totally optional and not required. There is paid DLC (downloadable content) you can purchase such as fun Monopoly maps, and you can make your own version of Monopoly ($10). Overall, you have to consider the cost for a game like this and what you are getting and it's hard to argue that it's not a great deal. If you have a Xbox One or PS4 and are looking for a fun game the whole family can play that doesn't involve dancing, this one is great if your family is into board games at all.",5.0
"Don't really think anybody needs an explanation of the quality of the purchase due to it being digital, however the email to get the code was fairly quick (almost instantly), so yeah, 5-star review given by me!",5.0
Perfect,5.0
Great for playing on custom online servers!,5.0
Great,5.0
"Wonderful, I love it.",5.0
Very good game with good graphics especially considering the system is a handheld console.,5.0
"I did not purchase this console from Amazon.com, but I have a Playstation 2 (Phat). If you are purchasing a Playstation 2 for gaming only, I would recommend the slim version. However if you are looking to mod, or play games off a hard drive, then this is the console for you. My Playstation 2 has FreeMCBoot (soft mod only), and I run my games off the HDD. PM me if you are interested in modding this console, I will help as much as I can.",5.0
Love this game use to have a copy but it broke so i bought another one,5.0
i like it,5.0
"I like this gamepad a lot.  It's got a very solid feel.  I'm using it with emulator games on my pc, like snes, n64, etc.  Everything feels right on it, and installation was easy (just plugged it in).  It feels very similar to a Playstation 2 controller (and similar control layout) but feels thicker, and the ergonomics are better (the surface material has a very nice texture and seems to fight hand sweating).  Rumble feature works well if your game supports it.  Looks slick too.  I'd recommend it if you're looking for a good gamepad.",5.0
fun game,5.0
This might be the best game on PS4. I have always been an Uncharted fan but this one blows all the previous ones out of the water visually. The graphics are actually better than any game I have on my Xbox One.. I don't have enough good things to say about this game other than it is amazing and you should definetly get it if you like adventure / action games. I heard the ending is amazing and cant wait to get to that point! Great Job developers!!,5.0
Good game,5.0
"If there is one word to describe this game, it is: HUGE! I mean there is so much to do in this game. I've played for about 4 hours and I have only completed 2% of the game-it is that big!

On this fictional country: ""Panau"", there are tons of hidden objects, easter eggs, vehicles, buildings to destroy, and side missions which some complain about being too repetitive. But I mean really, what sandbox game have you ever played in which the side missions were not too repetitive? You could probably find only a few if at best for most of them are highly repetitive! inFamous was probably the most repetitive game I've ever played and the graphics were not even that great! But tons of people love that game-I was so bored by it after 2 days! The variability in missions are fine in Just Cause 2 and there are a number of approaches you can take upon successfully beating them.

As for the the storyline and cutscenes, they remind me of the days of yore when you had those cheesy PSOne movies where the people look side to side when talking! But you know what, this was a perfect sacrifice. To make a world this big without any loading problems, glitches, or even screen tearing-you gotta cut production on those cutscenes-it only makes sense to do so. And besides, I have only been enthralled by only a few video game story lines and Uncharted 1 & 2 are two of those. So usually in my opinion, cut scenes or video game story lines are pointless. I'm all about do and less talk! The actual in-game graphics are outstanding. Trust me-do a sky dive from 20,000ft at sunrise in the game and you will be blown away! There are such rich and full detail-its ridiculous! I mean, on a clear day you can see clearly into the bottom of the ocean! Yes! You can see fish, coral, sand ripples, sea shells, even underwater currents that sweep sand along!

The best part of this game would definitely be your trusty grappling hook attachment! I just love this! For those that have played it, it's not like ""Batman: Vengence"" for PS2 where you only have predetermined grappling points which I thought was kind of lame considering you were BATMAN! Anything that is a solid, you can attach to! Even the bottom floor of a lake! Coupled with the disposable and infinite stunt parachutes makes these great character accessories. It's also always great when you can tether the grappling hook to a moving enemy jeep onto the road and see it flip over with all it's passengers! Nice!

Now some people complain about the in game controls for vehicles and such. I'm not so sure why this is. For me, the controls were very easy to get used to! The cool thing (which I wish most games gave you the option!) is that you can select your trigger (R1 or R2, L1 or L2) preferences for weapon shooting. I prefer the R1 and L1. I never liked using R2 and L2 for shooting and I have always hated that change once PS3 came around. But again that's just me.

Anyway, one last great thing about this game and I am pretty certain that this is a PS3 exclusive, is that you can capture videos directly from the game and either upload to youtube or save as a video file on your PS3 hard drive. This comes in handy when you would like to document some easter egg locations for your friends or compare stunt manuevers/mission approaches.

This game is terrific! This game is so big/intense that I traded in 4 other games that I got bored with just to commit my time to do this one!

GET IT! GET IT NOW! ARRRGGHHHH!",5.0
"In many ways, Alan Wake reminds me of the old ""point and click"" adventure games I played on the computer as a kid. You are propelled through the game by a strong narrative, dialogue, characters, and pacing. Of course, though the game takes cues from the old school adventure games (as well as some TV shows, like ""Twin Peaks""), it wisely adopts modern control schemes, playing in the typical third person, over the shoulder style that has become very popular over the past two console generations. It is a very linear experience, but that's just the way I like my games- focused with the emphasis being on pacing, fun, and story. This game truly is the ""psychological suspense thriller"" that it claims to be!",5.0
"This is a story mode game. Similar to Heavy Rain in that regard. It's fun, it's creepy, and has great replay capabilities. Great graphics, very good story. Let the choices begin...",5.0
What a great system!.  the 4gb is not very much if you want to download anything.  use a flash drive or buy a dedicated hard drive.,5.0
"first of all, This game is not as easy as some might think. I just found the porthole to castle B, and spent 2 hours wondering around the castle and not getting anywhere! you almost definately need a guide to play this game. Still, this game has a classic Castlevania feel to it, almost like I'm playing castlevania 4 again, with the return of a belmont in the staring role, the dangling whip tactic, and the simple music, and the castlevania MUST: a clock tower. The music isn't so bad. you can even hear a familiar Bach motif in the ""entrance"" area. I also like the clock tower theme. Kind of has a frantic feel to it.
Also, if you make it to the end credits, the ""entrance"" theme is played remixed to Circle of the Moon Quality. It almost sounds like an actual orchestra playing it. a very nice reward for beating the game",5.0
"Perfect, fast delivery.",5.0
"So far this game is at the top of my list for this year. I love strategy games (especially turn-based) and RPGs and this one delivers. The best thing about this game is the combat. It has a decent storyline too, and an open world. It's sort of opposite to Final Fantasy 13 in those regards (not really, I'm being a little hard on FF13).

There are challenge encounters (red dots on the map that you have the option to do, usually with really good rewards) that are fun and make you rethink your strategies multiple times. You can grind up and have a little easier time on encounters but you can still get owned by a boss if you do it completely wrong, but there's usually some good hints on how to kill stuff based on the area and what people say. It has a small penalty for losing to an encounter (have to pay money to retry, or you can just reload if you just saved) so there's a reason to focus on winning in battles.",5.0
great game the zombies mode is neverending fun for my kids.,5.0
One of the best games I've purchased.  Item arrived as described.  No complaints.,5.0
"Halo notwithstanding, this has to be my favorite game for the Xbox 360. This game so freakin' awesome! It's certainly the most violent game on the 360 - definitely not for kids! But that's a bonus in my book. This game is built from the ground up for the hardcore gamer, for sure!

That said, I have to agree with most of the other reviewers here. I loved Ninja Gaiden Black, so I had high hopes for Ninja Gaiden 2. And while it is still a spectacular game, there are a few glaring flaws where it just comes up short. So lets get those out of the way first, shall we?

THE BAD THINGS:

1. A nonsensical story. I'm sorry, but none of the story really makes any darn sense. Especially when compared to the first game. All the story boils down to is just a flimsy excuse to string a bunch of unrelated levels together. So don't pay much attention to it. Also, I thought Ryu's whole family was dead. Was that not established in the first game? Again, you just gotta ignore this stuff and enjoy the game for what it is. The game is about ACTION. Forget everything else!

2. Too many bland environments. While enemies are lavishly detailed, the environments are often hit and miss. Some are quite beautiful. But then in the very next one you are walking down some drab hallway or cave that looks like something straight out of a PS1. Seems like the environments in NGB were a lot more detailed. They at least had a lot more thought put into them. There was a lot of climbing and 3D thinking involved. Not in this game.

3. Bad instructions. The manual is bare bones, which is fine. But I wish I had had some explanation of how to use Ninja Cinema at least. I finally figured out how to download some of the videos from the people on the leaderboard, but I still can't figure out how to upload videos. It always says, ""You are not ranked on this leaderboard"". What the heck does that mean? I AM ranked! I may be ranked 6,999 out of 7,000 but by God, I'm still ranked!

4. Slowdown. Yes, there is some slowdown, which I found surprising. This game pushes the Xbox to the limits it seems. That's all well and good until the action mounts up. In reality this rarely happens though. Just enough for you to notice it on occasion. After a while, you don't notice it at all.

5. Limited wall jumping. This is big for me. In NGB, one of the most important fighting techniques was wall jump attacks and spamming Flying Swallows. Not in this game. It seems they have tried to penalize players like me by taking almost all climbable surfaces away. It especially becomes noticeable in the Trial challenges and the boss battles. Like it or not, you're pretty much ground-bound.

6. No story in mission mode. Mission mode is great, but it is Xbox Live DLC, so you'll have to buy it separately. I didn't mind that at all, and it is definitely worth the money. But while Mission Mode from NGB contained a complete mini-story toward the end, you won't find anything like that here. It's fairly bare-bones.

7. Glitches. My game froze two or three times. No big deal, but still annoying. Especially once when it was right at the end of finishing a level, and I had to do it over again. What a bummer.

8. Way too linear. Unlike NGB, NG2 has virtually no exploration. That game had more open levels and lots of places where you had to think in three dimensions. Here, you're just level grinding from one hallway to the next. And while taking all the thought out of it does let you just concentrate on the fighting, it's still kind of annoying. You would think game developers would be better at this by now.

9. No unlockables. This is a big one for me. The Xbox Ninja Gaiden included all 3 NES games as unlockables. NGB included the Arcade game. This game has got NOTHING. That is totally inexcuseable! Expecially considering how cheap and easy it is to incorporate that old source code. Maybe this is because the game was produced through Microsoft, not Techmo. I don't know why, but whatever the reason, it leaves me feeling irritated. This game should have had SOMETHING, dang it! IMO, it should have had all four!

10. DLC Skins. What the heck? In NGB, skins were an unlockable reward for being an awesome player. But now you have to pay for them through Xbox Live! How annoying is that? It just further underscores the ""no unlockables"" problem.

11. Too much boobage. Yeah, yeah... I know a lot of guys will disagree with me here. But I've gotta say, I honestly do NOT like seeing every female in these games depicted with double-D size breasts! There. I said it. The giant cleavage is distracting. It's annoying. And frankly, it's demeaning to women. A real woman - one who was capable of the gymnastics that the female heroines do in these games - would likely have so little body fat that she would have hardly any breasts at all. I know, I know... this is only a game. We're not trying to be realistic here. But is it really necessary for game developers to treat all women like nothing more than sex objects? I just can't stand how Team Ninja does this, and they do it in all their games. (Get real, guys! Stop treating your game audience like we're all super-horny teenage boys.)

THE GOOD THINGS:

1. Cool villains. I liked the enemies in this game. They were varied, and all pretty fun to play against. Yeah, some were cheap. But what would a NG game be without enemies taking cheap shots?

2. More blood and increased carnage. It ain't rated ""M"" for nothing, baby! This game is VIOLENT. A LOT more violent than the first one. Blood spews and sprays, body parts fly, and heads roll. Definitely not a game you want to buy for your 8 year old nephew. It's tons of fun, though :)

3. Obliteration techniques. You've still got Ultimate techniques, which look cool as ever. But now you also have the finishing moves, called Obliteration techniques. These are easy and fun to pull off, and sweet to watch.

5. Interesting new weapons. I liked most of the new weapons. It has some really neat ones, like the Kusuri-gama, which is chain-and-sickle affair. And the Eclipse Sycthe, which is somewhat similar in execution to the Dark Dragon Blade, or the Unlabored Flawlessness. (That weapon rules. Once you find it, you pretty much have no need to use any other weapon ever again.) Some weapons from NGB are missing and some make a return, like the Lunar Staff. I did miss the Nunchucks, but the Tonfa make up for that somewhat.

6. Awesome new Ninpo. I disagree with others here who say that the new Ninpo is worthless. I think they are all pretty neat, and awesome to use. I found each one suited to specific situations, and used them all. Art of the Inferno is still a fave, of course. But Art of the Piercing Void has its uses too. Also, the new screen effects for Ninpo use are beautiful - they are a VERY nice addition! The ninpo has to aimed now, but so what? If anything, that at least adds a LITTLE skill to it :)

7. A long game. It is not short, so you do get your money's worth.

8. A good camera. Unlike others, I have no complaints about the camera. It usually put me where I wanted to be. Only tricky part was on the rope climbs, but no biggie.

9. Mission Mode. This is super-fun and well-worth its price as Xbox Live Downloadable Content. It includes 24 missions. Of those, 16 are ""Karma Attack"" missions and 8 are ""Survival"" missions. All are super-hard and challenging. In Survival, you are given a unique weapon with which to face unending waves of enemies, with your goal to rack up enough karma before dying to get the medals. There is 500,000 for Steel, 1,000,000 for Bronze, 1,500,000 for Gold, and finally, the Ultra-HARD-to-get 2,000,000 karma for Gold! It is a TON of fun, if you enjoy that kind of thing.

10. Leaderboards. It's fun to see where you rank with your friends on the leaderboards. It is quite astonishing to see how much karma some of the top players have. Those guys must play the game 16 hours a day, every day.

11. Ninja cinema. This too was a nice addition, once you figure it out. It allows you to record clips of yourself. It is best used during boss fights or during Mission Mode, where you can replay your victory afterwards to feel that rush again (only a little more relaxed this time!). It is fun to watch yourself play, and enjoy seeing how awesome a player you are :) The classic cinema filter was nice, too.

12. Xbox Live Achievements. These are always fun, no matter what game. And NG2's do not disappoint.

13. Bone-crushingly difficult. This could be good or bad, depending on your point of view. I thought the first half of the game was super-easy. But then the difficultly level suddenly ratcheted up to unbelievable proportions. Toward the end of the game, I honestly felt like throwing in the towel. I mean, all the never-ending multiple boss fights with no save stations start wearing on your nerves after a while. And when you are dying OVER and OVER, it gets a little disheartening sometimes. But I hung in there. And with the help of youtube, I made it through. Now I've walked the Way of the Warrior, and beaten all the Missions too! ""Yeah, that's nothing,"" some of you may say. Well, you are better than I then, my friend! This game is HARD. I mean, punch you in the stomach and knock you out HARD!

THE CONCLUSION:

The game does have a few flaws. Some parts feel a little rushed, like they could have worked on some stuff more but they just ran out of time. But the fighting is polished.

And really, I just can't talk about this game without comparing it to Ninja Gaiden Black. Ninja Gaiden Black was perfection. This game is not. Great, yes. But just a little shy of perfection. Of course, If you've never played Ninja Gaiden Black, then maybe you won't even notice. Or care. In any case, I give it 4.75 stars out of 5.

It is worth buying, definitely worth playing. Nothing can quite match the awesomeness you feel when you charge up Ryu and watch him go apes--- on everyone. Will there be a Ninja Gaiden 3? I sure hope so!

Remember, Honor the Way of the Ninja!
And Peace out, Ninja dogs! Word.
-TCG",5.0
"Originally, I was suppose to order a different game...I kept it because my granddaughter loved it.",5.0
Excellent product and transaction...Thanks!!!,5.0
"product arrived on time and are very good, a responsible person is recommended.",5.0
"One of the best zelda games made.

Tied for First place:

1. Ocarina of Time
2. A link to the past",5.0
Its all good,5.0
"For a game of its age, it has a lot of replay value. The graphics are colorful and the music is famous for its catchy and well produced sound. Using the expensive MMC5 mapper (a special nintendo game board that makes the NES more powerful), things like vertical scrolling and improved sound make it stand out compared to other NES games. The challenge curve is perfect, with enemies doing double damage once you actually make it to Dracula's castle. There are three assistants that can help as well, and they each offer something that will help make certain problematic areas or bosses easier to bear.

Also, here is some information that fans of the series and newcomers might want to take note of for Castlevania III:

-Since it uses the special MMC5 mapper, this game has problems running on portable or ""retroconsole"" remade systems. And even if it does run, there might be graphical or sound issues. So your best bet is to get a hold of an actual NES.
-There are a lot of differences between this version of the game and the japanese version akumajo densetsu. For example in the dracula stages the damage is never doubled and the final boss is easier. Additionally the help character grant was changed substantially for this version, arguably making him much less useful since in akumajo densetsu he had infinite daggers to throw but no melee attack. More importantly the sound of the entire game is different (which one is better is up to opinion, look it up on youtube if you want to hear the differnce). Unfortunately it is a pain to get the Japanese version working as it was intended, since if you get pin converter and play the game on your NES you will be missing the special sound. The only way to get it running properly on actual hardware is to have a Famicom or to open up and mod your NES.

Regardless of all the complications, both versions are a lot of fun and I personally enjoy the North American copy more. But if you are a die-hard Castlevania fan or really enjoy the game, there is more to be had.",5.0
This item is great my son had a few of his games that had broken but the disk was still great so with these we were able to fix them so he could still play them.,5.0
Great item thanks,5.0
"After WWF No Mercy, WWF Royal Rumble is second I still play this game its just got magic for me",5.0
Bought for son he said he loves it,5.0
Mightbe the best game on ps4 unlike all the other cash grabbers out there ..... 5 star fun,5.0
It just about fits my waist and I am able to get five stars as I do my exercise/ dance routines,5.0
Great advertising,5.0
Love Borderlands!,5.0
