reviewText,overall
"Excellent game, literally twice as long as the original Mario Galaxy.",5.0
The control is a manufacture copy of the control provided with the console at purchase. It worded flawlessly with not issues. I did not experience or see any defects on the product.,5.0
"fun to play in bursts. Great for when you only have a few minutes to play.

It's not deep, but it's fun!",5.0
love this game!,5.0
"First of all, I'll simply say that I love this game.  It's not perfect...with the exception of maybe Chrono Trigger and Super Metroid and A Link To The Past, no game I've played is what I could call perfect; but it's a very good game.  However, I notice all these new Skyrim games coming out for PS4, and now Switch...I for one would like to see an updated Oblivion game, maybe with updated graphics, etc.  Personally, as nice as Skyrim was, I think Oblivion was a better, and more in depth game.  All the guild quests in Oblivion seemed to be a bit deeper, and the main story in Oblivion seemed to have a bit more depth.  Not knocking Skyrim...just saying that Oblivion was an AWESOME game, a game many feel was better than Skyrim.  With all these remakes for newer systems...I like to see them put out an updated Oblivion game.  Furthermore, I'd love to see a new Morrowind game...not the new Online game...but a remake of the old Xbox Morrowind.  Pretty sure I'm not the only one who'd love to see a remake of those classics.",5.0
"My favorite Wii game! So incredibly fun. The boxing workouts are sort of Guitar Hero-like in that the fists come down from the top of the screen and in keeping in rhythm with the music, you have to punch when the fist reaches the proper spot. Look for videos on You Tube if that does not make sense. There are other elements to this workout as well that are just so much fun. It's an oldie for a dated system now but still ranks as my favorite fun workout. I even bought an extra copy to have in case my disk ever breaks/malfunctions and I can't find a replacement.",5.0
"""Leisure Suit Larry: Magna Cum Laude"" is the first LSL game in about 8 years, and also the first to cross over from the personal computer to home video game platforms on the Playstation 2 & XBox. As a fan of old Sierra games (even though I was too young to have played the early LSL games), I was incredibly pleased to see the series resurrected and brought to new heights!

Important note: ""Magna Cum Laude: Uncut & Uncensored"" has now been released for the PC, and it features full frontal nudity and none of the pesky ""censorship bars"" that are present in this version.

Obviously, nudity is the main selling point of this game. Anyone who says otherwise is trying too hard to justify his or her purchase. The college co-eds are voluptuous, they are animated in a sexy, often provocative, ways, and the main quest of the game is to get Larry laid. Because of the time and attention put into creating realistic (though cute in an almost-anime way), this game is more titilating than any of the ""Dead or Alive"" series of fighting games, more fun than any of the WWE wrestling video games that feature the strip matches, and the females are more desirable than Lara Croft ever has been.

The women are mostly stereotypical ""college girls"" -- we have the head cheerleader Barbara Jo Bimbo (B.J. for short), the Italian castoff from ""The Sopranos"" Analisa, the Russian exchange student Zanna, the hot but nerdy college professor Beatrice, and so on. Chasing after each woman requires different approaches, and the result is never the same twice. And no, Larry *does not* get with all these babes. I hate to spoil it for you, but he only has actual intercourse a few times during the entire game. But every encounter is sexy, funny, and most importantly, packed full of eye candy!

The gameplay is fun. It is not very involving and has been criticized for being mostly a string of ""mini-games."" That is true; however, the variety of the games keeps it interesting as you progress through the storyline. The script is absolutely hilarious, and the comedy is equal to the nudity as a selling point for this game. If you are a guy, or even a gal who likes to laugh at guys, you will laugh at Larry and the things coming out of his mouth. He rambles on a lot, gets off-topic, tries horrible pickup lines, lies constantly, and even staggers around drunk and farts. If you've ever known a man who made you laugh simply because he was, to quote Steve Martin, ""a wild and crazy guy,"" then you will enjoy the story of Magna Cum Laude. And the voice acting is wonderful; there is not a bad actor or actress in this entire game.

Now a few words on the Mature Audiences rating: This game is about sex, (...) drinking, jokes, and other things guys find enjoyable. For some people, this is disturbing. Those people need to get a life. I can play Grand Theft Auto, in which my character is able to walk down any street and at any moment cut off the head of a pedestrian with a sword. Or gun down dozens of policemen, only to enter a cheat code and get away with it all at the last possible minute. Yet somehow, the ESRB (game ratings board) finds Larry's girlfriends more offensive when they drop their shorts. Give us a break! Violence is much more detrimental to society & to teenagers than sex is, and yet we still can't get over our fear of pixelated private parts. It's ridiculous!

All in all, I give ""LSL: Magna Cum Laude"" a totally positive recommendation to anyone old enough to purchase it. It was definitely one of the best games of 2004 simply because it is like nothing else on the market today: a fun, sexy romp through college life. 5 stars! 2 thumbs up! Just buy it!",5.0
"E3 2004 came and went and AstroBoy Omega Factor was there and waiting. It played like a classic space shooter with power ups and loads of enemies to blow away. The game looks very sweet on the GBA hardware and is being developed by Treasure, the same guys that did Ikaruga and Gunstar Heroes, and the coming soon: Guardian Heroes for GBA. The hype starts here for this soon to be classic.",5.0
"StarFox Assault is quite simply the most (as in #1) action packed game on Game Cube and I have played and beaten many action packed games on Game Cube like Resident Evil 4, TimeSplitters Future Perfect, and Medal of Honor European Assault.  All of the above games have also achieved greatness.  StarFox Assault has three levels of difficulty:  Bronze, Silver, or Gold.  The single-player game does not last only three hours like so many reviews may suggest.  The single-player game lasts more like 10 hours on one difficulty.  Those of you who have beaten the game on Bronze have not beaten the game on Silver or Gold.  And if you beat it on Gold, then you can choose the option of Gold Survival, in which you have no continues or ability to save the game.  Basically, you have to beat the whole game without losing Fox's last life.  The graphics, sound, and environments are nothing short of spectacular with absolutely no slowdown in framerate at all.  True, while the Landmaster missions are a bit slower than the Arwing missions, they often require more strategy than the Arwing missions.  The ground missions by foot are excellent because you have the most diversity in choice of weapons to use during these missions.  I especially like the sniper levels.  True, Fox can run quite fast and leap really high without a humanly sense of physics, but he is a Fox and he needs to jump that high to get the job done.  If that is the only gripe one can find with the game, then that is ridiculous because nearly every game lacks physics in some respect or another.  Some of those ground missions get really hectic on Gold and are a lot of fun.  Other complaints about StarFox Assault that critics have given are that your allies are useless, while this opinion is not true, your allies frequently do need your help.  It is an intentionally installed part of the game.  Appreciate its brilliance.  The intent is to give you an extra objective to pass in a given amount of time while you are being swarmed by attackers.  These events of your allies needing your help arrive at believable times when swarms of attackers are around.  It makes things much more challenging for the experienced gamer and those that enjoy challenges because you are being attacked while you are trying to save your allies.  Ultimately, you need to be able to eliminate attackers and save your allies at the same time, which is not an easy task.  It takes quick reflexes to do so.  The game also has pretty good multiplayer options, but they are somewhat of an afterthought after the single-player game is finished.  However, this game has much replayability in trying to beat your high scores and collect all the red flags during Arwing missions.  StarFox Assault is definitely a game to own if you own a Game Cube and is my favorite game on Game Cube.",5.0
The 1st Gears of War was great and all this one did was improve on it. Loved the survival mode. It got wicked hard and kept me and my friend playing for a long time. It kept us on the edge while trying to take out the massive enemies. The story line was excellent too. The story was deep and kept suprising moments all throughout the game. I Highly recommend it to anyone who loves shooters. One of my top XBOX 360 games. The only downfall is that they didn't bring back the creatures that attacked you in the night. The missions for them last time were innovative. I feel they could have done so much more with them. But the new weapons made up for it.,5.0
"First Off I've Read Lot Of The Reviews For This Game And I Gotta Say, Stop Hating! You Guys Have Lost Your Minds. The First Suffering Game Is Amazing. It's Unique, And Has An Awesome Story Line. That Was The Introduction To The Madness, The Introduction Of Torque. This Game In My Opinion Is A Really Good Sequel. Yes I Have Seen It Skip A Few Times But (Seriously What Video Game Doesn't Freeze? They All Do) The Weapons Are Awesome, Details And Graphics Are Good. Also It's Very Gory. So Do Your Self A Favor And Pick This Game Up. It's A Fun One. It's Messed Up Though lol. Get It You Won't Be Disappointed :)",5.0
slice up zombies oh hell yes,5.0
"I just got a Wii and was searching around for cheap Gamecube games that I could plan on it and found this title.

This is one of the funnest games I've played in a long time.

The 2D to ""3D"" switch when Joe transforms is really amazing.

They put some serious thought into this game.

It's like I've been transported into a cool 80s cartoon or something.

I don't see how anybody could not love Viewtiful Joe!",5.0
"To begin, I should say that watching the movie before you play the game will make it much more fun.  Unlike most games based off of movies, this game is a prequel to the movie.  It takes place three months before the beginning of the movie and you learn how the Warriors began and see the characters from the movie evolve.  It's an ingenius idea and the game is terrific.

The graphics are great, the sound is great, the plot of each mission is great.  It has the feel from the movie, too.  The music comes straight from the movie score and dark feel, the movie carried, continues in this game.  Playing, you get an opportunity to look into the background of the Warriors and the other gangs introduced in the movie.  It's outstanding.

In all honesty, I have so much good to say about this game, I'm having trouble keeping my thoughts in order.  All I can say is play it, and if you haven't seen the movie, rent the movie then play the game.  I'm telling you, you won't be dissapointed.",5.0
Amazing storyline and graphics. I'm still playing this and looking forward to the next few games from these guys... Massive.,5.0
"My XBOX One Day One controller began drifting, so I pulled the trigger on this one so I could differentiate my controllers. This on has not let me down, and it is now the the preferred controller of the three I have.",5.0
SO NICE !,5.0
LOVE THIS!!,5.0
"Of course you need to go online and load all the updates and mod patches. Once done, this is the very best flight sim ever created. It is NOT a game. It is a highly realistic flight sim. Worth far more than the cost you pay for it...",5.0
"Conflict Desert Storm is a great game. Its Grafics are better than most games. Theres a lot of weapons to choose from. Theres The

M-16, Bust fire, single shot and granade

AK-47, Fully Automatic and single shot

M-60, Fully automatic and single shot

Combat Knife

M-18 Smoke Granade

granade

C-4 plastic explosive

Tank Mine

Combat ShotGun

And a lot more. Buy Conflict Desert Storm.",5.0
Excelente,5.0
I got this game because I heard something about it on a game show called xplay.  It was only $19.99.  I got it home and started playing it and I looked and an hour had gone by.  The game is very fun to play and once you start time will go by and you won't even know it.  I got a ds lite and my mother and I have played and she loves it as much as I do.  It is wifi and only 1 game is required so if you get it you can play against your friends or family even if they do not have the game.  For the price and the fun this game if surely worth the purchase.,5.0
memory card works great. i started going old school with the nintendo 64 and this helps with playing games.,5.0
"the vita is not exactly capable of matching the graphics of the PS3, or the soon to release PS4. as a handheld, it never would have and never will.
that being said, this is a BEAUTIFUL vita game. it almost rivals Dragon's crown in the looks department.
in mercenaries, you play a merc participating in the events in Killzone 1 and 2. with the fighting taking part on vekta and Helghan, and with you accepting contracts from both the ISA and the Helghast army, as the fighting becomes hotter and more brutal. this game also shows that there is no ""good guy"" in this fight as you see, or hear of brutality committed by both sides. you receive new weapons not by picking them up, but by buying them from blackjack the arms dealer with money earned from looting ammo, completing contracts, and not dying.

-contracts is another word for story mode chapter as you switch sides because the story says so.
-no bots mode for multiplayer (word is it will happen via patch)
-the difficulty on easy is a bit too hard.

+Beautiful game, crafted with the same engine used in making Killzone 2
+each gun acts and sounds unique, with there own individual stats.
+full use of the twin stick controls, touch screen, and shoulder buttons, and they are remarkably responsive.

All and all, this is a MUST have for fans of FPS, killzone, or action gaming in general. it is an essential part of the Vita library.
Buy it if you can find it",5.0
The item arrived on time and the quality of product is good. No any problem can be found. Fantastic seller.,5.0
work great help me shoot better and have alot more control while playing basicly any game i would buy more if needed.,5.0
The twins have to be pried away from this game and I am surprised with the many other games they have between them. Totally interactive. My wife and I even got coaxed into playing for a while ....,5.0
Excelente producto,5.0
I play against computer but I wonder how much fun I am missing playing it by myself.,5.0
great price  fast delivery,5.0
"Excellent game that won't break the bank. I'm excited about this game purchase because it is in nearly new condition with a flawless game disk, like new case, and premium artwork liner. I purchased this game and Rainbow Six: Siege from Amazon Warehouse deals for less money and received top notch quality. The game manual can be downloaded as it states on inside of the game liner. Absolutely fantastic! Thanks again Amazon!",5.0
"My son says this mouse is good, he plays fortnight, he had a death adder a mamba a razor, just to mention a few and says this one is close in quality, he likes the buttons on the top, he says it shifts smooth and has decent DPI for the price",5.0
Nice,5.0
Works great,5.0
These are great for protecting your ps4 cantrolers from ware and tear.,5.0
"Arrived on time and works great, now I have the whole set and see how the series originally began",5.0
What an amazing accomplishment!! I have only been at this for 12 hours give or take but this game has certainly met my expectations!  This game is not for everyone.  This not some action packed space shooter but rather a game centered around exploration and discovery.  Do I feel that this could be so much more? Sure I do!  Wouldn't it be amazing to be able to build settlements and interact (trade / fight) with other players? I believe so.  With that being said I love this game! The graphics are stunning and the gameplay is fun and relaxing.  While not for everyone I would certainly recommend it to those looking to embark on an epic quest to the stars.,5.0
Great game and vrry ballanced from the beggining. I love fire emblem series,5.0
"This game will hook you up to your PC for days, months and years to come.
this game is so awesome, it is like the benchmark of all FPS online mutiplayer genre.

It is that awesome.",5.0
Uniquely fun.,5.0
"excellent item, very good quality",5.0
"It seems that Buffalo Technology is the ONLY brand that makes quality USB NES and SNES controllers. I bought one set of the Super Famicom controllers and one set of the Famicom controllers. Both are absolutely fantastic products! I should have turned to the Japanese from the start when I needed USB controllers. All the Chinese junk I bought and returned was a big disappointment and a waste of time.

So enough complaining. How do these controllers compare to real SNES controllers? They compare very well. I have two lightly used SNES controllers and 4 decently used SNES controllers plus one heavily used controller. The A, B, X, Y, L,R, Start and Select buttons feel just like the buttons on my real SNES controllers ( the lightly used controllers I have). They have a click to them when you press down but its not a cheap stiff click. Its that familiar smooth click that feels just right.

The D-Pad on these controllers does have a different feel compared to the real SNES controllers. First the D-Pad sits higher, second it has a longer travel and third it feels slightly tactile, but not stiff. Even with those differences it doesn't affect gameplay what so ever. I'm able to control every game I've played so far with no issues at all. The D-Pads on these Buffalo SNES and NES controllers actually work! I can't say the same about the junk USB controllers I bought before these.

The Turbo Features on these controllers come in handy and do what they are supposed to do. Just pause the game ( so you don't die), hold down the turbo button and then simply press whatever button you need to have the turbo function. To clear just hold down the clear button and press the button you programmed to have the turbo function.

Overall I can't recommend these controllers enough. I was actually smiling the whole time I was using my emulator. It feels good using a quality peace of hardware.

I would really like for Buffalo Technology to make controllers for my NES, SNES, N64 and Sega Genesis consoles. Its getting hard to find good original controllers for the older consoles. If Buffalo Technology can make USB controllers this good, then I know they can make reproduction controllers for my old video game consoles.

One more thing Buffalo tech should also consider making a USB six button Sega Genesis controller. The larger six button controller not the smaller version.",5.0
Good buy,5.0
"Great gift, my boyfriend collects all these video games, movies, etc.",5.0
Fun game as long as one does not compare to AAA titles. Neat combat and puzzles. Pretty good overall.,5.0
a friend told me this is a game she played on another game system and she was happy that they made it for wii and that it has a lot of replay value that's good,5.0
Very good sequel to the first game. You get to play as the first Big Daddy. Arrived on time. Great game.,5.0
"So, one day, I just got the craving for some nostalgia. I decided to buy a Pokemon game (Heartgold), but I needed a system to play it on, so I bought the Nintendo DS Lite, since it also lets you play SP games, I bought it used (Very Good) for about $60 bucks and when it came I turned it on, and it worked great. It feels better than the Nintendo SP and the two screens really ads something new, I'm glad I bought this. I recommend this to anyone.",5.0
Great quality. Works very well and versatile. Better than all the junk on-line for just a couple $ more. Works as advertised.,5.0
Cliff n Vinnie luv,5.0
"Okay, the word Disney on the cover scared a lot of people, we all know it's history with kiddy games.  However, this mesmerizing team-up with Squaresoft has produced an amazing Action/RPG title.
The characters, Disney and Square alike, come together to perform a striking drama, humorous at times, that tells the story of a young man and his will to live and protect those who he cares about.
The gameplay is surprisingly fast-paced and challenging at times, making it very, very addicting.  This is one of those rare gems that you can sit down and play for 4 hours straight, wondering where the time went afterwards.
Truly a memorable experience, for Final Fantasy fans, or fans of the genre.  With a sequel in the works already, Kingdom Hearts is a game that you should definitely buy.",5.0
"Great level design and characters. Addictive gameplay. Captures the dream esthetic they were going for.

Just buy it if you like unique games.",5.0
"Ran beautifully and was a nice game. I just wish the ending was more detailed and also would have liked to see a little more info about one of the patients in the game they mention, but you can't see them or anything. Nice graphics and story line, just wished was a little more detailed and maybe a little longer. I liked that there were voice actors in the game, instead of just words where you got read all the time what people are saying.",5.0
"Not sure what I can add apart from what's already been reviewed, but Horizon Zero Dawn deserves every bit of praise and hype that's been published.  If you haven't purchased it yet, I would certainly give it my moneys' consideration!",5.0
Did exactly what it was supposed to. Saved an amazing number of games for my kids.,5.0
good,5.0
All i have to say is this game is much better then da one on PS2!!,5.0
Love this thing now only they could make a mouse that gose with it.,5.0
"okay well it is the best wild west you can get and more the game had a bug 45 min in but hay bugs are bugs you can't get all bugs in one go so yea the game is very much just like the wild west the guns are very fun to play with the wild life is AWESOME you go up to BEARCLAW CAMP and you get like 10 bears come at you over and over so before you go make sure you have a very powerful weapon and if you are looking for fun with bears up there in the camp shot them in the side or on there butt you'll see a lot of very awesome views when you look across the RIVER yea the online is very addicting and you can loose track of time playing this game well all in all this game really is GOTY kinda game this game had some poor reviews witch who ever gave this game a 3 star rating lighten up would you jesus its a fun game you can't get this awesome of a game from any other game creator just like that CALL OF JUREZ this game beats that hands down no matter what if its in 720p or 1080p com'on this is ROCKSTAR the BEST creator in the wild west games. my review is very good this gang hide outs isn't hard or any of the game is hard i,v took on 40 bad guys by my self and yea i won the challenge so leveling up is VERY EASY.",5.0
Love it,5.0
great price thanks amazon warehouse,5.0
excelent,5.0
"This game is fun, fun, fun!!! The graphics are nice, the sound is nice, the adventure is nice and my wife finaly playing video games, is very nice. She hates all my other titles but she loves this and my son gazes at the amazeing wide virety of worlds. No loading time is very nice. There is absolutely nothing you can say to deprive this game of it's well disorved hype. I suggest to you, if you have a family and just plain love playing adventure games, this is a must buy! 5 STARS BAY-BE!!!!",5.0
This winter on those cold snowy evening he will be able to keep busy and will be able to share with his friends.,5.0
"I have been playing this game since 10 or 11 years old, I'm 36 now. This is the game that started it all. Totally addicting gameplay, great control, and the difficulty is very high. Some people just can't beat this game, I can. But I have huge respect for gamers who have beatin "" Ghosts In Goblins"", I just can't. This has Some of the greatest music that'll grace a NES game.
Get this classic while it's HOT"".
Graphics - 10/10
Control - 10/10
Music - 10/10
Difficulty - 10/10
Overall Gameplay - 10/10",5.0
Great,5.0
Love it!,5.0
Very good!!! Excellent time of arrival.,5.0
Quick shipping and as described!,5.0
Lindsay loves it,5.0
"Works perfect. Kids love it, I love it.",5.0
Just as I expected,5.0
good,5.0
"If you thought Fifa soccer 13 was awesome this game here is a better and more difficult version to play, The delivery was well it came in a day and I was on my way to greatness playing matches and leveling up against my friends.",5.0
beat it the first day!,5.0
"Great game that is much harder than the original. It provides hours of game play. I did walkthrough videos on YouTube, so in case if you are stuck in a mission and can't figure it out, search for ""Mr. Math Expert Red Alert The Aftermath."" You don't need to buy the game; it's officially free, so search for it using the words ""Command and Conquer The Aftermath abandonware."" All in all, lots of fun.",5.0
